CPU: ID 0x306a9, Processor Type 0x0, Family 0x6, Model 0x3a, Stepping 0x9
Northbridge: 8086:0150 (3rd generation (Ivy Bridge family) Core Processor (Desktop))
Southbridge: 8086:1c4a (H67)

============= GPIOS =============

GPIOBASE = 0x0480 (IO)

gpiobase+0x0000: 0xb97ba1c3 (GPIO_USE_SEL)
gpiobase+0x0000: 0xb96ba1ff (GPIO_USE_SEL) DEFAULT
gpiobase+0x0000: 0x0010003c (GPIO_USE_SEL) DIFF
gpiobase+0x0004: 0x8eef6ec3 (GP_IO_SEL)
gpiobase+0x0004: 0xf6ff6eff (GP_IO_SEL) DEFAULT
gpiobase+0x0004: 0x7810003c (GP_IO_SEL) DIFF
gpiobase+0x0008: 0x00000000 (RESERVED)
gpiobase+0x000c: 0xe0da7ebf (GP_LVL)
gpiobase+0x000c: 0x02fe0100 (GP_LVL) DEFAULT
gpiobase+0x000c: 0xe2247fbf (GP_LVL) DIFF
gpiobase+0x0010: 0x00000000 (RESERVED)
gpiobase+0x0014: 0x00000000 (RESERVED)
gpiobase+0x0018: 0x00000000 (GPO_BLINK)
gpiobase+0x0018: 0x00040000 (GPO_BLINK) DEFAULT
gpiobase+0x0018: 0x00040000 (GPO_BLINK) DIFF
gpiobase+0x001c: 0x00000000 (GP_SER_BLINK)
gpiobase+0x0020: 0x00080000 (GP_SB_CMDSTS)
gpiobase+0x0024: 0x00000000 (GP_SB_DATA)
gpiobase+0x0028: 0x0000     (GPI_NMI_EN)
gpiobase+0x002a: 0x0000     (GPI_NMI_STS)
gpiobase+0x002c: 0x00002000 (GPI_INV)
gpiobase+0x002c: 0x00000000 (GPI_INV) DEFAULT
gpiobase+0x002c: 0x00002000 (GPI_INV) DIFF
gpiobase+0x0030: 0x020300fb (GPIO_USE_SEL2)
gpiobase+0x0030: 0x020300ff (GPIO_USE_SEL2) DEFAULT
gpiobase+0x0030: 0x00000004 (GPIO_USE_SEL2) DIFF
gpiobase+0x0034: 0x1f57fff0 (GP_IO_SEL2)
gpiobase+0x0034: 0x1f57fff4 (GP_IO_SEL2) DEFAULT
gpiobase+0x0034: 0x00000004 (GP_IO_SEL2) DIFF
gpiobase+0x0038: 0xfcfe0f05 (GP_LVL2)
gpiobase+0x0038: 0xa4aa0007 (GP_LVL2) DEFAULT
gpiobase+0x0038: 0x58540f02 (GP_LVL2) DIFF
gpiobase+0x003c: 0x00000000 (RESERVED)
gpiobase+0x0040: 0x00000130 (GPIO_USE_SEL3)
gpiobase+0x0044: 0x00000ff0 (GP_IO_SEL3)
gpiobase+0x0048: 0x00000d3f (GP_LVL3)
gpiobase+0x0048: 0x000000c0 (GP_LVL3) DEFAULT
gpiobase+0x0048: 0x00000dff (GP_LVL3) DIFF
gpiobase+0x004c: 0x00000000 (RESERVED)
gpiobase+0x0050: 0x00000000 (RESERVED)
gpiobase+0x0054: 0x00000000 (RESERVED)
gpiobase+0x0058: 0x00000000 (RESERVED)
gpiobase+0x005c: 0x00000000 (RESERVED)
gpiobase+0x0060: 0x00000000 (GP_RST_SEL1)
gpiobase+0x0060: 0x01000000 (GP_RST_SEL1) DEFAULT
gpiobase+0x0060: 0x01000000 (GP_RST_SEL1) DIFF
gpiobase+0x0064: 0x00000000 (GP_RST_SEL2)
gpiobase+0x0068: 0x00000000 (GP_RST_SEL3)
gpiobase+0x006c: 0x00000000 (RESERVED)
gpiobase+0x0070: 0x00000000 (RESERVED)
gpiobase+0x0074: 0x00000000 (RESERVED)
gpiobase+0x0078: 0x00000000 (RESERVED)
gpiobase+0x007c: 0x00000000 (RESERVED)



============= RCBA ==============

RCBA = 0xfed1c000 (MEM)

0x0050: 0x812a0654
0x0054: 0x00000789
0x0400: 0x00000d03
0x0404: 0xfed0ba9c
0x0800: 0x20100808
0x0804: 0x01000404
0x0808: 0x04210444
0x080c: 0x01110000
0x0810: 0x00660000
0x0818: 0x00170017
0x081c: 0x00000f0f
0x0820: 0xf7401111
0x0824: 0x11111111
0x0834: 0x0003303c
0x0838: 0x04124054
0x0900: 0x00004000
0x0988: 0x00400010
0x098c: 0x00440000
0x0990: 0x00002000
0x0994: 0x00006000
0x1000: 0x20100808
0x1004: 0x01000404
0x1008: 0x04210444
0x100c: 0x01110000
0x1010: 0x00007731
0x1020: 0x20100808
0x1024: 0x01000404
0x1028: 0x04210f11
0x102c: 0x04210000
0x1030: 0x00040010
0x1034: 0x0003303c
0x1038: 0x045a419a
0x1100: 0x00006000
0x1104: 0x00000400
0x1114: 0x00000005
0x1194: 0x00002000
0x1d48: 0x00030000
0x2014: 0x80000019
0x2020: 0x81000022
0x2030: 0x82000044
0x2040: 0x87000080
0x2088: 0x00109000
0x2094: 0x00002000
0x20ac: 0x40000000
0x21a4: 0x00012c42
0x21a8: 0x00420003
0x21b0: 0x0000000f
0x2230: 0x00010000
0x2234: 0x0000000f
0x2238: 0x00000941
0x2240: 0x00470a1a
0x2244: 0x00530a5a
0x2248: 0x003801c5
0x224c: 0x00660000
0x2250: 0x00720000
0x2254: 0x004906aa
0x2258: 0x0049049e
0x2260: 0x00410406
0x2268: 0x000c0028
0x2270: 0x000c0000
0x2274: 0x00100040
0x2278: 0x00bd0390
0x227c: 0x00c903b8
0x2280: 0x00af0000
0x2284: 0x00bb0000
0x2288: 0x00030321
0x228c: 0x00000001
0x2298: 0x000c0028
0x22a0: 0x000b0000
0x22a4: 0x00100040
0x2304: 0xc0388000
0x2308: 0x28000016
0x230c: 0x4abcb5bc
0x2310: 0xa809605b
0x2314: 0x0a2c0020
0x2318: 0x04b8f0a8
0x231c: 0x05de00a9
0x2320: 0x00008002
0x2324: 0x00854c74
0x2328: 0x00421731
0x2330: 0xea004000
0x2334: 0x00000084
0x2338: 0x00000600
0x2340: 0x003a001b
0x2344: 0xff0c000c
0x3020: 0xffffffff
0x3024: 0xffffffff
0x3028: 0xffffffff
0x302c: 0xffffffff
0x3030: 0xffffffff
0x3034: 0xffffffff
0x3038: 0xffffffff
0x303c: 0xffffffff
0x3040: 0xffffffff
0x3044: 0xffffffff
0x3048: 0xffffffff
0x304c: 0xffffffff
0x3050: 0xffffffff
0x3054: 0xffffffff
0x3058: 0xffffffff
0x305c: 0xffffffff
0x3060: 0xffffffff
0x3064: 0xffffffff
0x3068: 0xffffffff
0x306c: 0xffffffff
0x3070: 0xffffffff
0x3074: 0xffffffff
0x3078: 0xffffffff
0x307c: 0xffffffff
0x3080: 0xffffffff
0x3084: 0xffffffff
0x3088: 0xffffffff
0x308c: 0xffffffff
0x3090: 0xffffffff
0x3094: 0xffffffff
0x3098: 0xffffffff
0x309c: 0xffffffff
0x30a0: 0xffffffff
0x30a4: 0xffffffff
0x30a8: 0xffffffff
0x30ac: 0xffffffff
0x30b0: 0xffffffff
0x30b4: 0xffffffff
0x30b8: 0xffffffff
0x30bc: 0xffffffff
0x30c0: 0xffffffff
0x30c4: 0xffffffff
0x30c8: 0xffffffff
0x30cc: 0xffffffff
0x30d0: 0xffffffff
0x30d4: 0xffffffff
0x30d8: 0xffffffff
0x30dc: 0xffffffff
0x30e0: 0xffffffff
0x30e4: 0xffffffff
0x30e8: 0xffffffff
0x30ec: 0xffffffff
0x30f0: 0xffffffff
0x30f4: 0xffffffff
0x30f8: 0xffffffff
0x30fc: 0xffffffff
0x3100: 0x04302100
0x3108: 0x00000001
0x310c: 0x43214321
0x3110: 0x00000001
0x3114: 0x00000001
0x3118: 0x00000001
0x311c: 0x00000001
0x3124: 0x00000001
0x3128: 0x00000001
0x3140: 0x00001100
0x3144: 0x32100002
0x3148: 0x00000003
0x314c: 0x00000003
0x3150: 0x00000001
0x3154: 0x00003210
0x3160: 0x00000001
0x31fc: 0x01000000
0x3310: 0x03050100
0x3314: 0x0000000f
0x3318: 0x050f0000
0x331c: 0x80000000
0x3324: 0x04000000
0x3340: 0x000fffff
0x3344: 0x00000002
0x3360: 0x0001c000
0x3368: 0x00061100
0x3378: 0x7f8fdfff
0x337c: 0x000003fc
0x3388: 0x00001000
0x3390: 0x0001c000
0x33a0: 0x00000800
0x33b0: 0x00001000
0x33c0: 0x00093900
0x33cc: 0x24653002
0x33d0: 0x062108fe
0x33d4: 0x00670060
0x33d8: 0x07ffffff
0x33f0: 0x30002de4
0x3400: 0x00000004
0x3404: 0x00000080
0x3410: 0x00000c21
0x3418: 0x07ef0001
0x341c: 0xbfcf001f
0x3420: 0x00000080
0x3424: 0x00060010
0x3428: 0x00000007
0x3440: 0x80000000
0x3450: 0xfed04000
0x3458: 0xffffffff
0x345c: 0xffffffff
0x3460: 0xffffffff
0x3464: 0xffffffff
0x3468: 0xffffffff
0x346c: 0xffffffff
0x3470: 0xffffffff
0x3474: 0xffffffff
0x3478: 0xffffffff
0x347c: 0xffffffff
0x3480: 0xffffffff
0x3484: 0xffffffff
0x3488: 0xffffffff
0x348c: 0xffffffff
0x3490: 0xffffffff
0x3494: 0xffffffff
0x3498: 0xffffffff
0x349c: 0xffffffff
0x34a0: 0xffffffff
0x34a4: 0xffffffff
0x34a8: 0xffffffff
0x34ac: 0xffffffff
0x34b0: 0xffffffff
0x34b4: 0xffffffff
0x34b8: 0xffffffff
0x34bc: 0xffffffff
0x34c0: 0xffffffff
0x34c4: 0xffffffff
0x34c8: 0xffffffff
0x34cc: 0xffffffff
0x34d0: 0xffffffff
0x34d4: 0xffffffff
0x34d8: 0xffffffff
0x34dc: 0xffffffff
0x34e0: 0xffffffff
0x34e4: 0xffffffff
0x34e8: 0xffffffff
0x34ec: 0xffffffff
0x34f0: 0xffffffff
0x34f4: 0xffffffff
0x34f8: 0xffffffff
0x34fc: 0xffffffff
0x3500: 0x20000f57
0x3504: 0x20000f57
0x3508: 0x20000f57
0x350c: 0x20000f57
0x3510: 0x20000f57
0x3514: 0x20000f57
0x3518: 0x20000f57
0x351c: 0x20000f57
0x3520: 0x20000f57
0x3524: 0x20000f57
0x3528: 0x20000f57
0x352c: 0x20000f57
0x3530: 0x20000f57
0x3534: 0x20000f57
0x3560: 0x024c8001
0x3564: 0x000024a3
0x3568: 0x00040002
0x356c: 0x01000050
0x3570: 0x02000772
0x3574: 0x17000f83
0x3578: 0x1800ff4f
0x357c: 0x0001d630
0x35a0: 0xc0300c03
0x35a4: 0x00241803
0x35b0: 0x00000022
0x3600: 0xffffffff
0x3604: 0xffffffff
0x3608: 0xffffffff
0x360c: 0xffffffff
0x3610: 0xffffffff
0x3614: 0xffffffff
0x3618: 0xffffffff
0x361c: 0xffffffff
0x3620: 0xffffffff
0x3624: 0xffffffff
0x3628: 0xffffffff
0x362c: 0xffffffff
0x3630: 0xffffffff
0x3634: 0xffffffff
0x3638: 0xffffffff
0x363c: 0xffffffff
0x3640: 0xffffffff
0x3644: 0xffffffff
0x3648: 0xffffffff
0x364c: 0xffffffff
0x3650: 0xffffffff
0x3654: 0xffffffff
0x3658: 0xffffffff
0x365c: 0xffffffff
0x3660: 0xffffffff
0x3664: 0xffffffff
0x3668: 0xffffffff
0x366c: 0xffffffff
0x3670: 0xffffffff
0x3674: 0xffffffff
0x3678: 0xffffffff
0x367c: 0xffffffff
0x3680: 0xffffffff
0x3684: 0xffffffff
0x3688: 0xffffffff
0x368c: 0xffffffff
0x3690: 0xffffffff
0x3694: 0xffffffff
0x3698: 0xffffffff
0x369c: 0xffffffff
0x36a0: 0xffffffff
0x36a4: 0xffffffff
0x36a8: 0xffffffff
0x36ac: 0xffffffff
0x36b0: 0xffffffff
0x36b4: 0xffffffff
0x36b8: 0xffffffff
0x36bc: 0xffffffff
0x36c0: 0xffffffff
0x36c4: 0xffffffff
0x36c8: 0xffffffff
0x36cc: 0xffffffff
0x36d0: 0xffffffff
0x36d4: 0xffffffff
0x36d8: 0xffffffff
0x36dc: 0xffffffff
0x36e0: 0xffffffff
0x36e4: 0xffffffff
0x36e8: 0xffffffff
0x36ec: 0xffffffff
0x36f0: 0xffffffff
0x36f4: 0xffffffff
0x36f8: 0xffffffff
0x36fc: 0xffffffff
0x3700: 0xffffffff
0x3704: 0xffffffff
0x3708: 0xffffffff
0x370c: 0xffffffff
0x3710: 0xffffffff
0x3714: 0xffffffff
0x3718: 0xffffffff
0x371c: 0xffffffff
0x3720: 0xffffffff
0x3724: 0xffffffff
0x3728: 0xffffffff
0x372c: 0xffffffff
0x3730: 0xffffffff
0x3734: 0xffffffff
0x3738: 0xffffffff
0x373c: 0xffffffff
0x3740: 0xffffffff
0x3744: 0xffffffff
0x3748: 0xffffffff
0x374c: 0xffffffff
0x3750: 0xffffffff
0x3754: 0xffffffff
0x3758: 0xffffffff
0x375c: 0xffffffff
0x3760: 0xffffffff
0x3764: 0xffffffff
0x3768: 0xffffffff
0x376c: 0xffffffff
0x3770: 0xffffffff
0x3774: 0xffffffff
0x3778: 0xffffffff
0x377c: 0xffffffff
0x3780: 0xffffffff
0x3784: 0xffffffff
0x3788: 0xffffffff
0x378c: 0xffffffff
0x3790: 0xffffffff
0x3794: 0xffffffff
0x3798: 0xffffffff
0x379c: 0xffffffff
0x37a0: 0xffffffff
0x37a4: 0xffffffff
0x37a8: 0xffffffff
0x37ac: 0xffffffff
0x37b0: 0xffffffff
0x37b4: 0xffffffff
0x37b8: 0xffffffff
0x37bc: 0xffffffff
0x37c0: 0xffffffff
0x37c4: 0xffffffff
0x37c8: 0xffffffff
0x37cc: 0xffffffff
0x37d0: 0xffffffff
0x37d4: 0xffffffff
0x37d8: 0xffffffff
0x37dc: 0xffffffff
0x37e0: 0xffffffff
0x37e4: 0xffffffff
0x37e8: 0xffffffff
0x37ec: 0xffffffff
0x37f0: 0xffffffff
0x37f4: 0xffffffff
0x37f8: 0xffffffff
0x37fc: 0xffffffff
0x3800: 0x03ff0017
0x3804: 0x0000e008
0x3810: 0x006f0002
0x3814: 0x0049006e
0x3818: 0x0000006e
0x381c: 0x000b0f03
0x3820: 0xffffffff
0x3824: 0x7f010103
0x3828: 0x000004ff
0x3834: 0x0000000c
0x3838: 0x0000000f
0x383c: 0x8be4df61
0x3840: 0x11d293ca
0x3844: 0xe0000daa
0x3848: 0x8c2b0398
0x384c: 0xd2f9bee0
0x3850: 0x0000ffff
0x3858: 0x03ff0017
0x385c: 0x00160003
0x3860: 0x00020001
0x3864: 0x00000fff
0x3890: 0xf9400080
0x3894: 0xb32d5006
0x3898: 0x05030201
0x389c: 0x0bd89f20
0x38b0: 0x00001000
0x38b4: 0x09300024
0x38c0: 0x00000007
0x38c4: 0x00802005
0x38c8: 0x00002005
0x3a00: 0x03020100
0x3a04: 0x07060504
0x3a08: 0x0b0a0908
0x3a0c: 0x0f0e0d0c
0x3a20: 0x06060606
0x3a24: 0x00000606
0x3a28: 0x01010000
0x3a2c: 0x01010404
0x3a60: 0x0000008f
0x3a6c: 0x00000001
0x3a80: 0x01041041
0x3a84: 0x01001001
0x3a88: 0x00000001
0x3b00: 0xffffffff
0x3b04: 0xffffffff
0x3b08: 0xffffffff
0x3b0c: 0xffffffff
0x3b10: 0xffffffff
0x3b14: 0xffffffff
0x3b18: 0xffffffff
0x3b1c: 0xffffffff
0x3b20: 0xffffffff
0x3b24: 0xffffffff
0x3b28: 0xffffffff
0x3b2c: 0xffffffff
0x3b30: 0xffffffff
0x3b34: 0xffffffff
0x3b38: 0xffffffff
0x3b3c: 0xffffffff
0x3b40: 0xffffffff
0x3b44: 0xffffffff
0x3b48: 0xffffffff
0x3b4c: 0xffffffff
0x3b50: 0xffffffff
0x3b54: 0xffffffff
0x3b58: 0xffffffff
0x3b5c: 0xffffffff
0x3b60: 0xffffffff
0x3b64: 0xffffffff
0x3b68: 0xffffffff
0x3b6c: 0xffffffff
0x3b70: 0xffffffff
0x3b74: 0xffffffff
0x3b78: 0xffffffff
0x3b7c: 0xffffffff
0x3b80: 0xffffffff
0x3b84: 0xffffffff
0x3b88: 0xffffffff
0x3b8c: 0xffffffff
0x3b90: 0xffffffff
0x3b94: 0xffffffff
0x3b98: 0xffffffff
0x3b9c: 0xffffffff
0x3ba0: 0xffffffff
0x3ba4: 0xffffffff
0x3ba8: 0xffffffff
0x3bac: 0xffffffff
0x3bb0: 0xffffffff
0x3bb4: 0xffffffff
0x3bb8: 0xffffffff
0x3bbc: 0xffffffff
0x3bc0: 0xffffffff
0x3bc4: 0xffffffff
0x3bc8: 0xffffffff
0x3bcc: 0xffffffff
0x3bd0: 0xffffffff
0x3bd4: 0xffffffff
0x3bd8: 0xffffffff
0x3bdc: 0xffffffff
0x3be0: 0xffffffff
0x3be4: 0xffffffff
0x3be8: 0xffffffff
0x3bec: 0xffffffff
0x3bf0: 0xffffffff
0x3bf4: 0xffffffff
0x3bf8: 0xffffffff
0x3bfc: 0xffffffff
0x3c00: 0xffffffff
0x3c04: 0xffffffff
0x3c08: 0xffffffff
0x3c0c: 0xffffffff
0x3c10: 0xffffffff
0x3c14: 0xffffffff
0x3c18: 0xffffffff
0x3c1c: 0xffffffff
0x3c20: 0xffffffff
0x3c24: 0xffffffff
0x3c28: 0xffffffff
0x3c2c: 0xffffffff
0x3c30: 0xffffffff
0x3c34: 0xffffffff
0x3c38: 0xffffffff
0x3c3c: 0xffffffff
0x3c40: 0xffffffff
0x3c44: 0xffffffff
0x3c48: 0xffffffff
0x3c4c: 0xffffffff
0x3c50: 0xffffffff
0x3c54: 0xffffffff
0x3c58: 0xffffffff
0x3c5c: 0xffffffff
0x3c60: 0xffffffff
0x3c64: 0xffffffff
0x3c68: 0xffffffff
0x3c6c: 0xffffffff
0x3c70: 0xffffffff
0x3c74: 0xffffffff
0x3c78: 0xffffffff
0x3c7c: 0xffffffff
0x3c80: 0xffffffff
0x3c84: 0xffffffff
0x3c88: 0xffffffff
0x3c8c: 0xffffffff
0x3c90: 0xffffffff
0x3c94: 0xffffffff
0x3c98: 0xffffffff
0x3c9c: 0xffffffff
0x3ca0: 0xffffffff
0x3ca4: 0xffffffff
0x3ca8: 0xffffffff
0x3cac: 0xffffffff
0x3cb0: 0xffffffff
0x3cb4: 0xffffffff
0x3cb8: 0xffffffff
0x3cbc: 0xffffffff
0x3cc0: 0xffffffff
0x3cc4: 0xffffffff
0x3cc8: 0xffffffff
0x3ccc: 0xffffffff
0x3cd0: 0xffffffff
0x3cd4: 0xffffffff
0x3cd8: 0xffffffff
0x3cdc: 0xffffffff
0x3ce0: 0xffffffff
0x3ce4: 0xffffffff
0x3ce8: 0xffffffff
0x3cec: 0xffffffff
0x3cf0: 0xffffffff
0x3cf4: 0xffffffff
0x3cf8: 0xffffffff
0x3cfc: 0xffffffff
0x3d00: 0xffffffff
0x3d04: 0xffffffff
0x3d08: 0xffffffff
0x3d0c: 0xffffffff
0x3d10: 0xffffffff
0x3d14: 0xffffffff
0x3d18: 0xffffffff
0x3d1c: 0xffffffff
0x3d20: 0xffffffff
0x3d24: 0xffffffff
0x3d28: 0xffffffff
0x3d2c: 0xffffffff
0x3d30: 0xffffffff
0x3d34: 0xffffffff
0x3d38: 0xffffffff
0x3d3c: 0xffffffff
0x3d40: 0xffffffff
0x3d44: 0xffffffff
0x3d48: 0xffffffff
0x3d4c: 0xffffffff
0x3d50: 0xffffffff
0x3d54: 0xffffffff
0x3d58: 0xffffffff
0x3d5c: 0xffffffff
0x3d60: 0xffffffff
0x3d64: 0xffffffff
0x3d68: 0xffffffff
0x3d6c: 0xffffffff
0x3d70: 0xffffffff
0x3d74: 0xffffffff
0x3d78: 0xffffffff
0x3d7c: 0xffffffff
0x3d80: 0xffffffff
0x3d84: 0xffffffff
0x3d88: 0xffffffff
0x3d8c: 0xffffffff
0x3d90: 0xffffffff
0x3d94: 0xffffffff
0x3d98: 0xffffffff
0x3d9c: 0xffffffff
0x3da0: 0xffffffff
0x3da4: 0xffffffff
0x3da8: 0xffffffff
0x3dac: 0xffffffff
0x3db0: 0xffffffff
0x3db4: 0xffffffff
0x3db8: 0xffffffff
0x3dbc: 0xffffffff
0x3dc0: 0xffffffff
0x3dc4: 0xffffffff
0x3dc8: 0xffffffff
0x3dcc: 0xffffffff
0x3dd0: 0xffffffff
0x3dd4: 0xffffffff
0x3dd8: 0xffffffff
0x3ddc: 0xffffffff
0x3de0: 0xffffffff
0x3de4: 0xffffffff
0x3de8: 0xffffffff
0x3dec: 0xffffffff
0x3df0: 0xffffffff
0x3df4: 0xffffffff
0x3df8: 0xffffffff
0x3dfc: 0xffffffff
0x3e00: 0xffffffff
0x3e04: 0xffffffff
0x3e08: 0xffffffff
0x3e0c: 0xffffffff
0x3e10: 0xffffffff
0x3e14: 0xffffffff
0x3e18: 0xffffffff
0x3e1c: 0xffffffff
0x3e20: 0xffffffff
0x3e24: 0xffffffff
0x3e28: 0xffffffff
0x3e2c: 0xffffffff
0x3e30: 0xffffffff
0x3e34: 0xffffffff
0x3e38: 0xffffffff
0x3e3c: 0xffffffff
0x3e40: 0xffffffff
0x3e44: 0xffffffff
0x3e48: 0xffffffff
0x3e4c: 0xffffffff
0x3e50: 0xffffffff
0x3e54: 0xffffffff
0x3e58: 0xffffffff
0x3e5c: 0xffffffff
0x3e60: 0xffffffff
0x3e64: 0xffffffff
0x3e68: 0xffffffff
0x3e6c: 0xffffffff
0x3e70: 0xffffffff
0x3e74: 0xffffffff
0x3e78: 0xffffffff
0x3e7c: 0xffffffff
0x3e80: 0xffffffff
0x3e84: 0xffffffff
0x3e88: 0xffffffff
0x3e8c: 0xffffffff
0x3e90: 0xffffffff
0x3e94: 0xffffffff
0x3e98: 0xffffffff
0x3e9c: 0xffffffff
0x3ea0: 0xffffffff
0x3ea4: 0xffffffff
0x3ea8: 0xffffffff
0x3eac: 0xffffffff
0x3eb0: 0xffffffff
0x3eb4: 0xffffffff
0x3eb8: 0xffffffff
0x3ebc: 0xffffffff
0x3ec0: 0xffffffff
0x3ec4: 0xffffffff
0x3ec8: 0xffffffff
0x3ecc: 0xffffffff
0x3ed0: 0xffffffff
0x3ed4: 0xffffffff
0x3ed8: 0xffffffff
0x3edc: 0xffffffff
0x3ee0: 0xffffffff
0x3ee4: 0xffffffff
0x3ee8: 0xffffffff
0x3eec: 0xffffffff
0x3ef0: 0xffffffff
0x3ef4: 0xffffffff
0x3ef8: 0xffffffff
0x3efc: 0xffffffff
0x3f00: 0x0000010b



========== ACPI/PMC =========


========== ABASE/PMBASE =========

PMBASE = 0x0500 (IO)

pmbase+0x0000: 0x0001     (PM1_STS)
pmbase+0x0002: 0x0120     (PM1_EN)
pmbase+0x0004: 0x00000001 (PM1_CNT)
pmbase+0x0008: 0x00373be1 (PM1_TMR)
pmbase+0x000c: 0x00000000 (RESERVED)
pmbase+0x0010: 0x00000000 (RESERVED)
pmbase+0x0014: 0x00000000 (RESERVED)
pmbase+0x0018: 0x00000000 (RESERVED)
pmbase+0x001c: 0x00000000 (RESERVED)
pmbase+0x0020: 0x4e830000 (GPE0_STS)
               0x00000008
pmbase+0x0028: 0x00000000 (GPE0_EN)
               0x00000000
pmbase+0x0030: 0x00002033 (SMI_EN)
pmbase+0x0034: 0x00004100 (SMI_STS)
pmbase+0x0038: 0x0000     (ALT_GP_SMI_EN)
pmbase+0x003a: 0x4e83     (ALT_GP_SMI_STS)
pmbase+0x003c: 0x00       (UPRWC)
pmbase+0x003d: 0x01       (RESERVED)
pmbase+0x003e: 0x0000     (RESERVED)
pmbase+0x0040: 0x0000     (RESERVED)
pmbase+0x0042: 0x00       (GPE_CNTL)
pmbase+0x0043: 0x00       (RESERVED)
pmbase+0x0044: 0x13e0     (DEVACT_STS)
pmbase+0x0046: 0x0000     (RESERVED)
pmbase+0x0048: 0x00000000 (RESERVED)
pmbase+0x004c: 0x00000000 (RESERVED)
pmbase+0x0050: 0x00       (PM2_CNT)
pmbase+0x0051: 0x00       (RESERVED)
pmbase+0x0052: 0x0000     (RESERVED)
pmbase+0x0054: 0x00002000 (RESERVED)
pmbase+0x0058: 0x00000000 (RESERVED)
pmbase+0x005c: 0x00000000 (RESERVED)
pmbase+0x0060: 0x0004     (TCO_RLD)
pmbase+0x0062: 0x00       (TCO_DAT_IN)
pmbase+0x0063: 0x00       (TCO_DAT_OUT)
pmbase+0x0064: 0x0000     (TCO1_STS)
pmbase+0x0066: 0x0000     (TCO2_STS)
pmbase+0x0068: 0x1800     (TCO1_CNT)
pmbase+0x006a: 0x0008     (TCO2_CNT)
pmbase+0x006c: 0x0000     (TCO_MESSAGE)
pmbase+0x006e: 0x00       (TCO_WDCNT)
pmbase+0x006f: 0x00       (RESERVED)
pmbase+0x0070: 0x03       (SW_IRQ_GEN)
pmbase+0x0071: 0x00       (RESERVED)
pmbase+0x0072: 0x0032     (TCO_TMR)
pmbase+0x0074: 0x00000000 (RESERVED)
pmbase+0x0078: 0x00000000 (RESERVED)
pmbase+0x007c: 0x00000000 (RESERVED)



========== LPC/eSPI =========

Error: Dumping LPC/eSPI on this southbridge is not (yet) supported.



============= MCHBAR ============

MCHBAR = 0xfed10000 (MEM)

0x000c: 0x000b421c
0x0030: 0x000000ff
0x0034: 0x00001814
0x010c: 0x000b421c
0x0110: 0x02002135
0x0120: 0x0001811f
0x0130: 0x000000ff
0x0134: 0x00001814
0x020c: 0x000b421c
0x0230: 0x000000ff
0x0234: 0x00001814
0x030c: 0x000b421c
0x0310: 0x02112301
0x0320: 0x00019433
0x0330: 0x000000ff
0x0334: 0x00001814
0x040c: 0x000b421c
0x0430: 0x000000ff
0x0434: 0x00001814
0x050c: 0x000b421c
0x0510: 0x0201200f
0x0520: 0x0009a403
0x0530: 0x000000ff
0x0534: 0x00001814
0x060c: 0x000b421c
0x0630: 0x000000ff
0x0634: 0x00001814
0x070c: 0x000b421c
0x0710: 0x0201231a
0x0720: 0x0009b110
0x0730: 0x000000ff
0x0734: 0x00001814
0x080c: 0x000b421c
0x0830: 0x000000ff
0x0834: 0x00001814
0x090c: 0x000b421c
0x0930: 0x000000ff
0x0934: 0x00001814
0x0a04: 0x000b4a08
0x0a08: 0x000b4a0e
0x0a0c: 0x00004000
0x0a10: 0x00003fff
0x0b00: 0x00000001
0x0b04: 0x000b4a08
0x0b08: 0x000b4a0e
0x0b0c: 0x00024006
0x0b10: 0x00003fff
0x0c04: 0x000a4210
0x0c1c: 0x000002ff
0x0c20: 0x0000ff00
0x0c34: 0x00001814
0x0d00: 0x00000001
0x0d04: 0x000a4210
0x0d14: 0x0100000a
0x0d1c: 0x000002ff
0x0d20: 0x0000ffff
0x0d34: 0x00001814
0x0e04: 0x000b4a08
0x0e08: 0x000b4a0e
0x0e0c: 0x00004000
0x0e10: 0x00003fff
0x0f00: 0x00000001
0x0f04: 0x000b4a08
0x0f08: 0x000b4a0e
0x0f0c: 0x00024006
0x0f10: 0x00003fff
0x100c: 0x000b421c
0x1030: 0x000000ff
0x1034: 0x00001814
0x110c: 0x000b421c
0x1110: 0x02012133
0x1120: 0x0002001f
0x1130: 0x000000ff
0x1134: 0x00001814
0x120c: 0x000b421c
0x1230: 0x000000ff
0x1234: 0x00001814
0x130c: 0x000b421c
0x1310: 0x02122003
0x1320: 0x00020929
0x1330: 0x000000ff
0x1334: 0x00001814
0x140c: 0x000b421c
0x1430: 0x000000ff
0x1434: 0x00001814
0x150c: 0x000b421c
0x1510: 0x02122212
0x1520: 0x00020d2b
0x1530: 0x000000ff
0x1534: 0x00001814
0x160c: 0x000b421c
0x1630: 0x000000ff
0x1634: 0x00001814
0x170c: 0x000b421c
0x1710: 0x0202221d
0x1720: 0x00021638
0x1730: 0x000000ff
0x1734: 0x00001814
0x1810: 0x24924924
0x1814: 0x0ca8c264
0x1818: 0x00000400
0x1910: 0x24914924
0x1914: 0x0ca8c264
0x1918: 0x00000400
0x4000: 0x00187999
0x4004: 0xca145454
0x400c: 0x00005690
0x401c: 0x00100000
0x4020: 0x10100005
0x4024: 0x20202020
0x4028: 0x000e0000
0x40a8: 0x01000040
0x40ac: 0x00000040
0x40b0: 0x00000340
0x40b4: 0xffffffff
0x40b8: 0x00040000
0x40d4: 0x00000046
0x4200: 0x00060002
0x4204: 0x00060400
0x4214: 0x00000288
0x4220: 0x00000007
0x4224: 0x0001f003
0x4230: 0x000f1001
0x4234: 0x01901001
0x4284: 0x00040000
0x428c: 0x00000044
0x4290: 0x00004080
0x4294: 0x000198ff
0x4298: 0x5a6b1450
0x42a4: 0x41f97200
0x4380: 0x00000aaa
0x4388: 0x5f7003ff
0x438c: 0x551d1519
0x4400: 0x00187999
0x4404: 0x0a145454
0x4408: 0x0a022220
0x440c: 0x00005690
0x441c: 0x00100000
0x4420: 0x00100005
0x4424: 0x00000023
0x4428: 0x000e0002
0x4434: 0x00028bfa
0x4438: 0x19ed5483
0x443c: 0x53fe4b49
0x44a8: 0x01000040
0x44ac: 0x00000040
0x44b0: 0x00000340
0x44b4: 0xffffffff
0x44b8: 0x00040000
0x44d4: 0x00000046
0x4600: 0x00460000
0x4604: 0x00000320
0x4608: 0x00000320
0x460c: 0x00060400
0x4610: 0x00000244
0x4614: 0x00000242
0x4618: 0x00000242
0x461c: 0x00000240
0x4620: 0x0001f006
0x4624: 0x0001f201
0x4628: 0x0001f105
0x462c: 0x0001f002
0x4630: 0x00282004
0x4634: 0x08281064
0x4638: 0x04281064
0x463c: 0x00280c01
0x4670: 0x1ed2fd85
0x4684: 0x000c0000
0x468c: 0x00000044
0x4690: 0x00004080
0x4694: 0x000198ff
0x4698: 0x5a6b1450
0x469c: 0x00000250
0x46a0: 0x00001001
0x46a4: 0x41f97200
0x46ac: 0x00000001
0x4760: 0x00000320
0x4764: 0x00000320
0x4780: 0x00000aaa
0x4784: 0x00373131
0x4788: 0x5f7003ff
0x478c: 0x551d1519
0x4c00: 0x00187999
0x4c04: 0xca145454
0x4c0c: 0x00005690
0x4c1c: 0x00100000
0x4c20: 0x10100005
0x4c24: 0x20202020
0x4c28: 0x000e0000
0x4ca8: 0x01000040
0x4cac: 0x00000040
0x4cb0: 0x00000340
0x4cb4: 0xffffffff
0x4cb8: 0x00040000
0x4cd4: 0x00000046
0x4e00: 0x00060002
0x4e04: 0x00060400
0x4e14: 0x00000288
0x4e20: 0x00000007
0x4e24: 0x0001f003
0x4e30: 0x000f1001
0x4e34: 0x01901001
0x4e84: 0x00040000
0x4e8c: 0x00000044
0x4e90: 0x00004080
0x4e94: 0x000198ff
0x4e98: 0x5a6b1450
0x4ea4: 0x41f97200
0x4f80: 0x00000aaa
0x4f88: 0x5f7003ff
0x4f8c: 0x551d1519
0x5000: 0x00000021
0x5008: 0x00600008
0x500c: 0x00600000
0x5020: 0x00000006
0x5024: 0x00a030ce
0x5030: 0x0000019f
0x5034: 0xc04eb002
0x5044: 0x59a4cd39
0x5048: 0x10f5a3eb
0x5050: 0x1fa85924
0x5054: 0x4a9b227c
0x5058: 0xe40bede4
0x5060: 0x000100ff
0x5064: 0x00073150
0x5074: 0x00000010
0x5080: 0x0000201a
0x5084: 0x00010898
0x5094: 0xffffffff
0x50fc: 0x0000008f
0x5418: 0x00000024
0x541c: 0x30000000
0x5500: 0x00100001
0x5880: 0xca9171e5
0x5888: 0x00e4d5d0
0x5894: 0x00681ed2
0x58a4: 0x0000201e
0x5924: 0x00000010
0x5928: 0x19c3acc1
0x5930: 0x016001b8
0x5934: 0x000d0000
0x5938: 0x000a1003
0x593c: 0xf6e05cdb
0x5954: 0x00040000
0x5958: 0xe0011c00
0x595c: 0x00081000
0x5964: 0x10fd1ad1
0x5968: 0x10fd1638
0x596c: 0x7bae6342
0x5978: 0x00000024
0x597c: 0x00000024
0x5980: 0x00000023
0x5984: 0x7f1c3f10
0x5990: 0x000000ff
0x5994: 0x000000ff
0x5998: 0x00070d15
0x599c: 0x00691400
0x59b0: 0x80000380
0x59b4: 0x18141494
0x59b8: 0x80000190
0x59bc: 0x18141494
0x59c0: 0x88490000
0x5d10: 0x2010040c
0x5d14: 0x8000cafe
0x5d20: 0x00000005
0x5da8: 0x00000001
0x5e00: 0x00000005
0x5e04: 0x00000005
0x5efc: 0xffff0000
0x5f00: 0x8000270f
0x5f04: 0x7530001a
0x5f08: 0x0000001a
0x5f0c: 0x4e20001a
0x5f10: 0x1f425830
0x5f14: 0x801db100
0x5f18: 0x000000fa
0x5f20: 0x5dc20000
0x5f30: 0x00040001
0x5f38: 0x2074f5f8
0x5f3c: 0x0000001c
0x5f44: 0x01600000
0x5f4c: 0x01600000
0x5f50: 0x80000000
0x6000: 0x00000004
0x6008: 0x800000d8
0x6010: 0xfff00000
0x6014: 0x0000007f
0x6020: 0x00000001
0x6030: 0x000700b0
0x6034: 0x000700b0
0x6200: 0x88450000
0x63fc: 0x00000001
0x6410: 0x00000c00
0x6430: 0x00fac688
0x6434: 0x00fac688
0x6800: 0x80000044
0x7000: 0x80444444
0x7030: 0x00000018
0x7400: 0x09249249
0x7404: 0x00120249
0x7408: 0x01ffffff
0x740c: 0xb124f851
0x7410: 0x00000017
0x7500: 0x000f0000
0x7504: 0x000700f8
0x77fc: 0x00000001
0x7800: 0x00444444
0x7804: 0x00004444
 .tCK = TCK_MHZ666,
.rankmap = { 0x0, 0x1 },
.mad_dimm = { 0x0, 0x600008 },
.mobile = 0,
.CAS = 0 /* 0 clocks = 0.000 ns */,
.tWR = 10 /* 10 clocks = 15.000 ns */,
.reg_4004_b30 = { 0, 0 },
.tFAW = 20 /* 20 clocks = 30.000 ns */,
.tWTR = 5 /* 5 clocks = 7.500 ns */,
.tCKE = 4 /* 4 clocks = 6.000 ns */,
.tRTP = 5 /* 5 clocks = 7.500 ns */,
.tRRD = 4 /* 4 clocks = 6.000 ns */,
.tRAS = 24 /* 24 clocks = 36.000 ns */,
.tCWL = 7 /* 7 clocks = 10.500 ns */,
.tRP = 9 /* 9 clocks = 13.500 ns */,
.tRCD = 9 /* 9 clocks = 13.500 ns */,
.tXPDLL = 16 /* 16 clocks = 24.000 ns */,
.tXP = 4 /* 4 clocks = 6.000 ns */,
.tAONPD = 6 /* 6 clocks = 9.000 ns */,
.tREFI = 5200 /* 5200 clocks = 7800.000 ns */,
.tRFC = 107 /* 107 clocks = 160.500 ns */,
.tMOD = 12 /* 12 clocks = 18.000 ns */,
.tXSOffset = 7 /* 7 clocks = 10.500 ns */,
.reg5064b0 = 0x150,
.channel_size_mb = { 0, ? },
/* CH1S0: 2048 MiB  */
/* SPD matching current mode:  */
/* CH1S0  */
00: 92 11 0b 03 03 00 00 01 03 52 01 08 0c 00 20 00 
10: 6c 78 6c 30 6c 11 20 81 04 05 3c 3c 00 f0 00 00 
20: 00 00 00 00 00 00 00 00 00 00 00 00 00 00 00 00 
30: 00 00 00 00 00 00 00 00 00 00 00 00 00 00 65 00 
40: 00 00 00 00 00 00 00 00 00 00 00 00 00 00 00 00 
50: 00 00 00 00 00 00 00 00 00 00 00 00 00 00 00 00 
60: 00 00 00 00 00 00 00 00 00 00 00 00 00 00 00 00 
70: 00 00 00 00 00 00 00 00 00 00 00 00 00 00 b0 59 
80: 00 00 00 00 00 00 00 00 00 00 00 00 00 00 00 00 
90: 00 00 00 00 00 00 00 00 00 00 00 00 00 00 00 00 
a0: 00 00 00 00 00 00 00 00 00 00 00 00 00 00 00 00 
b0: 00 00 00 00 00 00 00 00 00 00 00 00 00 00 00 00 
c0: 00 00 00 00 00 00 00 00 00 00 00 00 00 00 00 00 
d0: 00 00 00 00 00 00 00 00 00 00 00 00 00 00 00 00 
e0: 00 00 00 00 00 00 00 00 00 00 00 00 00 00 00 00 
f0: 00 00 00 00 00 00 00 00 00 00 00 00 00 00 00 00 




============= EPBAR =============

EPBAR = 0xfed19000 (MEM)

0x0000: 0x04010002
0x0004: 0x00000001
0x0010: 0x00000001
0x0014: 0x800000ff
0x001c: 0x00008001
0x0020: 0x01000000
0x0040: 0x00010005
0x0044: 0x00000501
0x0050: 0x01000000
0x0060: 0x02000002
0x0070: 0x03000002
0x0080: 0x04000002
0x0090: 0x05000002



============= DMIBAR ============

DMIBAR = 0xfed18000 (MEM)

0x0000: 0x04010002
0x0004: 0x00000001
0x0010: 0x00000001
0x0014: 0x80000019
0x001c: 0x00008001
0x0020: 0x81000022
0x0028: 0x00000001
0x002c: 0x82000044
0x0034: 0x00008000
0x0038: 0x87000080
0x0040: 0x08010005
0x0044: 0x01000202
0x0080: 0x00010006
0x0084: 0x00412c42
0x0088: 0x00420003
0x0098: 0x00000002
0x00f0: 0x00000800
0x00f4: 0x00050020
0x00fc: 0x00100001
0x01c0: 0x00010001
0x01cc: 0x00060010
0x01d4: 0x00002000
0x01f8: 0x00010000
0x01fc: 0x7c801000
0x0200: 0x80000000
0x0204: 0x00f78000
0x0208: 0x000004b0
0x0214: 0x000a000f
0x0218: 0x0ac70fe7
0x021c: 0x0fe80fe8
0x0224: 0x97410007
0x022c: 0x00c2403c
0x0230: 0x2800000c
0x0234: 0x4abcb5bc
0x0238: 0x202c02c3
0x0250: 0x08d00320
0x0254: 0x000c0f10
0x0258: 0x60000600
0x025c: 0x14084c60
0x0300: 0x00280185
0x0304: 0x003801c5
0x0308: 0x000c0040
0x030c: 0x005806a9
0x0310: 0x005906aa
0x0314: 0x000c0000
0x0318: 0x003103c6
0x031c: 0x00410406
0x0320: 0x30073007
0x0324: 0x30083008
0x032c: 0x000c0028
0x0330: 0x000c0000
0x0334: 0x000c0028
0x0338: 0x000c0000
0x0344: 0x000c0028
0x0348: 0x000b0000
0x039c: 0x00100040
0x03b8: 0x003803ae
0x03bc: 0x004803ee
0x03dc: 0x00100040
0x0400: 0x1401000b
0x0404: 0x0c000001
0x0408: 0x0010100d
0x040c: 0x02800063
0x0410: 0x00000003
0x0414: 0x00000002
0x0418: 0x00000001
0x041c: 0x00800000
0x0428: 0x00400002
0x0438: 0x0000000f
0x0440: 0x000e0b00
0x0448: 0xffff0000
0x044c: 0xffff0000
0x0468: 0x06000084
0x046c: 0x00000f00
0x0470: 0xabc2d6bc
0x0474: 0x0000ffff
0x0490: 0x10000000
0x04b8: 0x000000fa
0x04bc: 0x0000c8c8
0x0508: 0x00000001
0x0530: 0x52e602c8
0x0534: 0x3c729724
0x0700: 0x45fb9008
0x0720: 0x45fb9008
0x0804: 0x00000001
0x0900: 0x50000000
0x0904: 0x2a1846ec
0x0908: 0x51ffffff
0x090c: 0x00000128
0x0910: 0x00004300
0x0914: 0x98200280
0x091c: 0x00020000
0x0920: 0x50000000
0x0924: 0x2a1846ec
0x0928: 0x51ffffff
0x092c: 0x00000128
0x0930: 0x00004300
0x0934: 0x98200280
0x093c: 0x00020000
0x0a00: 0x03242018
0x0a04: 0x0c0718f0
0x0a08: 0x06208300
0x0a0c: 0x00000080
0x0a10: 0x03242018
0x0a14: 0x0c0718f0
0x0a18: 0x06208300
0x0a1c: 0x00000080
0x0a20: 0x03242018
0x0a24: 0x0c0718f0
0x0a28: 0x06208300
0x0a2c: 0x00000080
0x0a30: 0x03242018
0x0a34: 0x0c0718f0
0x0a38: 0x06208300
0x0a3c: 0x00000080
0x0b80: 0x00000200
0x0b98: 0x00001c20
0x0ba4: 0x0000000d
0x0ba8: 0x00e00014
0x0c00: 0x29700c08
0x0c04: 0x2e680008
0x0c08: 0x100c5843
0x0c0c: 0x00063400
0x0c10: 0x00000100
0x0c14: 0x0e004000
0x0c18: 0x00000054
0x0c1c: 0xa0202000
0x0c24: 0xa0840080
0x0c28: 0x0003a091
0x0c30: 0x40024000
0x0c38: 0x18000402
0x0c40: 0x00003ff1
0x0c44: 0x00003ff2
0x0c4c: 0x00000231
0x0c50: 0x00000020
0x0ccc: 0x00000001
0x0cd4: 0xff0000ff
0x0cd8: 0x00005000
0x0cdc: 0xc1ff0113
0x0d10: 0xffff0000
0x0d14: 0xffff0000
0x0d1c: 0x00000040
0x0d34: 0x0000005f
0x0d6c: 0x400204e0
0x0d70: 0x8000abf5
0x0d74: 0x000146ec
0x0d78: 0x0000043a
0x0d7c: 0x0002000f
0x0d80: 0x6c2c6c87
0x0d84: 0x00ff0fff
0x0dc0: 0x3400fbc0
0x0dc4: 0x0037100a
0x0dc8: 0x00f80236
0x0dcc: 0x36200e06
0x0dd0: 0x0836b180
0x0dd4: 0x00d0a22e
0x0ddc: 0x00014a80
0x0e0c: 0x20000000
0x0e1c: 0x20000000
0x0e2c: 0x20000000
0x0e3c: 0x20000000


========= PCIEXBAR ========

PCIEXBAR: 0xf0000000

PCIe 00:01.0 extended config space:
0000: 86 80 51 01 07 04 10 00 09 00 04 06 10 00 81 00
0010: 00 00 00 00 00 00 00 00 00 01 01 00 10 10 00 20
0020: 00 8a 00 8b 01 80 f1 89 00 00 00 00 00 00 00 00
0030: 00 00 00 00 88 00 00 00 00 00 00 00 ff 01 1b 00
0040: 00 00 00 00 00 00 00 00 00 00 00 00 00 00 00 00
0050: 00 00 00 00 00 00 00 00 00 00 00 00 00 00 00 00
0060: 00 00 00 00 00 00 00 00 00 00 00 00 00 00 00 00
0070: 00 00 00 00 00 00 00 00 00 00 00 00 00 00 00 0a
0080: 01 90 03 c8 08 00 00 00 0d 80 00 00 86 80 01 20
0090: 05 a0 01 00 04 10 e0 fe 21 00 00 00 00 00 00 00
00a0: 10 00 42 01 01 80 00 00 00 00 00 00 03 ad 61 02
00b0: 43 00 01 51 00 00 04 00 00 00 48 00 08 00 00 00
00c0: 00 00 00 00 00 00 00 00 00 00 00 00 06 00 00 00
00d0: 03 00 00 00 00 00 00 00 00 00 00 00 00 00 00 00
00e0: 00 00 00 00 00 00 00 00 00 00 00 00 00 00 00 00
00f0: 00 00 00 00 00 00 01 00 00 00 00 00 01 00 10 00
0100: 02 00 01 14 00 00 00 00 00 00 00 00 00 00 00 00
0110: 01 00 00 00 ff 00 00 80 00 00 00 00 00 00 00 00
0120: 00 00 00 00 00 00 00 00 00 00 00 00 00 00 00 00
0130: 00 00 00 00 00 00 00 00 00 00 00 00 00 00 00 00
0140: 05 00 01 00 00 01 00 02 00 00 00 00 00 00 00 00
0150: 00 00 00 00 00 00 00 00 00 00 00 00 00 00 00 00
0160: 00 00 00 00 00 00 00 00 00 00 00 00 00 00 00 00
0170: 00 00 00 00 00 00 00 00 00 00 00 00 00 00 00 00
0180: 00 00 00 00 00 00 00 00 00 00 00 00 00 00 00 00
0190: 00 00 00 00 00 00 00 00 00 00 00 00 00 00 00 00
01a0: 00 00 00 00 00 00 00 00 00 00 00 00 00 00 00 00
01b0: 00 00 00 00 00 00 00 00 00 00 00 00 00 00 00 00
01c0: 01 00 01 00 00 00 00 00 00 00 00 00 10 00 06 00
01d0: 00 00 00 00 00 20 00 00 00 00 00 00 00 00 00 00
01e0: 00 00 00 00 00 00 00 00 00 00 00 00 00 00 00 00
01f0: 00 00 00 00 00 00 00 00 00 08 00 04 00 00 00 7c
0200: 00 00 00 80 00 80 f4 00 b0 74 00 00 00 00 00 00
0210: 00 00 00 00 ff ff 07 00 0f 06 97 07 10 06 10 06
0220: 00 00 00 00 1f 00 41 97 14 17 00 00 60 64 c2 00
0230: 0c 00 00 28 bc b5 bc 4a 3c 01 0e 00 00 00 00 00
0240: 00 00 00 00 00 00 00 00 00 00 00 00 01 00 00 00
0250: 20 03 d0 08 40 39 14 00 00 06 00 40 60 40 08 14
0260: 00 00 00 00 00 00 00 00 00 00 00 00 00 00 00 00
0270: 00 00 00 00 00 00 00 00 00 00 00 00 00 00 00 00
0280: 00 00 00 00 00 00 00 00 00 00 00 00 00 00 00 00
0290: 00 00 00 00 00 00 00 00 00 00 00 00 00 00 00 00
02a0: 00 00 00 00 00 00 00 00 00 00 00 00 00 00 00 00
02b0: 00 00 00 00 00 00 00 00 00 00 00 00 00 00 00 00
02c0: 00 00 00 00 00 00 00 00 00 00 00 00 00 00 00 00
02d0: 00 00 00 00 00 00 00 00 00 00 00 00 00 00 00 00
02e0: 00 00 00 00 00 00 00 00 00 00 00 00 00 00 00 00
02f0: 00 00 00 00 00 00 00 00 00 00 00 00 00 00 00 00
0300: c2 05 10 00 42 06 30 00 f4 00 38 00 ea 00 eb 00
0310: 00 80 ef 00 00 00 38 00 19 09 3d 00 00 80 00 80
0320: 07 30 07 30 00 00 00 00 00 00 00 00 08 00 01 00
0330: 00 00 0a 00 00 00 00 00 00 00 00 00 00 00 00 00
0340: 00 00 00 00 00 00 00 00 00 00 00 00 00 00 00 00
0350: 00 00 00 00 00 00 00 00 00 00 00 00 00 00 00 00
0360: 00 00 00 00 00 00 00 00 00 00 00 00 00 00 00 00
0370: 00 00 00 00 00 00 00 00 00 00 00 00 00 00 00 00
0380: 00 00 00 00 00 00 00 00 00 00 00 00 00 00 00 00
0390: 00 00 00 00 00 00 00 00 00 00 00 00 00 00 00 00
03a0: 00 00 00 00 00 00 00 00 00 00 00 00 00 00 00 00
03b0: 00 00 00 00 00 00 00 00 00 00 00 00 00 00 00 00
03c0: 00 00 00 00 00 00 00 00 00 00 00 00 00 00 00 00
03d0: 00 00 00 00 00 00 00 00 00 00 00 00 00 00 00 00
03e0: 00 00 00 00 00 00 00 00 00 00 00 00 00 00 00 00
03f0: 00 00 00 00 00 00 00 00 00 00 00 00 00 00 00 00
0400: 0b 00 01 14 01 00 00 0c 0d 00 10 04 ef 01 81 02
0410: 03 04 00 21 02 04 04 04 7f 1f 00 00 0a 0a 80 00
0420: 00 00 00 00 00 00 00 00 02 00 40 00 00 00 00 00
0430: 00 00 00 00 00 00 00 00 ff ff 00 00 00 00 00 00
0440: 00 0b 0b 00 00 00 00 00 00 00 00 00 00 00 00 00
0450: 00 00 00 00 00 00 00 00 00 00 00 00 00 00 00 00
0460: 00 00 00 00 00 00 00 00 84 00 00 06 00 0f 00 00
0470: bc d6 c2 ab ff ff 00 00 00 00 00 00 00 00 00 00
0480: 00 00 00 00 00 00 00 00 00 00 00 00 00 00 00 00
0490: 00 00 00 10 00 00 00 00 00 00 00 00 00 00 00 00
04a0: 00 00 00 00 00 00 00 00 00 00 00 00 00 00 00 00
04b0: 00 00 00 00 00 00 00 00 fa 00 00 00 c8 c8 00 00
04c0: 84 00 00 06 00 0f 00 00 bc d6 c2 ab 00 00 00 00
04d0: 00 00 00 00 00 00 00 00 00 00 00 00 00 00 00 00
04e0: 00 00 00 00 00 00 00 00 00 00 00 00 00 00 00 00
04f0: 00 00 00 00 00 00 00 00 9c 04 70 17 89 01 88 0c
0500: 00 00 00 00 00 00 03 00 01 00 00 00 00 00 00 00
0510: 00 00 00 00 00 00 00 00 00 00 00 00 00 00 00 00
0520: 00 00 00 00 00 00 00 00 00 00 00 00 00 00 00 00
0530: 80 be 46 0d c0 0c a7 0a 00 00 00 00 00 00 00 00
0540: 00 00 00 00 00 00 00 00 00 00 00 00 00 00 00 00
0550: 00 00 00 00 00 00 00 00 00 00 00 00 00 00 00 00
0560: 00 00 00 e0 00 00 10 00 00 00 00 e0 00 00 00 00
0570: 00 00 00 00 00 00 00 00 00 00 00 00 00 00 00 00
0580: 00 00 00 00 00 00 00 00 00 00 00 00 00 00 00 00
0590: 00 00 00 00 00 00 00 00 00 00 00 00 00 00 00 00
05a0: 00 00 00 00 00 00 00 00 00 00 00 00 00 00 00 00
05b0: 00 00 00 00 00 00 00 00 00 00 00 00 00 00 00 00
05c0: 00 00 00 00 00 00 00 00 00 00 00 00 00 00 00 00
05d0: 00 00 00 00 00 00 00 00 00 00 00 00 00 00 00 00
05e0: 00 00 00 00 00 00 00 00 00 00 00 00 00 00 00 00
05f0: 00 00 00 00 00 00 00 00 00 00 00 00 00 00 00 00
0600: 00 00 00 00 00 00 00 00 00 00 00 00 00 00 00 00
0610: 00 00 00 00 00 00 00 00 00 00 00 00 00 00 00 00
0620: 00 00 00 00 00 00 00 00 00 00 00 00 00 00 00 00
0630: 00 00 00 00 00 00 00 00 00 00 00 00 00 00 00 00
0640: 00 00 00 00 00 00 00 00 00 00 00 00 00 00 00 00
0650: 00 00 00 00 00 00 00 00 00 00 00 00 00 00 00 00
0660: 00 00 00 00 00 00 00 00 00 00 00 00 00 00 00 00
0670: 00 00 00 00 00 00 00 00 00 00 00 00 00 00 00 00
0680: 00 00 00 00 00 00 00 00 00 00 00 00 00 00 00 00
0690: 00 00 00 00 00 00 00 00 00 00 00 00 00 00 00 00
06a0: 00 00 00 00 00 00 00 00 00 00 00 00 00 00 00 00
06b0: 00 00 00 00 00 00 00 00 00 00 00 00 00 00 00 00
06c0: 00 00 00 00 00 00 00 00 00 00 00 00 00 00 00 00
06d0: 00 00 00 00 00 00 00 00 00 00 00 00 00 00 00 00
06e0: 00 00 00 00 00 00 00 00 00 00 00 00 00 00 00 00
06f0: 00 00 00 00 00 00 00 00 00 00 00 00 00 00 00 00
0700: 08 90 13 46 00 00 00 00 00 00 00 00 00 00 00 00
0710: 00 00 00 00 00 00 00 00 00 00 00 00 00 00 00 00
0720: 08 90 13 46 00 00 00 00 00 00 00 00 00 00 00 00
0730: 00 00 00 00 00 00 00 00 00 00 00 00 00 00 00 00
0740: 08 90 13 46 00 00 00 00 00 00 00 00 00 00 00 00
0750: 00 00 00 00 00 00 00 00 00 00 00 00 00 00 00 00
0760: 08 90 13 46 00 00 00 00 00 00 00 00 00 00 00 00
0770: 00 00 00 00 00 00 00 00 00 00 00 00 00 00 00 00
0780: 08 90 13 46 00 00 00 00 00 00 00 00 00 00 00 00
0790: 00 00 00 00 00 00 00 00 00 00 00 00 00 00 00 00
07a0: 08 90 13 46 00 00 00 00 00 00 00 00 00 00 00 00
07b0: 00 00 00 00 00 00 00 00 00 00 00 00 00 00 00 00
07c0: 08 90 13 46 00 00 00 00 00 00 00 00 00 00 00 00
07d0: 00 00 00 00 00 00 00 00 00 00 00 00 00 00 00 00
07e0: 08 90 13 46 00 00 00 00 00 00 00 00 00 00 00 00
07f0: 00 00 00 00 00 00 00 00 00 00 00 00 00 00 00 00
0800: 00 00 00 00 01 00 00 00 00 00 00 00 00 00 00 00
0810: 00 00 00 00 00 00 00 00 00 00 00 00 00 00 00 00
0820: 00 00 00 00 00 00 00 00 00 00 00 00 00 00 00 00
0830: 00 00 00 00 00 00 00 00 00 00 00 00 00 00 00 00
0840: 00 00 00 00 00 00 00 00 00 00 00 00 00 00 00 00
0850: 00 00 00 00 00 00 00 00 00 00 00 00 00 00 00 00
0860: 00 00 00 00 00 00 00 00 00 00 00 00 00 00 00 00
0870: 00 00 00 00 00 00 00 00 00 00 00 00 00 00 00 00
0880: 00 00 00 00 00 00 00 00 00 00 00 00 00 00 00 00
0890: 00 00 00 00 00 00 00 00 00 00 00 00 00 00 00 00
08a0: 00 00 00 00 00 00 00 00 00 00 00 00 00 00 00 00
08b0: 00 00 00 00 00 00 00 00 00 00 00 00 00 00 00 00
08c0: 00 00 00 00 00 00 00 00 00 00 00 00 00 00 00 00
08d0: 00 00 00 00 00 00 00 00 00 00 00 00 00 00 00 00
08e0: 00 00 00 00 00 00 00 00 00 00 00 00 00 00 00 00
08f0: 00 00 00 00 00 00 00 00 00 00 00 00 00 00 00 00
0900: 00 00 00 50 62 4c 18 7a ff ff ff 51 08 02 00 01
0910: 00 63 00 00 80 a0 21 10 00 00 00 00 00 00 02 00
0920: 00 00 00 50 62 4c 18 7a ff ff ff 51 08 02 00 01
0930: 00 63 00 00 80 a0 21 10 00 00 00 00 00 00 02 00
0940: 00 00 00 50 62 4c 18 7a ff ff ff 51 08 02 00 01
0950: 00 63 00 00 80 a0 21 10 00 00 00 00 00 00 02 00
0960: 00 00 00 50 62 4c 18 7a ff ff ff 51 08 02 00 01
0970: 00 63 00 00 80 a0 21 10 00 00 00 00 00 00 02 00
0980: 00 00 00 50 62 4c 18 7a ff ff ff 51 08 02 00 01
0990: 00 63 00 00 80 a0 21 10 00 00 00 00 00 00 02 00
09a0: 00 00 00 50 62 4c 18 7a ff ff ff 51 08 02 00 01
09b0: 00 63 00 00 80 a0 21 10 00 00 00 00 00 00 02 00
09c0: 00 00 00 50 62 4c 18 7a ff ff ff 51 08 02 00 01
09d0: 00 63 00 00 80 a0 21 10 00 00 00 00 00 00 02 00
09e0: 00 00 00 50 62 4c 18 7a ff ff ff 51 08 02 00 01
09f0: 00 63 00 00 80 a0 21 10 00 00 00 00 00 00 02 00
0a00: 10 20 04 03 f0 08 07 0c 00 83 20 06 40 00 00 00
0a10: 10 20 04 03 f0 08 07 0c 00 83 20 06 40 00 00 00
0a20: 10 20 04 03 f0 08 07 0c 00 83 20 06 40 00 00 00
0a30: 10 20 04 03 f0 08 07 0c 00 83 20 06 40 00 00 00
0a40: 10 20 04 03 f0 08 07 0c 00 83 20 06 40 00 00 00
0a50: 10 20 04 03 f0 08 07 0c 00 83 20 06 40 00 00 00
0a60: 10 20 04 03 f0 08 07 0c 00 83 20 06 40 00 00 00
0a70: 10 20 04 03 f0 08 07 0c 00 83 20 06 40 00 00 00
0a80: 10 20 04 03 f0 08 07 0c 00 83 20 06 40 00 00 00
0a90: 10 20 04 03 f0 08 07 0c 00 83 20 06 40 00 00 00
0aa0: 10 20 04 03 f0 08 07 0c 00 83 20 06 40 00 00 00
0ab0: 10 20 04 03 f0 08 07 0c 00 83 20 06 40 00 00 00
0ac0: 10 20 04 03 f0 08 07 0c 00 83 20 06 40 00 00 00
0ad0: 10 20 04 03 f0 08 07 0c 00 83 20 06 40 00 00 00
0ae0: 10 20 04 03 f0 08 07 0c 00 83 20 06 40 00 00 00
0af0: 10 20 04 03 f0 08 07 0c 00 83 20 06 40 00 00 00
0b00: 00 00 00 00 00 00 00 00 00 00 00 00 00 00 00 00
0b10: 00 00 00 00 00 00 00 00 00 00 00 00 00 00 00 00
0b20: 00 00 00 00 00 00 00 00 00 00 00 00 00 00 00 00
0b30: 00 00 00 00 00 00 00 00 00 00 00 00 00 00 00 00
0b40: 00 00 00 00 00 00 00 00 00 00 00 00 00 00 00 00
0b50: 00 00 00 00 00 00 00 00 00 00 00 00 00 00 00 00
0b60: 00 00 00 00 00 00 00 00 00 00 00 00 00 00 00 00
0b70: 00 00 00 00 00 00 00 00 00 00 00 00 00 00 00 00
0b80: 00 00 00 00 00 00 00 00 00 00 00 00 00 00 00 00
0b90: 00 00 00 00 00 00 00 00 00 00 00 00 00 00 00 00
0ba0: 00 00 00 00 00 00 00 00 00 00 00 00 00 00 00 00
0bb0: 00 00 00 00 00 00 00 00 00 00 00 00 00 00 00 00
0bc0: 00 00 00 00 00 00 00 00 00 00 00 00 00 00 00 00
0bd0: 00 00 00 00 00 00 00 00 00 00 00 00 00 00 00 00
0be0: 00 00 00 00 00 00 00 00 00 00 00 00 00 00 00 00
0bf0: 00 00 00 00 00 00 00 00 00 00 00 00 00 00 00 00
0c00: 00 00 00 00 00 00 00 00 00 00 00 00 00 00 00 00
0c10: 00 00 00 00 00 00 00 00 00 00 00 00 00 00 00 00
0c20: 00 00 00 00 20 10 84 a0 91 a0 03 00 00 00 00 00
0c30: 00 00 00 00 00 00 00 00 02 04 00 18 00 00 00 00
0c40: f1 3f 00 00 f2 3f 00 00 00 00 00 00 a8 00 00 00
0c50: 40 00 00 00 00 00 00 00 00 00 00 00 00 00 00 00
0c60: 00 00 00 00 00 00 00 00 00 00 00 00 00 00 00 00
0c70: 00 00 00 00 00 00 00 00 00 00 00 00 00 00 00 00
0c80: 00 00 00 00 00 00 00 00 00 00 00 00 00 00 00 00
0c90: 00 00 00 00 00 00 00 00 00 00 00 00 00 00 00 00
0ca0: 00 00 00 00 00 00 00 00 00 00 00 00 00 00 00 00
0cb0: 00 00 00 00 00 00 00 00 00 00 00 00 00 00 00 00
0cc0: 00 00 00 00 00 00 00 00 00 00 00 00 01 00 00 00
0cd0: 5e 01 00 00 5e 01 00 50 00 00 00 00 00 00 00 00
0ce0: 01 00 00 00 00 00 00 00 00 00 00 00 00 00 00 00
0cf0: 00 00 00 00 00 00 00 00 00 00 00 00 00 00 00 00
0d00: 00 00 00 00 00 00 00 00 00 00 00 00 00 00 00 00
0d10: 00 00 ff ff 10 00 3e 00 00 00 00 00 40 00 00 00
0d20: 00 00 00 00 00 00 00 00 00 00 00 00 00 00 00 00
0d30: 00 00 00 00 5f 00 00 00 00 00 00 00 00 00 00 00
0d40: 00 00 00 00 00 00 00 00 00 00 00 00 00 00 00 00
0d50: 00 00 00 00 00 00 00 00 00 00 00 00 00 00 00 00
0d60: 00 00 00 00 00 00 00 00 00 00 00 00 e0 04 02 40
0d70: f5 ab 00 80 ec 46 01 00 0f 00 00 00 ff ff 05 00
0d80: 59 b4 26 f2 ff 0f ff 00 00 00 00 00 00 00 00 00
0d90: 00 00 00 00 19 00 01 00 00 00 00 00 00 00 00 00
0da0: 08 07 08 07 08 07 08 07 08 07 08 07 08 07 08 07
0db0: 08 07 08 07 08 07 08 07 08 07 08 07 08 07 08 07
0dc0: c0 fb 00 34 0a 10 37 00 36 02 f8 00 06 0e 20 36
0dd0: 80 b1 36 08 2e a2 d0 00 00 44 40 f9 80 4a 01 00
0de0: 00 00 00 00 00 00 00 00 00 00 00 00 00 00 00 00
0df0: 00 00 00 00 00 00 00 00 00 00 00 00 00 00 00 00
0e00: 00 00 00 00 00 00 00 00 00 00 00 00 00 00 00 a0
0e10: 00 00 00 00 00 00 00 00 00 00 00 00 00 00 00 80
0e20: 00 00 00 00 00 00 00 00 00 00 00 00 00 00 00 a0
0e30: 00 00 00 00 00 00 00 00 00 00 00 00 00 00 00 a0
0e40: 00 00 00 00 00 00 00 00 00 00 00 00 00 00 00 80
0e50: 00 00 00 00 00 00 00 00 00 00 00 00 00 00 00 a0
0e60: 00 00 00 00 00 00 00 00 00 00 00 00 00 00 00 80
0e70: 00 00 00 00 00 00 00 00 00 00 00 00 00 00 00 80
0e80: 00 00 00 00 00 00 00 00 00 00 00 00 00 00 00 a0
0e90: 00 00 00 00 00 00 00 00 00 00 00 00 00 00 00 a0
0ea0: 00 00 00 00 00 00 00 00 00 00 00 00 00 00 00 80
0eb0: 00 00 00 00 00 00 00 00 00 00 00 00 00 00 00 80
0ec0: 00 00 00 00 00 00 00 00 00 00 00 00 00 00 00 a0
0ed0: 00 00 00 00 00 00 00 00 00 00 00 00 00 00 00 a0
0ee0: 00 00 00 00 00 00 00 00 00 00 00 00 00 00 00 80
0ef0: 00 00 00 00 00 00 00 00 00 00 00 00 00 00 00 80
0f00: 00 00 00 00 00 00 00 00 00 00 00 00 00 00 00 00
0f10: 00 00 00 00 00 00 00 00 00 00 00 00 00 00 00 00
0f20: 00 00 00 00 00 00 00 00 00 00 00 00 00 00 00 00
0f30: 00 00 00 00 00 00 00 00 00 00 00 00 00 00 00 00
0f40: 00 00 00 00 00 00 00 00 00 00 00 00 00 00 00 00
0f50: 00 00 00 00 00 00 00 00 00 00 00 00 00 00 00 00
0f60: 00 00 00 00 00 00 00 00 00 00 00 00 00 00 00 00
0f70: 00 00 00 00 00 00 00 00 00 00 00 00 00 00 00 00
0f80: 00 00 00 00 00 00 00 00 00 00 00 00 00 00 00 00
0f90: 00 00 00 00 00 00 00 00 00 00 00 00 00 00 00 00
0fa0: 00 00 00 00 00 00 00 00 00 00 00 00 00 00 00 00
0fb0: 00 00 00 00 00 00 00 00 00 00 00 00 00 00 00 00
0fc0: 00 00 00 00 00 00 00 00 00 00 00 00 00 00 00 00
0fd0: 00 00 00 00 00 00 00 00 00 00 00 00 00 00 00 00
0fe0: 00 00 00 00 00 00 00 00 00 00 00 00 00 00 00 00
0ff0: 00 00 00 00 00 00 00 00 00 00 00 00 00 00 00 00

PCIe 00:19.0 extended config space:
0000: 86 80 03 15 07 05 10 00 05 00 00 02 00 00 00 00
0010: 00 00 b0 7f 00 40 b2 7f 01 30 00 00 00 00 00 00
0020: 00 00 00 00 00 00 00 00 00 00 00 00 86 80 02 20
0030: 00 00 00 00 c8 00 00 00 00 00 00 00 ff 01 00 00
0040: 00 00 00 00 00 00 00 00 00 00 00 00 00 00 00 00
0050: 00 00 00 00 00 00 00 00 00 00 00 00 00 00 00 00
0060: 00 00 00 00 00 00 00 00 00 00 00 00 00 00 00 00
0070: 00 00 00 00 00 00 00 00 00 00 00 00 00 00 00 00
0080: 00 00 00 00 00 00 00 00 00 00 00 00 00 00 00 00
0090: 00 00 00 00 00 00 00 00 00 00 00 00 00 00 00 00
00a0: 00 00 00 00 00 00 00 00 00 00 00 00 00 00 00 00
00b0: 00 00 00 00 00 00 00 00 00 00 00 00 00 00 00 00
00c0: 00 00 00 00 00 00 00 00 01 d0 22 c8 00 20 00 07
00d0: 05 e0 81 00 04 20 e0 fe 00 00 00 00 23 00 00 00
00e0: 13 00 06 03 00 00 00 00 00 00 00 00 00 00 00 00
00f0: 00 00 00 00 00 00 00 00 00 00 00 00 00 00 00 00
0100: 00 00 00 00 00 00 00 00 00 00 00 00 00 00 00 00
0110: 00 00 00 00 00 00 00 00 00 00 00 00 00 00 00 00
0120: 00 00 00 00 00 00 00 00 00 00 00 00 00 00 00 00
0130: 00 00 00 00 00 00 00 00 00 00 00 00 00 00 00 00
0140: 00 00 00 00 00 00 00 00 00 00 00 00 00 00 00 00
0150: 00 00 00 00 00 00 00 00 00 00 00 00 00 00 00 00
0160: 00 00 00 00 00 00 00 00 00 00 00 00 00 00 00 00
0170: 00 00 00 00 00 00 00 00 00 00 00 00 00 00 00 00
0180: 00 00 00 00 00 00 00 00 00 00 00 00 00 00 00 00
0190: 00 00 00 00 00 00 00 00 00 00 00 00 00 00 00 00
01a0: 00 00 00 00 00 00 00 00 00 00 00 00 00 00 00 00
01b0: 00 00 00 00 00 00 00 00 00 00 00 00 00 00 00 00
01c0: 00 00 00 00 00 00 00 00 00 00 00 00 00 00 00 00
01d0: 00 00 00 00 00 00 00 00 00 00 00 00 00 00 00 00
01e0: 00 00 00 00 00 00 00 00 00 00 00 00 00 00 00 00
01f0: 00 00 00 00 00 00 00 00 00 00 00 00 00 00 00 00
0200: 00 00 00 00 00 00 00 00 00 00 00 00 00 00 00 00
0210: 00 00 00 00 00 00 00 00 00 00 00 00 00 00 00 00
0220: 00 00 00 00 00 00 00 00 00 00 00 00 00 00 00 00
0230: 00 00 00 00 00 00 00 00 00 00 00 00 00 00 00 00
0240: 00 00 00 00 00 00 00 00 00 00 00 00 00 00 00 00
0250: 00 00 00 00 00 00 00 00 00 00 00 00 00 00 00 00
0260: 00 00 00 00 00 00 00 00 00 00 00 00 00 00 00 00
0270: 00 00 00 00 00 00 00 00 00 00 00 00 00 00 00 00
0280: 00 00 00 00 00 00 00 00 00 00 00 00 00 00 00 00
0290: 00 00 00 00 00 00 00 00 00 00 00 00 00 00 00 00
02a0: 00 00 00 00 00 00 00 00 00 00 00 00 00 00 00 00
02b0: 00 00 00 00 00 00 00 00 00 00 00 00 00 00 00 00
02c0: 00 00 00 00 00 00 00 00 00 00 00 00 00 00 00 00
02d0: 00 00 00 00 00 00 00 00 00 00 00 00 00 00 00 00
02e0: 00 00 00 00 00 00 00 00 00 00 00 00 00 00 00 00
02f0: 00 00 00 00 00 00 00 00 00 00 00 00 00 00 00 00
0300: 00 00 00 00 00 00 00 00 00 00 00 00 00 00 00 00
0310: 00 00 00 00 00 00 00 00 00 00 00 00 00 00 00 00
0320: 00 00 00 00 00 00 00 00 00 00 00 00 00 00 00 00
0330: 00 00 00 00 00 00 00 00 00 00 00 00 00 00 00 00
0340: 00 00 00 00 00 00 00 00 00 00 00 00 00 00 00 00
0350: 00 00 00 00 00 00 00 00 00 00 00 00 00 00 00 00
0360: 00 00 00 00 00 00 00 00 00 00 00 00 00 00 00 00
0370: 00 00 00 00 00 00 00 00 00 00 00 00 00 00 00 00
0380: 00 00 00 00 00 00 00 00 00 00 00 00 00 00 00 00
0390: 00 00 00 00 00 00 00 00 00 00 00 00 00 00 00 00
03a0: 00 00 00 00 00 00 00 00 00 00 00 00 00 00 00 00
03b0: 00 00 00 00 00 00 00 00 00 00 00 00 00 00 00 00
03c0: 00 00 00 00 00 00 00 00 00 00 00 00 00 00 00 00
03d0: 00 00 00 00 00 00 00 00 00 00 00 00 00 00 00 00
03e0: 00 00 00 00 00 00 00 00 00 00 00 00 00 00 00 00
03f0: 00 00 00 00 00 00 00 00 00 00 00 00 00 00 00 00
0400: 00 00 00 00 00 00 00 00 00 00 00 00 00 00 00 00
0410: 00 00 00 00 00 00 00 00 00 00 00 00 00 00 00 00
0420: 00 00 00 00 00 00 00 00 00 00 00 00 00 00 00 00
0430: 00 00 00 00 00 00 00 00 00 00 00 00 00 00 00 00
0440: 00 00 00 00 00 00 00 00 00 00 00 00 00 00 00 00
0450: 00 00 00 00 00 00 00 00 00 00 00 00 00 00 00 00
0460: 00 00 00 00 00 00 00 00 00 00 00 00 00 00 00 00
0470: 00 00 00 00 00 00 00 00 00 00 00 00 00 00 00 00
0480: 00 00 00 00 00 00 00 00 00 00 00 00 00 00 00 00
0490: 00 00 00 00 00 00 00 00 00 00 00 00 00 00 00 00
04a0: 00 00 00 00 00 00 00 00 00 00 00 00 00 00 00 00
04b0: 00 00 00 00 00 00 00 00 00 00 00 00 00 00 00 00
04c0: 00 00 00 00 00 00 00 00 00 00 00 00 00 00 00 00
04d0: 00 00 00 00 00 00 00 00 00 00 00 00 00 00 00 00
04e0: 00 00 00 00 00 00 00 00 00 00 00 00 00 00 00 00
04f0: 00 00 00 00 00 00 00 00 00 00 00 00 00 00 00 00
0500: 00 00 00 00 00 00 00 00 00 00 00 00 00 00 00 00
0510: 00 00 00 00 00 00 00 00 00 00 00 00 00 00 00 00
0520: 00 00 00 00 00 00 00 00 00 00 00 00 00 00 00 00
0530: 00 00 00 00 00 00 00 00 00 00 00 00 00 00 00 00
0540: 00 00 00 00 00 00 00 00 00 00 00 00 00 00 00 00
0550: 00 00 00 00 00 00 00 00 00 00 00 00 00 00 00 00
0560: 00 00 00 00 00 00 00 00 00 00 00 00 00 00 00 00
0570: 00 00 00 00 00 00 00 00 00 00 00 00 00 00 00 00
0580: 00 00 00 00 00 00 00 00 00 00 00 00 00 00 00 00
0590: 00 00 00 00 00 00 00 00 00 00 00 00 00 00 00 00
05a0: 00 00 00 00 00 00 00 00 00 00 00 00 00 00 00 00
05b0: 00 00 00 00 00 00 00 00 00 00 00 00 00 00 00 00
05c0: 00 00 00 00 00 00 00 00 00 00 00 00 00 00 00 00
05d0: 00 00 00 00 00 00 00 00 00 00 00 00 00 00 00 00
05e0: 00 00 00 00 00 00 00 00 00 00 00 00 00 00 00 00
05f0: 00 00 00 00 00 00 00 00 00 00 00 00 00 00 00 00
0600: 00 00 00 00 00 00 00 00 00 00 00 00 00 00 00 00
0610: 00 00 00 00 00 00 00 00 00 00 00 00 00 00 00 00
0620: 00 00 00 00 00 00 00 00 00 00 00 00 00 00 00 00
0630: 00 00 00 00 00 00 00 00 00 00 00 00 00 00 00 00
0640: 00 00 00 00 00 00 00 00 00 00 00 00 00 00 00 00
0650: 00 00 00 00 00 00 00 00 00 00 00 00 00 00 00 00
0660: 00 00 00 00 00 00 00 00 00 00 00 00 00 00 00 00
0670: 00 00 00 00 00 00 00 00 00 00 00 00 00 00 00 00
0680: 00 00 00 00 00 00 00 00 00 00 00 00 00 00 00 00
0690: 00 00 00 00 00 00 00 00 00 00 00 00 00 00 00 00
06a0: 00 00 00 00 00 00 00 00 00 00 00 00 00 00 00 00
06b0: 00 00 00 00 00 00 00 00 00 00 00 00 00 00 00 00
06c0: 00 00 00 00 00 00 00 00 00 00 00 00 00 00 00 00
06d0: 00 00 00 00 00 00 00 00 00 00 00 00 00 00 00 00
06e0: 00 00 00 00 00 00 00 00 00 00 00 00 00 00 00 00
06f0: 00 00 00 00 00 00 00 00 00 00 00 00 00 00 00 00
0700: 00 00 00 00 00 00 00 00 00 00 00 00 00 00 00 00
0710: 00 00 00 00 00 00 00 00 00 00 00 00 00 00 00 00
0720: 00 00 00 00 00 00 00 00 00 00 00 00 00 00 00 00
0730: 00 00 00 00 00 00 00 00 00 00 00 00 00 00 00 00
0740: 00 00 00 00 00 00 00 00 00 00 00 00 00 00 00 00
0750: 00 00 00 00 00 00 00 00 00 00 00 00 00 00 00 00
0760: 00 00 00 00 00 00 00 00 00 00 00 00 00 00 00 00
0770: 00 00 00 00 00 00 00 00 00 00 00 00 00 00 00 00
0780: 00 00 00 00 00 00 00 00 00 00 00 00 00 00 00 00
0790: 00 00 00 00 00 00 00 00 00 00 00 00 00 00 00 00
07a0: 00 00 00 00 00 00 00 00 00 00 00 00 00 00 00 00
07b0: 00 00 00 00 00 00 00 00 00 00 00 00 00 00 00 00
07c0: 00 00 00 00 00 00 00 00 00 00 00 00 00 00 00 00
07d0: 00 00 00 00 00 00 00 00 00 00 00 00 00 00 00 00
07e0: 00 00 00 00 00 00 00 00 00 00 00 00 00 00 00 00
07f0: 00 00 00 00 00 00 00 00 00 00 00 00 00 00 00 00
0800: 00 00 00 00 00 00 00 00 00 00 00 00 00 00 00 00
0810: 00 00 00 00 00 00 00 00 00 00 00 00 00 00 00 00
0820: 00 00 00 00 00 00 00 00 00 00 00 00 00 00 00 00
0830: 00 00 00 00 00 00 00 00 00 00 00 00 00 00 00 00
0840: 00 00 00 00 00 00 00 00 00 00 00 00 00 00 00 00
0850: 00 00 00 00 00 00 00 00 00 00 00 00 00 00 00 00
0860: 00 00 00 00 00 00 00 00 00 00 00 00 00 00 00 00
0870: 00 00 00 00 00 00 00 00 00 00 00 00 00 00 00 00
0880: 00 00 00 00 00 00 00 00 00 00 00 00 00 00 00 00
0890: 00 00 00 00 00 00 00 00 00 00 00 00 00 00 00 00
08a0: 00 00 00 00 00 00 00 00 00 00 00 00 00 00 00 00
08b0: 00 00 00 00 00 00 00 00 00 00 00 00 00 00 00 00
08c0: 00 00 00 00 00 00 00 00 00 00 00 00 00 00 00 00
08d0: 00 00 00 00 00 00 00 00 00 00 00 00 00 00 00 00
08e0: 00 00 00 00 00 00 00 00 00 00 00 00 00 00 00 00
08f0: 00 00 00 00 00 00 00 00 00 00 00 00 00 00 00 00
0900: 00 00 00 00 00 00 00 00 00 00 00 00 00 00 00 00
0910: 00 00 00 00 00 00 00 00 00 00 00 00 00 00 00 00
0920: 00 00 00 00 00 00 00 00 00 00 00 00 00 00 00 00
0930: 00 00 00 00 00 00 00 00 00 00 00 00 00 00 00 00
0940: 00 00 00 00 00 00 00 00 00 00 00 00 00 00 00 00
0950: 00 00 00 00 00 00 00 00 00 00 00 00 00 00 00 00
0960: 00 00 00 00 00 00 00 00 00 00 00 00 00 00 00 00
0970: 00 00 00 00 00 00 00 00 00 00 00 00 00 00 00 00
0980: 00 00 00 00 00 00 00 00 00 00 00 00 00 00 00 00
0990: 00 00 00 00 00 00 00 00 00 00 00 00 00 00 00 00
09a0: 00 00 00 00 00 00 00 00 00 00 00 00 00 00 00 00
09b0: 00 00 00 00 00 00 00 00 00 00 00 00 00 00 00 00
09c0: 00 00 00 00 00 00 00 00 00 00 00 00 00 00 00 00
09d0: 00 00 00 00 00 00 00 00 00 00 00 00 00 00 00 00
09e0: 00 00 00 00 00 00 00 00 00 00 00 00 00 00 00 00
09f0: 00 00 00 00 00 00 00 00 00 00 00 00 00 00 00 00
0a00: 00 00 00 00 00 00 00 00 00 00 00 00 00 00 00 00
0a10: 00 00 00 00 00 00 00 00 00 00 00 00 00 00 00 00
0a20: 00 00 00 00 00 00 00 00 00 00 00 00 00 00 00 00
0a30: 00 00 00 00 00 00 00 00 00 00 00 00 00 00 00 00
0a40: 00 00 00 00 00 00 00 00 00 00 00 00 00 00 00 00
0a50: 00 00 00 00 00 00 00 00 00 00 00 00 00 00 00 00
0a60: 00 00 00 00 00 00 00 00 00 00 00 00 00 00 00 00
0a70: 00 00 00 00 00 00 00 00 00 00 00 00 00 00 00 00
0a80: 00 00 00 00 00 00 00 00 00 00 00 00 00 00 00 00
0a90: 00 00 00 00 00 00 00 00 00 00 00 00 00 00 00 00
0aa0: 00 00 00 00 00 00 00 00 00 00 00 00 00 00 00 00
0ab0: 00 00 00 00 00 00 00 00 00 00 00 00 00 00 00 00
0ac0: 00 00 00 00 00 00 00 00 00 00 00 00 00 00 00 00
0ad0: 00 00 00 00 00 00 00 00 00 00 00 00 00 00 00 00
0ae0: 00 00 00 00 00 00 00 00 00 00 00 00 00 00 00 00
0af0: 00 00 00 00 00 00 00 00 00 00 00 00 00 00 00 00
0b00: 00 00 00 00 00 00 00 00 00 00 00 00 00 00 00 00
0b10: 00 00 00 00 00 00 00 00 00 00 00 00 00 00 00 00
0b20: 00 00 00 00 00 00 00 00 00 00 00 00 00 00 00 00
0b30: 00 00 00 00 00 00 00 00 00 00 00 00 00 00 00 00
0b40: 00 00 00 00 00 00 00 00 00 00 00 00 00 00 00 00
0b50: 00 00 00 00 00 00 00 00 00 00 00 00 00 00 00 00
0b60: 00 00 00 00 00 00 00 00 00 00 00 00 00 00 00 00
0b70: 00 00 00 00 00 00 00 00 00 00 00 00 00 00 00 00
0b80: 00 00 00 00 00 00 00 00 00 00 00 00 00 00 00 00
0b90: 00 00 00 00 00 00 00 00 00 00 00 00 00 00 00 00
0ba0: 00 00 00 00 00 00 00 00 00 00 00 00 00 00 00 00
0bb0: 00 00 00 00 00 00 00 00 00 00 00 00 00 00 00 00
0bc0: 00 00 00 00 00 00 00 00 00 00 00 00 00 00 00 00
0bd0: 00 00 00 00 00 00 00 00 00 00 00 00 00 00 00 00
0be0: 00 00 00 00 00 00 00 00 00 00 00 00 00 00 00 00
0bf0: 00 00 00 00 00 00 00 00 00 00 00 00 00 00 00 00
0c00: 00 00 00 00 00 00 00 00 00 00 00 00 00 00 00 00
0c10: 00 00 00 00 00 00 00 00 00 00 00 00 00 00 00 00
0c20: 00 00 00 00 00 00 00 00 00 00 00 00 00 00 00 00
0c30: 00 00 00 00 00 00 00 00 00 00 00 00 00 00 00 00
0c40: 00 00 00 00 00 00 00 00 00 00 00 00 00 00 00 00
0c50: 00 00 00 00 00 00 00 00 00 00 00 00 00 00 00 00
0c60: 00 00 00 00 00 00 00 00 00 00 00 00 00 00 00 00
0c70: 00 00 00 00 00 00 00 00 00 00 00 00 00 00 00 00
0c80: 00 00 00 00 00 00 00 00 00 00 00 00 00 00 00 00
0c90: 00 00 00 00 00 00 00 00 00 00 00 00 00 00 00 00
0ca0: 00 00 00 00 00 00 00 00 00 00 00 00 00 00 00 00
0cb0: 00 00 00 00 00 00 00 00 00 00 00 00 00 00 00 00
0cc0: 00 00 00 00 00 00 00 00 00 00 00 00 00 00 00 00
0cd0: 00 00 00 00 00 00 00 00 00 00 00 00 00 00 00 00
0ce0: 00 00 00 00 00 00 00 00 00 00 00 00 00 00 00 00
0cf0: 00 00 00 00 00 00 00 00 00 00 00 00 00 00 00 00
0d00: 00 00 00 00 00 00 00 00 00 00 00 00 00 00 00 00
0d10: 00 00 00 00 00 00 00 00 00 00 00 00 00 00 00 00
0d20: 00 00 00 00 00 00 00 00 00 00 00 00 00 00 00 00
0d30: 00 00 00 00 00 00 00 00 00 00 00 00 00 00 00 00
0d40: 00 00 00 00 00 00 00 00 00 00 00 00 00 00 00 00
0d50: 00 00 00 00 00 00 00 00 00 00 00 00 00 00 00 00
0d60: 00 00 00 00 00 00 00 00 00 00 00 00 00 00 00 00
0d70: 00 00 00 00 00 00 00 00 00 00 00 00 00 00 00 00
0d80: 00 00 00 00 00 00 00 00 00 00 00 00 00 00 00 00
0d90: 00 00 00 00 00 00 00 00 00 00 00 00 00 00 00 00
0da0: 00 00 00 00 00 00 00 00 00 00 00 00 00 00 00 00
0db0: 00 00 00 00 00 00 00 00 00 00 00 00 00 00 00 00
0dc0: 00 00 00 00 00 00 00 00 00 00 00 00 00 00 00 00
0dd0: 00 00 00 00 00 00 00 00 00 00 00 00 00 00 00 00
0de0: 00 00 00 00 00 00 00 00 00 00 00 00 00 00 00 00
0df0: 00 00 00 00 00 00 00 00 00 00 00 00 00 00 00 00
0e00: 00 00 00 00 00 00 00 00 00 00 00 00 00 00 00 00
0e10: 00 00 00 00 00 00 00 00 00 00 00 00 00 00 00 00
0e20: 00 00 00 00 00 00 00 00 00 00 00 00 00 00 00 00
0e30: 00 00 00 00 00 00 00 00 00 00 00 00 00 00 00 00
0e40: 00 00 00 00 00 00 00 00 00 00 00 00 00 00 00 00
0e50: 00 00 00 00 00 00 00 00 00 00 00 00 00 00 00 00
0e60: 00 00 00 00 00 00 00 00 00 00 00 00 00 00 00 00
0e70: 00 00 00 00 00 00 00 00 00 00 00 00 00 00 00 00
0e80: 00 00 00 00 00 00 00 00 00 00 00 00 00 00 00 00
0e90: 00 00 00 00 00 00 00 00 00 00 00 00 00 00 00 00
0ea0: 00 00 00 00 00 00 00 00 00 00 00 00 00 00 00 00
0eb0: 00 00 00 00 00 00 00 00 00 00 00 00 00 00 00 00
0ec0: 00 00 00 00 00 00 00 00 00 00 00 00 00 00 00 00
0ed0: 00 00 00 00 00 00 00 00 00 00 00 00 00 00 00 00
0ee0: 00 00 00 00 00 00 00 00 00 00 00 00 00 00 00 00
0ef0: 00 00 00 00 00 00 00 00 00 00 00 00 00 00 00 00
0f00: 00 00 00 00 00 00 00 00 00 00 00 00 00 00 00 00
0f10: 00 00 00 00 00 00 00 00 00 00 00 00 00 00 00 00
0f20: 00 00 00 00 00 00 00 00 00 00 00 00 00 00 00 00
0f30: 00 00 00 00 00 00 00 00 00 00 00 00 00 00 00 00
0f40: 00 00 00 00 00 00 00 00 00 00 00 00 00 00 00 00
0f50: 00 00 00 00 00 00 00 00 00 00 00 00 00 00 00 00
0f60: 00 00 00 00 00 00 00 00 00 00 00 00 00 00 00 00
0f70: 00 00 00 00 00 00 00 00 00 00 00 00 00 00 00 00
0f80: 00 00 00 00 00 00 00 00 00 00 00 00 00 00 00 00
0f90: 00 00 00 00 00 00 00 00 00 00 00 00 00 00 00 00
0fa0: 00 00 00 00 00 00 00 00 00 00 00 00 00 00 00 00
0fb0: 00 00 00 00 00 00 00 00 00 00 00 00 00 00 00 00
0fc0: 00 00 00 00 00 00 00 00 00 00 00 00 00 00 00 00
0fd0: 00 00 00 00 00 00 00 00 00 00 00 00 00 00 00 00
0fe0: 00 00 00 00 00 00 00 00 00 00 00 00 00 00 00 00
0ff0: 00 00 00 00 00 00 00 00 00 00 00 00 00 00 00 00

PCIe 00:1b.0 extended config space:
0000: 86 80 20 1c 06 05 10 00 05 00 03 04 10 00 00 00
0010: 04 00 b2 7f 00 00 00 00 00 00 00 00 00 00 00 00
0020: 00 00 00 00 00 00 00 00 00 00 00 00 86 80 01 20
0030: 00 00 00 00 50 00 00 00 00 00 00 00 ff 01 00 00
0040: 01 00 00 45 00 00 00 00 00 00 00 00 00 00 00 00
0050: 01 60 42 c8 00 00 00 00 00 00 00 00 00 00 00 00
0060: 05 70 81 00 04 20 e0 fe 00 00 00 00 26 00 00 00
0070: 10 00 91 00 00 00 00 10 00 00 10 00 00 00 00 00
0080: 00 00 00 00 00 00 00 00 00 00 00 00 00 00 00 00
0090: 00 00 00 00 00 00 00 00 00 00 00 00 00 00 00 00
00a0: 00 00 00 00 00 00 00 00 00 00 00 00 00 00 00 00
00b0: 00 00 00 00 00 00 00 00 00 00 00 00 00 00 00 00
00c0: 00 04 00 01 02 24 00 40 00 0c a3 82 10 00 33 02
00d0: 00 0c a3 02 10 00 33 02 00 00 00 00 00 00 00 00
00e0: 00 00 00 00 00 00 00 00 00 00 00 00 00 00 00 00
00f0: 00 00 00 00 00 00 00 00 87 0f 06 08 00 00 00 00
0100: 02 00 01 13 01 00 00 00 00 00 00 00 00 00 00 00
0110: 00 00 00 00 01 00 00 80 00 00 00 00 00 00 00 00
0120: 44 00 00 81 00 00 00 00 00 00 00 00 00 00 00 00
0130: 05 00 01 00 00 01 00 0f 00 00 00 00 00 00 00 00
0140: 01 00 00 00 00 00 00 00 00 c0 d1 fe 00 00 00 00
0150: 00 00 00 00 00 00 00 00 00 00 00 00 00 00 00 00
0160: 00 00 00 00 00 00 00 00 00 00 00 00 00 00 00 00
0170: 00 00 00 00 00 00 00 00 00 00 00 00 00 00 00 00
0180: 00 00 00 00 00 00 00 00 00 00 00 00 00 00 00 00
0190: 00 00 00 00 00 00 00 00 00 00 00 00 00 00 00 00
01a0: 00 00 00 00 00 00 00 00 00 00 00 00 00 00 00 00
01b0: 00 00 00 00 00 00 00 00 00 00 00 00 00 00 00 00
01c0: 00 00 00 00 00 00 00 00 00 00 00 00 00 00 00 00
01d0: 00 00 00 00 00 00 00 00 00 00 00 00 00 00 00 00
01e0: 00 00 00 00 00 00 00 00 00 00 00 00 00 00 00 00
01f0: 00 00 00 00 00 00 00 00 00 00 00 00 00 00 00 00
0200: 00 00 00 00 00 00 00 00 00 00 00 00 00 00 00 00
0210: 00 00 00 00 00 00 00 00 00 00 00 00 00 00 00 00
0220: 00 00 00 00 00 00 00 00 00 00 00 00 00 00 00 00
0230: 00 00 00 00 00 00 00 00 00 00 00 00 00 00 00 00
0240: 00 00 00 00 00 00 00 00 00 00 00 00 00 00 00 00
0250: 00 00 00 00 00 00 00 00 00 00 00 00 00 00 00 00
0260: 00 00 00 00 00 00 00 00 00 00 00 00 00 00 00 00
0270: 00 00 00 00 00 00 00 00 00 00 00 00 00 00 00 00
0280: 00 00 00 00 00 00 00 00 00 00 00 00 00 00 00 00
0290: 00 00 00 00 00 00 00 00 00 00 00 00 00 00 00 00
02a0: 00 00 00 00 00 00 00 00 00 00 00 00 00 00 00 00
02b0: 00 00 00 00 00 00 00 00 00 00 00 00 00 00 00 00
02c0: 00 00 00 00 00 00 00 00 00 00 00 00 00 00 00 00
02d0: 00 00 00 00 00 00 00 00 00 00 00 00 00 00 00 00
02e0: 00 00 00 00 00 00 00 00 00 00 00 00 00 00 00 00
02f0: 00 00 00 00 00 00 00 00 00 00 00 00 00 00 00 00
0300: 00 00 00 00 00 00 00 00 00 00 00 00 00 00 00 00
0310: 00 00 00 00 00 00 00 00 00 00 00 00 00 00 00 00
0320: 00 00 00 00 00 00 00 00 00 00 00 00 00 00 00 00
0330: 00 00 00 00 00 00 00 00 00 00 00 00 00 00 00 00
0340: 00 00 00 00 00 00 00 00 00 00 00 00 00 00 00 00
0350: 00 00 00 00 00 00 00 00 00 00 00 00 00 00 00 00
0360: 00 00 00 00 00 00 00 00 00 00 00 00 00 00 00 00
0370: 00 00 00 00 00 00 00 00 00 00 00 00 00 00 00 00
0380: 00 00 00 00 00 00 00 00 00 00 00 00 00 00 00 00
0390: 00 00 00 00 00 00 00 00 00 00 00 00 00 00 00 00
03a0: 00 00 00 00 00 00 00 00 00 00 00 00 00 00 00 00
03b0: 00 00 00 00 00 00 00 00 00 00 00 00 00 00 00 00
03c0: 00 00 00 00 00 00 00 00 00 00 00 00 00 00 00 00
03d0: 00 00 00 00 00 00 00 00 00 00 00 00 00 00 00 00
03e0: 00 00 00 00 00 00 00 00 00 00 00 00 00 00 00 00
03f0: 00 00 00 00 00 00 00 00 00 00 00 00 00 00 00 00
0400: 00 00 00 00 00 00 00 00 00 00 00 00 00 00 00 00
0410: 00 00 00 00 00 00 00 00 00 00 00 00 00 00 00 00
0420: 00 00 00 00 00 00 00 00 00 00 00 00 00 00 00 00
0430: 00 00 00 00 00 00 00 00 00 00 00 00 00 00 00 00
0440: 00 00 00 00 00 00 00 00 00 00 00 00 00 00 00 00
0450: 00 00 00 00 00 00 00 00 00 00 00 00 00 00 00 00
0460: 00 00 00 00 00 00 00 00 00 00 00 00 00 00 00 00
0470: 00 00 00 00 00 00 00 00 00 00 00 00 00 00 00 00
0480: 00 00 00 00 00 00 00 00 00 00 00 00 00 00 00 00
0490: 00 00 00 00 00 00 00 00 00 00 00 00 00 00 00 00
04a0: 00 00 00 00 00 00 00 00 00 00 00 00 00 00 00 00
04b0: 00 00 00 00 00 00 00 00 00 00 00 00 00 00 00 00
04c0: 00 00 00 00 00 00 00 00 00 00 00 00 00 00 00 00
04d0: 00 00 00 00 00 00 00 00 00 00 00 00 00 00 00 00
04e0: 00 00 00 00 00 00 00 00 00 00 00 00 00 00 00 00
04f0: 00 00 00 00 00 00 00 00 00 00 00 00 00 00 00 00
0500: 00 00 00 00 00 00 00 00 00 00 00 00 00 00 00 00
0510: 00 00 00 00 00 00 00 00 00 00 00 00 00 00 00 00
0520: 00 00 00 00 00 00 00 00 00 00 00 00 00 00 00 00
0530: 00 00 00 00 00 00 00 00 00 00 00 00 00 00 00 00
0540: 00 00 00 00 00 00 00 00 00 00 00 00 00 00 00 00
0550: 00 00 00 00 00 00 00 00 00 00 00 00 00 00 00 00
0560: 00 00 00 00 00 00 00 00 00 00 00 00 00 00 00 00
0570: 00 00 00 00 00 00 00 00 00 00 00 00 00 00 00 00
0580: 00 00 00 00 00 00 00 00 00 00 00 00 00 00 00 00
0590: 00 00 00 00 00 00 00 00 00 00 00 00 00 00 00 00
05a0: 00 00 00 00 00 00 00 00 00 00 00 00 00 00 00 00
05b0: 00 00 00 00 00 00 00 00 00 00 00 00 00 00 00 00
05c0: 00 00 00 00 00 00 00 00 00 00 00 00 00 00 00 00
05d0: 00 00 00 00 00 00 00 00 00 00 00 00 00 00 00 00
05e0: 00 00 00 00 00 00 00 00 00 00 00 00 00 00 00 00
05f0: 00 00 00 00 00 00 00 00 00 00 00 00 00 00 00 00
0600: 00 00 00 00 00 00 00 00 00 00 00 00 00 00 00 00
0610: 00 00 00 00 00 00 00 00 00 00 00 00 00 00 00 00
0620: 00 00 00 00 00 00 00 00 00 00 00 00 00 00 00 00
0630: 00 00 00 00 00 00 00 00 00 00 00 00 00 00 00 00
0640: 00 00 00 00 00 00 00 00 00 00 00 00 00 00 00 00
0650: 00 00 00 00 00 00 00 00 00 00 00 00 00 00 00 00
0660: 00 00 00 00 00 00 00 00 00 00 00 00 00 00 00 00
0670: 00 00 00 00 00 00 00 00 00 00 00 00 00 00 00 00
0680: 00 00 00 00 00 00 00 00 00 00 00 00 00 00 00 00
0690: 00 00 00 00 00 00 00 00 00 00 00 00 00 00 00 00
06a0: 00 00 00 00 00 00 00 00 00 00 00 00 00 00 00 00
06b0: 00 00 00 00 00 00 00 00 00 00 00 00 00 00 00 00
06c0: 00 00 00 00 00 00 00 00 00 00 00 00 00 00 00 00
06d0: 00 00 00 00 00 00 00 00 00 00 00 00 00 00 00 00
06e0: 00 00 00 00 00 00 00 00 00 00 00 00 00 00 00 00
06f0: 00 00 00 00 00 00 00 00 00 00 00 00 00 00 00 00
0700: 00 00 00 00 00 00 00 00 00 00 00 00 00 00 00 00
0710: 00 00 00 00 00 00 00 00 00 00 00 00 00 00 00 00
0720: 00 00 00 00 00 00 00 00 00 00 00 00 00 00 00 00
0730: 00 00 00 00 00 00 00 00 00 00 00 00 00 00 00 00
0740: 00 00 00 00 00 00 00 00 00 00 00 00 00 00 00 00
0750: 00 00 00 00 00 00 00 00 00 00 00 00 00 00 00 00
0760: 00 00 00 00 00 00 00 00 00 00 00 00 00 00 00 00
0770: 00 00 00 00 00 00 00 00 00 00 00 00 00 00 00 00
0780: 00 00 00 00 00 00 00 00 00 00 00 00 00 00 00 00
0790: 00 00 00 00 00 00 00 00 00 00 00 00 00 00 00 00
07a0: 00 00 00 00 00 00 00 00 00 00 00 00 00 00 00 00
07b0: 00 00 00 00 00 00 00 00 00 00 00 00 00 00 00 00
07c0: 00 00 00 00 00 00 00 00 00 00 00 00 00 00 00 00
07d0: 00 00 00 00 00 00 00 00 00 00 00 00 00 00 00 00
07e0: 00 00 00 00 00 00 00 00 00 00 00 00 00 00 00 00
07f0: 00 00 00 00 00 00 00 00 00 00 00 00 00 00 00 00
0800: 00 00 00 00 00 00 00 00 00 00 00 00 00 00 00 00
0810: 00 00 00 00 00 00 00 00 00 00 00 00 00 00 00 00
0820: 00 00 00 00 00 00 00 00 00 00 00 00 00 00 00 00
0830: 00 00 00 00 00 00 00 00 00 00 00 00 00 00 00 00
0840: 00 00 00 00 00 00 00 00 00 00 00 00 00 00 00 00
0850: 00 00 00 00 00 00 00 00 00 00 00 00 00 00 00 00
0860: 00 00 00 00 00 00 00 00 00 00 00 00 00 00 00 00
0870: 00 00 00 00 00 00 00 00 00 00 00 00 00 00 00 00
0880: 00 00 00 00 00 00 00 00 00 00 00 00 00 00 00 00
0890: 00 00 00 00 00 00 00 00 00 00 00 00 00 00 00 00
08a0: 00 00 00 00 00 00 00 00 00 00 00 00 00 00 00 00
08b0: 00 00 00 00 00 00 00 00 00 00 00 00 00 00 00 00
08c0: 00 00 00 00 00 00 00 00 00 00 00 00 00 00 00 00
08d0: 00 00 00 00 00 00 00 00 00 00 00 00 00 00 00 00
08e0: 00 00 00 00 00 00 00 00 00 00 00 00 00 00 00 00
08f0: 00 00 00 00 00 00 00 00 00 00 00 00 00 00 00 00
0900: 00 00 00 00 00 00 00 00 00 00 00 00 00 00 00 00
0910: 00 00 00 00 00 00 00 00 00 00 00 00 00 00 00 00
0920: 00 00 00 00 00 00 00 00 00 00 00 00 00 00 00 00
0930: 00 00 00 00 00 00 00 00 00 00 00 00 00 00 00 00
0940: 00 00 00 00 00 00 00 00 00 00 00 00 00 00 00 00
0950: 00 00 00 00 00 00 00 00 00 00 00 00 00 00 00 00
0960: 00 00 00 00 00 00 00 00 00 00 00 00 00 00 00 00
0970: 00 00 00 00 00 00 00 00 00 00 00 00 00 00 00 00
0980: 00 00 00 00 00 00 00 00 00 00 00 00 00 00 00 00
0990: 00 00 00 00 00 00 00 00 00 00 00 00 00 00 00 00
09a0: 00 00 00 00 00 00 00 00 00 00 00 00 00 00 00 00
09b0: 00 00 00 00 00 00 00 00 00 00 00 00 00 00 00 00
09c0: 00 00 00 00 00 00 00 00 00 00 00 00 00 00 00 00
09d0: 00 00 00 00 00 00 00 00 00 00 00 00 00 00 00 00
09e0: 00 00 00 00 00 00 00 00 00 00 00 00 00 00 00 00
09f0: 00 00 00 00 00 00 00 00 00 00 00 00 00 00 00 00
0a00: 00 00 00 00 00 00 00 00 00 00 00 00 00 00 00 00
0a10: 00 00 00 00 00 00 00 00 00 00 00 00 00 00 00 00
0a20: 00 00 00 00 00 00 00 00 00 00 00 00 00 00 00 00
0a30: 00 00 00 00 00 00 00 00 00 00 00 00 00 00 00 00
0a40: 00 00 00 00 00 00 00 00 00 00 00 00 00 00 00 00
0a50: 00 00 00 00 00 00 00 00 00 00 00 00 00 00 00 00
0a60: 00 00 00 00 00 00 00 00 00 00 00 00 00 00 00 00
0a70: 00 00 00 00 00 00 00 00 00 00 00 00 00 00 00 00
0a80: 00 00 00 00 00 00 00 00 00 00 00 00 00 00 00 00
0a90: 00 00 00 00 00 00 00 00 00 00 00 00 00 00 00 00
0aa0: 00 00 00 00 00 00 00 00 00 00 00 00 00 00 00 00
0ab0: 00 00 00 00 00 00 00 00 00 00 00 00 00 00 00 00
0ac0: 00 00 00 00 00 00 00 00 00 00 00 00 00 00 00 00
0ad0: 00 00 00 00 00 00 00 00 00 00 00 00 00 00 00 00
0ae0: 00 00 00 00 00 00 00 00 00 00 00 00 00 00 00 00
0af0: 00 00 00 00 00 00 00 00 00 00 00 00 00 00 00 00
0b00: 00 00 00 00 00 00 00 00 00 00 00 00 00 00 00 00
0b10: 00 00 00 00 00 00 00 00 00 00 00 00 00 00 00 00
0b20: 00 00 00 00 00 00 00 00 00 00 00 00 00 00 00 00
0b30: 00 00 00 00 00 00 00 00 00 00 00 00 00 00 00 00
0b40: 00 00 00 00 00 00 00 00 00 00 00 00 00 00 00 00
0b50: 00 00 00 00 00 00 00 00 00 00 00 00 00 00 00 00
0b60: 00 00 00 00 00 00 00 00 00 00 00 00 00 00 00 00
0b70: 00 00 00 00 00 00 00 00 00 00 00 00 00 00 00 00
0b80: 00 00 00 00 00 00 00 00 00 00 00 00 00 00 00 00
0b90: 00 00 00 00 00 00 00 00 00 00 00 00 00 00 00 00
0ba0: 00 00 00 00 00 00 00 00 00 00 00 00 00 00 00 00
0bb0: 00 00 00 00 00 00 00 00 00 00 00 00 00 00 00 00
0bc0: 00 00 00 00 00 00 00 00 00 00 00 00 00 00 00 00
0bd0: 00 00 00 00 00 00 00 00 00 00 00 00 00 00 00 00
0be0: 00 00 00 00 00 00 00 00 00 00 00 00 00 00 00 00
0bf0: 00 00 00 00 00 00 00 00 00 00 00 00 00 00 00 00
0c00: 00 00 00 00 00 00 00 00 00 00 00 00 00 00 00 00
0c10: 00 00 00 00 00 00 00 00 00 00 00 00 00 00 00 00
0c20: 00 00 00 00 00 00 00 00 00 00 00 00 00 00 00 00
0c30: 00 00 00 00 00 00 00 00 00 00 00 00 00 00 00 00
0c40: 00 00 00 00 00 00 00 00 00 00 00 00 00 00 00 00
0c50: 00 00 00 00 00 00 00 00 00 00 00 00 00 00 00 00
0c60: 00 00 00 00 00 00 00 00 00 00 00 00 00 00 00 00
0c70: 00 00 00 00 00 00 00 00 00 00 00 00 00 00 00 00
0c80: 00 00 00 00 00 00 00 00 00 00 00 00 00 00 00 00
0c90: 00 00 00 00 00 00 00 00 00 00 00 00 00 00 00 00
0ca0: 00 00 00 00 00 00 00 00 00 00 00 00 00 00 00 00
0cb0: 00 00 00 00 00 00 00 00 00 00 00 00 00 00 00 00
0cc0: 00 00 00 00 00 00 00 00 00 00 00 00 00 00 00 00
0cd0: 00 00 00 00 00 00 00 00 00 00 00 00 00 00 00 00
0ce0: 00 00 00 00 00 00 00 00 00 00 00 00 00 00 00 00
0cf0: 00 00 00 00 00 00 00 00 00 00 00 00 00 00 00 00
0d00: 00 00 00 00 00 00 00 00 00 00 00 00 00 00 00 00
0d10: 00 00 00 00 00 00 00 00 00 00 00 00 00 00 00 00
0d20: 00 00 00 00 00 00 00 00 00 00 00 00 00 00 00 00
0d30: 00 00 00 00 00 00 00 00 00 00 00 00 00 00 00 00
0d40: 00 00 00 00 00 00 00 00 00 00 00 00 00 00 00 00
0d50: 00 00 00 00 00 00 00 00 00 00 00 00 00 00 00 00
0d60: 00 00 00 00 00 00 00 00 00 00 00 00 00 00 00 00
0d70: 00 00 00 00 00 00 00 00 00 00 00 00 00 00 00 00
0d80: 00 00 00 00 00 00 00 00 00 00 00 00 00 00 00 00
0d90: 00 00 00 00 00 00 00 00 00 00 00 00 00 00 00 00
0da0: 00 00 00 00 00 00 00 00 00 00 00 00 00 00 00 00
0db0: 00 00 00 00 00 00 00 00 00 00 00 00 00 00 00 00
0dc0: 00 00 00 00 00 00 00 00 00 00 00 00 00 00 00 00
0dd0: 00 00 00 00 00 00 00 00 00 00 00 00 00 00 00 00
0de0: 00 00 00 00 00 00 00 00 00 00 00 00 00 00 00 00
0df0: 00 00 00 00 00 00 00 00 00 00 00 00 00 00 00 00
0e00: 00 00 00 00 00 00 00 00 00 00 00 00 00 00 00 00
0e10: 00 00 00 00 00 00 00 00 00 00 00 00 00 00 00 00
0e20: 00 00 00 00 00 00 00 00 00 00 00 00 00 00 00 00
0e30: 00 00 00 00 00 00 00 00 00 00 00 00 00 00 00 00
0e40: 00 00 00 00 00 00 00 00 00 00 00 00 00 00 00 00
0e50: 00 00 00 00 00 00 00 00 00 00 00 00 00 00 00 00
0e60: 00 00 00 00 00 00 00 00 00 00 00 00 00 00 00 00
0e70: 00 00 00 00 00 00 00 00 00 00 00 00 00 00 00 00
0e80: 00 00 00 00 00 00 00 00 00 00 00 00 00 00 00 00
0e90: 00 00 00 00 00 00 00 00 00 00 00 00 00 00 00 00
0ea0: 00 00 00 00 00 00 00 00 00 00 00 00 00 00 00 00
0eb0: 00 00 00 00 00 00 00 00 00 00 00 00 00 00 00 00
0ec0: 00 00 00 00 00 00 00 00 00 00 00 00 00 00 00 00
0ed0: 00 00 00 00 00 00 00 00 00 00 00 00 00 00 00 00
0ee0: 00 00 00 00 00 00 00 00 00 00 00 00 00 00 00 00
0ef0: 00 00 00 00 00 00 00 00 00 00 00 00 00 00 00 00
0f00: 00 00 00 00 00 00 00 00 00 00 00 00 00 00 00 00
0f10: 00 00 00 00 00 00 00 00 00 00 00 00 00 00 00 00
0f20: 00 00 00 00 00 00 00 00 00 00 00 00 00 00 00 00
0f30: 00 00 00 00 00 00 00 00 00 00 00 00 00 00 00 00
0f40: 00 00 00 00 00 00 00 00 00 00 00 00 00 00 00 00
0f50: 00 00 00 00 00 00 00 00 00 00 00 00 00 00 00 00
0f60: 00 00 00 00 00 00 00 00 00 00 00 00 00 00 00 00
0f70: 00 00 00 00 00 00 00 00 00 00 00 00 00 00 00 00
0f80: 00 00 00 00 00 00 00 00 00 00 00 00 00 00 00 00
0f90: 00 00 00 00 00 00 00 00 00 00 00 00 00 00 00 00
0fa0: 00 00 00 00 00 00 00 00 00 00 00 00 00 00 00 00
0fb0: 00 00 00 00 00 00 00 00 00 00 00 00 00 00 00 00
0fc0: 00 00 00 00 00 00 00 00 00 00 00 00 00 00 00 00
0fd0: 00 00 00 00 00 00 00 00 00 00 00 00 00 00 00 00
0fe0: 00 00 00 00 00 00 00 00 00 00 00 00 00 00 00 00
0ff0: 00 00 00 00 00 00 00 00 00 00 00 00 00 00 00 00

PCIe 00:1c.0 extended config space:
0000: 86 80 18 1c 07 05 10 00 b5 00 04 06 10 00 81 00
0010: 00 00 00 00 00 00 00 00 00 02 02 00 20 20 00 20
0020: a0 7f a0 7f f1 ff 01 00 00 00 00 00 00 00 00 00
0030: 00 00 00 00 40 00 00 00 00 00 00 00 ff 01 12 00
0040: 10 80 42 01 00 80 00 00 00 00 10 00 12 4c 11 05
0050: 00 00 11 70 00 05 0c 00 00 00 40 01 08 00 00 00
0060: 00 00 00 00 16 00 00 00 00 00 00 00 00 00 00 00
0070: 02 00 01 00 00 00 00 00 00 00 00 00 00 00 00 00
0080: 05 90 01 00 04 20 e0 fe 22 00 00 00 00 00 00 00
0090: 0d a0 00 00 86 80 01 20 00 00 00 00 00 00 00 00
00a0: 01 00 02 c8 00 00 00 00 00 00 00 00 00 00 00 00
00b0: 00 00 00 00 00 00 00 00 00 00 00 00 00 00 00 00
00c0: 00 00 00 00 00 00 00 00 00 00 00 00 00 00 00 00
00d0: 00 00 00 01 02 0b 00 00 00 80 11 01 00 00 00 00
00e0: 00 3f 00 00 00 00 00 00 01 00 00 00 00 00 00 00
00f0: 00 00 00 00 00 00 00 00 87 0f 06 08 00 00 00 00
0100: 00 00 00 00 00 00 00 00 00 00 00 00 11 00 06 00
0110: 00 00 00 00 00 20 00 00 00 00 00 00 00 00 00 00
0120: 00 00 00 00 00 00 00 00 00 00 00 00 00 00 00 00
0130: 00 00 00 00 00 00 00 00 00 00 00 00 00 00 00 00
0140: 00 00 00 00 00 00 00 00 00 00 00 00 00 00 00 00
0150: 00 00 00 00 00 00 00 00 00 00 00 00 00 00 00 00
0160: 00 00 00 00 00 00 00 00 00 00 00 00 00 00 00 00
0170: 00 00 00 00 00 00 00 00 00 00 00 00 00 00 00 00
0180: 00 00 00 00 00 00 00 00 00 00 00 00 00 00 00 00
0190: 00 00 00 00 00 00 00 00 00 00 00 00 00 00 00 00
01a0: 00 00 00 00 00 00 00 00 00 00 00 00 00 00 00 00
01b0: 00 00 00 00 00 00 00 00 00 00 00 00 00 00 00 00
01c0: 00 00 00 00 00 00 00 00 00 00 00 00 00 00 00 00
01d0: 00 00 00 00 00 00 00 00 00 00 00 00 00 00 00 00
01e0: 00 00 00 00 00 00 00 00 00 00 00 00 00 00 00 00
01f0: 00 00 00 00 00 00 00 00 00 00 00 00 00 00 00 00
0200: 00 00 00 00 00 00 00 00 00 00 00 00 00 00 00 00
0210: 00 00 00 00 00 00 00 00 00 00 00 00 00 00 00 00
0220: 00 00 00 00 00 00 00 00 00 00 00 00 00 00 00 00
0230: 00 00 00 00 00 00 00 00 00 00 00 00 00 00 00 00
0240: 00 00 00 00 00 00 00 00 00 00 00 00 00 00 00 00
0250: 00 00 00 00 00 00 00 00 00 00 00 00 00 00 00 00
0260: 00 00 00 00 00 00 00 00 00 00 00 00 00 00 00 00
0270: 00 00 00 00 00 00 00 00 00 00 00 00 00 00 00 00
0280: 00 00 00 00 00 00 00 00 00 00 00 00 00 00 00 00
0290: 00 00 00 00 00 00 00 00 00 00 00 00 00 00 00 00
02a0: 00 00 00 00 00 00 00 00 00 00 00 00 00 00 00 00
02b0: 00 00 00 00 00 00 00 00 00 00 00 00 00 00 00 00
02c0: 00 00 00 00 00 00 00 00 00 00 00 00 00 00 00 00
02d0: 00 00 00 00 00 00 00 00 00 00 00 00 00 00 00 00
02e0: 00 00 00 00 00 00 00 00 00 00 00 00 00 00 00 00
02f0: 00 00 00 00 00 00 00 00 00 00 00 00 00 00 00 00
0300: 00 00 00 00 00 00 00 00 00 00 00 00 00 00 00 00
0310: 00 00 00 00 1b 36 3a 74 00 00 14 14 31 17 42 00
0320: 5b 60 09 00 20 20 00 0a 1c 18 b8 04 1b 08 e2 07
0330: 40 00 00 28 bc b5 bc 4a 00 00 00 00 74 4c 85 00
0340: 42 00 42 00 00 00 44 00 34 00 14 00 5c 00 d8 00
0350: 00 00 da 00 01 00 0a 00 02 00 02 00 00 00 00 00
0360: 00 00 00 00 00 00 00 00 00 00 00 00 00 00 00 00
0370: 00 00 00 00 00 00 00 00 00 00 00 00 00 00 00 00
0380: 00 00 00 00 00 00 00 00 00 00 00 00 00 00 00 00
0390: 00 00 00 00 00 00 00 00 00 00 00 00 00 00 00 00
03a0: 00 00 00 00 00 00 00 00 00 00 00 00 00 00 00 00
03b0: 00 00 00 00 00 00 00 00 00 00 00 00 00 00 00 00
03c0: 00 00 00 00 00 00 00 00 00 00 00 00 00 00 00 00
03d0: 00 00 00 00 00 00 00 00 00 00 00 00 00 00 00 00
03e0: 00 00 00 00 00 00 00 00 00 00 00 00 00 00 00 00
03f0: 00 00 00 00 00 00 00 00 00 00 00 00 00 00 00 00
0400: 00 00 00 00 00 00 00 00 00 00 00 00 00 00 00 00
0410: 00 00 00 00 00 00 00 00 00 00 00 00 00 00 00 00
0420: 00 00 00 00 00 00 00 00 00 00 00 00 00 00 00 00
0430: 00 00 00 00 00 00 00 00 00 00 00 00 00 00 00 00
0440: 00 00 00 00 00 00 00 00 00 00 00 00 00 00 00 00
0450: 00 00 00 00 00 00 00 00 00 00 00 00 00 00 00 00
0460: 00 00 00 00 00 00 00 00 00 00 00 00 00 00 00 00
0470: 00 00 00 00 00 00 00 00 00 00 00 00 00 00 00 00
0480: 00 00 00 00 00 00 00 00 00 00 00 00 00 00 00 00
0490: 00 00 00 00 00 00 00 00 00 00 00 00 00 00 00 00
04a0: 00 00 00 00 00 00 00 00 00 00 00 00 00 00 00 00
04b0: 00 00 00 00 00 00 00 00 00 00 00 00 00 00 00 00
04c0: 00 00 00 00 00 00 00 00 00 00 00 00 00 00 00 00
04d0: 00 00 00 00 00 00 00 00 00 00 00 00 00 00 00 00
04e0: 00 00 00 00 00 00 00 00 00 00 00 00 00 00 00 00
04f0: 00 00 00 00 00 00 00 00 00 00 00 00 00 00 00 00
0500: 00 00 00 00 00 00 00 00 00 00 00 00 00 00 00 00
0510: 00 00 00 00 00 00 00 00 00 00 00 00 00 00 00 00
0520: 00 00 00 00 00 00 00 00 00 00 00 00 00 00 00 00
0530: 00 00 00 00 00 00 00 00 00 00 00 00 00 00 00 00
0540: 00 00 00 00 00 00 00 00 00 00 00 00 00 00 00 00
0550: 00 00 00 00 00 00 00 00 00 00 00 00 00 00 00 00
0560: 00 00 00 00 00 00 00 00 00 00 00 00 00 00 00 00
0570: 00 00 00 00 00 00 00 00 00 00 00 00 00 00 00 00
0580: 00 00 00 00 00 00 00 00 00 00 00 00 00 00 00 00
0590: 00 00 00 00 00 00 00 00 00 00 00 00 00 00 00 00
05a0: 00 00 00 00 00 00 00 00 00 00 00 00 00 00 00 00
05b0: 00 00 00 00 00 00 00 00 00 00 00 00 00 00 00 00
05c0: 00 00 00 00 00 00 00 00 00 00 00 00 00 00 00 00
05d0: 00 00 00 00 00 00 00 00 00 00 00 00 00 00 00 00
05e0: 00 00 00 00 00 00 00 00 00 00 00 00 00 00 00 00
05f0: 00 00 00 00 00 00 00 00 00 00 00 00 00 00 00 00
0600: 00 00 00 00 00 00 00 00 00 00 00 00 00 00 00 00
0610: 00 00 00 00 00 00 00 00 00 00 00 00 00 00 00 00
0620: 00 00 00 00 00 00 00 00 00 00 00 00 00 00 00 00
0630: 00 00 00 00 00 00 00 00 00 00 00 00 00 00 00 00
0640: 00 00 00 00 00 00 00 00 00 00 00 00 00 00 00 00
0650: 00 00 00 00 00 00 00 00 00 00 00 00 00 00 00 00
0660: 00 00 00 00 00 00 00 00 00 00 00 00 00 00 00 00
0670: 00 00 00 00 00 00 00 00 00 00 00 00 00 00 00 00
0680: 00 00 00 00 00 00 00 00 00 00 00 00 00 00 00 00
0690: 00 00 00 00 00 00 00 00 00 00 00 00 00 00 00 00
06a0: 00 00 00 00 00 00 00 00 00 00 00 00 00 00 00 00
06b0: 00 00 00 00 00 00 00 00 00 00 00 00 00 00 00 00
06c0: 00 00 00 00 00 00 00 00 00 00 00 00 00 00 00 00
06d0: 00 00 00 00 00 00 00 00 00 00 00 00 00 00 00 00
06e0: 00 00 00 00 00 00 00 00 00 00 00 00 00 00 00 00
06f0: 00 00 00 00 00 00 00 00 00 00 00 00 00 00 00 00
0700: 00 00 00 00 00 00 00 00 00 00 00 00 00 00 00 00
0710: 00 00 00 00 00 00 00 00 00 00 00 00 00 00 00 00
0720: 00 00 00 00 00 00 00 00 00 00 00 00 00 00 00 00
0730: 00 00 00 00 00 00 00 00 00 00 00 00 00 00 00 00
0740: 00 00 00 00 00 00 00 00 00 00 00 00 00 00 00 00
0750: 00 00 00 00 00 00 00 00 00 00 00 00 00 00 00 00
0760: 00 00 00 00 00 00 00 00 00 00 00 00 00 00 00 00
0770: 00 00 00 00 00 00 00 00 00 00 00 00 00 00 00 00
0780: 00 00 00 00 00 00 00 00 00 00 00 00 00 00 00 00
0790: 00 00 00 00 00 00 00 00 00 00 00 00 00 00 00 00
07a0: 00 00 00 00 00 00 00 00 00 00 00 00 00 00 00 00
07b0: 00 00 00 00 00 00 00 00 00 00 00 00 00 00 00 00
07c0: 00 00 00 00 00 00 00 00 00 00 00 00 00 00 00 00
07d0: 00 00 00 00 00 00 00 00 00 00 00 00 00 00 00 00
07e0: 00 00 00 00 00 00 00 00 00 00 00 00 00 00 00 00
07f0: 00 00 00 00 00 00 00 00 00 00 00 00 00 00 00 00
0800: 00 00 00 00 00 00 00 00 00 00 00 00 00 00 00 00
0810: 00 00 00 00 00 00 00 00 00 00 00 00 00 00 00 00
0820: 00 00 00 00 00 00 00 00 00 00 00 00 00 00 00 00
0830: 00 00 00 00 00 00 00 00 00 00 00 00 00 00 00 00
0840: 00 00 00 00 00 00 00 00 00 00 00 00 00 00 00 00
0850: 00 00 00 00 00 00 00 00 00 00 00 00 00 00 00 00
0860: 00 00 00 00 00 00 00 00 00 00 00 00 00 00 00 00
0870: 00 00 00 00 00 00 00 00 00 00 00 00 00 00 00 00
0880: 00 00 00 00 00 00 00 00 00 00 00 00 00 00 00 00
0890: 00 00 00 00 00 00 00 00 00 00 00 00 00 00 00 00
08a0: 00 00 00 00 00 00 00 00 00 00 00 00 00 00 00 00
08b0: 00 00 00 00 00 00 00 00 00 00 00 00 00 00 00 00
08c0: 00 00 00 00 00 00 00 00 00 00 00 00 00 00 00 00
08d0: 00 00 00 00 00 00 00 00 00 00 00 00 00 00 00 00
08e0: 00 00 00 00 00 00 00 00 00 00 00 00 00 00 00 00
08f0: 00 00 00 00 00 00 00 00 00 00 00 00 00 00 00 00
0900: 00 00 00 00 00 00 00 00 00 00 00 00 00 00 00 00
0910: 00 00 00 00 00 00 00 00 00 00 00 00 00 00 00 00
0920: 00 00 00 00 00 00 00 00 00 00 00 00 00 00 00 00
0930: 00 00 00 00 00 00 00 00 00 00 00 00 00 00 00 00
0940: 00 00 00 00 00 00 00 00 00 00 00 00 00 00 00 00
0950: 00 00 00 00 00 00 00 00 00 00 00 00 00 00 00 00
0960: 00 00 00 00 00 00 00 00 00 00 00 00 00 00 00 00
0970: 00 00 00 00 00 00 00 00 00 00 00 00 00 00 00 00
0980: 00 00 00 00 00 00 00 00 00 00 00 00 00 00 00 00
0990: 00 00 00 00 00 00 00 00 00 00 00 00 00 00 00 00
09a0: 00 00 00 00 00 00 00 00 00 00 00 00 00 00 00 00
09b0: 00 00 00 00 00 00 00 00 00 00 00 00 00 00 00 00
09c0: 00 00 00 00 00 00 00 00 00 00 00 00 00 00 00 00
09d0: 00 00 00 00 00 00 00 00 00 00 00 00 00 00 00 00
09e0: 00 00 00 00 00 00 00 00 00 00 00 00 00 00 00 00
09f0: 00 00 00 00 00 00 00 00 00 00 00 00 00 00 00 00
0a00: 00 00 00 00 00 00 00 00 00 00 00 00 00 00 00 00
0a10: 00 00 00 00 00 00 00 00 00 00 00 00 00 00 00 00
0a20: 00 00 00 00 00 00 00 00 00 00 00 00 00 00 00 00
0a30: 00 00 00 00 00 00 00 00 00 00 00 00 00 00 00 00
0a40: 00 00 00 00 00 00 00 00 00 00 00 00 00 00 00 00
0a50: 00 00 00 00 00 00 00 00 00 00 00 00 00 00 00 00
0a60: 00 00 00 00 00 00 00 00 00 00 00 00 00 00 00 00
0a70: 00 00 00 00 00 00 00 00 00 00 00 00 00 00 00 00
0a80: 00 00 00 00 00 00 00 00 00 00 00 00 00 00 00 00
0a90: 00 00 00 00 00 00 00 00 00 00 00 00 00 00 00 00
0aa0: 00 00 00 00 00 00 00 00 00 00 00 00 00 00 00 00
0ab0: 00 00 00 00 00 00 00 00 00 00 00 00 00 00 00 00
0ac0: 00 00 00 00 00 00 00 00 00 00 00 00 00 00 00 00
0ad0: 00 00 00 00 00 00 00 00 00 00 00 00 00 00 00 00
0ae0: 00 00 00 00 00 00 00 00 00 00 00 00 00 00 00 00
0af0: 00 00 00 00 00 00 00 00 00 00 00 00 00 00 00 00
0b00: 00 00 00 00 00 00 00 00 00 00 00 00 00 00 00 00
0b10: 00 00 00 00 00 00 00 00 00 00 00 00 00 00 00 00
0b20: 00 00 00 00 00 00 00 00 00 00 00 00 00 00 00 00
0b30: 00 00 00 00 00 00 00 00 00 00 00 00 00 00 00 00
0b40: 00 00 00 00 00 00 00 00 00 00 00 00 00 00 00 00
0b50: 00 00 00 00 00 00 00 00 00 00 00 00 00 00 00 00
0b60: 00 00 00 00 00 00 00 00 00 00 00 00 00 00 00 00
0b70: 00 00 00 00 00 00 00 00 00 00 00 00 00 00 00 00
0b80: 00 00 00 00 00 00 00 00 00 00 00 00 00 00 00 00
0b90: 00 00 00 00 00 00 00 00 00 00 00 00 00 00 00 00
0ba0: 00 00 00 00 00 00 00 00 00 00 00 00 00 00 00 00
0bb0: 00 00 00 00 00 00 00 00 00 00 00 00 00 00 00 00
0bc0: 00 00 00 00 00 00 00 00 00 00 00 00 00 00 00 00
0bd0: 00 00 00 00 00 00 00 00 00 00 00 00 00 00 00 00
0be0: 00 00 00 00 00 00 00 00 00 00 00 00 00 00 00 00
0bf0: 00 00 00 00 00 00 00 00 00 00 00 00 00 00 00 00
0c00: 00 00 00 00 00 00 00 00 00 00 00 00 00 00 00 00
0c10: 00 00 00 00 00 00 00 00 00 00 00 00 00 00 00 00
0c20: 00 00 00 00 00 00 00 00 00 00 00 00 00 00 00 00
0c30: 00 00 00 00 00 00 00 00 00 00 00 00 00 00 00 00
0c40: 00 00 00 00 00 00 00 00 00 00 00 00 00 00 00 00
0c50: 00 00 00 00 00 00 00 00 00 00 00 00 00 00 00 00
0c60: 00 00 00 00 00 00 00 00 00 00 00 00 00 00 00 00
0c70: 00 00 00 00 00 00 00 00 00 00 00 00 00 00 00 00
0c80: 00 00 00 00 00 00 00 00 00 00 00 00 00 00 00 00
0c90: 00 00 00 00 00 00 00 00 00 00 00 00 00 00 00 00
0ca0: 00 00 00 00 00 00 00 00 00 00 00 00 00 00 00 00
0cb0: 00 00 00 00 00 00 00 00 00 00 00 00 00 00 00 00
0cc0: 00 00 00 00 00 00 00 00 00 00 00 00 00 00 00 00
0cd0: 00 00 00 00 00 00 00 00 00 00 00 00 00 00 00 00
0ce0: 00 00 00 00 00 00 00 00 00 00 00 00 00 00 00 00
0cf0: 00 00 00 00 00 00 00 00 00 00 00 00 00 00 00 00
0d00: 00 00 00 00 00 00 00 00 00 00 00 00 00 00 00 00
0d10: 00 00 00 00 00 00 00 00 00 00 00 00 00 00 00 00
0d20: 00 00 00 00 00 00 00 00 00 00 00 00 00 00 00 00
0d30: 00 00 00 00 00 00 00 00 00 00 00 00 00 00 00 00
0d40: 00 00 00 00 00 00 00 00 00 00 00 00 00 00 00 00
0d50: 00 00 00 00 00 00 00 00 00 00 00 00 00 00 00 00
0d60: 00 00 00 00 00 00 00 00 00 00 00 00 00 00 00 00
0d70: 00 00 00 00 00 00 00 00 00 00 00 00 00 00 00 00
0d80: 00 00 00 00 00 00 00 00 00 00 00 00 00 00 00 00
0d90: 00 00 00 00 00 00 00 00 00 00 00 00 00 00 00 00
0da0: 00 00 00 00 00 00 00 00 00 00 00 00 00 00 00 00
0db0: 00 00 00 00 00 00 00 00 00 00 00 00 00 00 00 00
0dc0: 00 00 00 00 00 00 00 00 00 00 00 00 00 00 00 00
0dd0: 00 00 00 00 00 00 00 00 00 00 00 00 00 00 00 00
0de0: 00 00 00 00 00 00 00 00 00 00 00 00 00 00 00 00
0df0: 00 00 00 00 00 00 00 00 00 00 00 00 00 00 00 00
0e00: 00 00 00 00 00 00 00 00 00 00 00 00 00 00 00 00
0e10: 00 00 00 00 00 00 00 00 00 00 00 00 00 00 00 00
0e20: 00 00 00 00 00 00 00 00 00 00 00 00 00 00 00 00
0e30: 00 00 00 00 00 00 00 00 00 00 00 00 00 00 00 00
0e40: 00 00 00 00 00 00 00 00 00 00 00 00 00 00 00 00
0e50: 00 00 00 00 00 00 00 00 00 00 00 00 00 00 00 00
0e60: 00 00 00 00 00 00 00 00 00 00 00 00 00 00 00 00
0e70: 00 00 00 00 00 00 00 00 00 00 00 00 00 00 00 00
0e80: 00 00 00 00 00 00 00 00 00 00 00 00 00 00 00 00
0e90: 00 00 00 00 00 00 00 00 00 00 00 00 00 00 00 00
0ea0: 00 00 00 00 00 00 00 00 00 00 00 00 00 00 00 00
0eb0: 00 00 00 00 00 00 00 00 00 00 00 00 00 00 00 00
0ec0: 00 00 00 00 00 00 00 00 00 00 00 00 00 00 00 00
0ed0: 00 00 00 00 00 00 00 00 00 00 00 00 00 00 00 00
0ee0: 00 00 00 00 00 00 00 00 00 00 00 00 00 00 00 00
0ef0: 00 00 00 00 00 00 00 00 00 00 00 00 00 00 00 00
0f00: 00 00 00 00 00 00 00 00 00 00 00 00 00 00 00 00
0f10: 00 00 00 00 00 00 00 00 00 00 00 00 00 00 00 00
0f20: 00 00 00 00 00 00 00 00 00 00 00 00 00 00 00 00
0f30: 00 00 00 00 00 00 00 00 00 00 00 00 00 00 00 00
0f40: 00 00 00 00 00 00 00 00 00 00 00 00 00 00 00 00
0f50: 00 00 00 00 00 00 00 00 00 00 00 00 00 00 00 00
0f60: 00 00 00 00 00 00 00 00 00 00 00 00 00 00 00 00
0f70: 00 00 00 00 00 00 00 00 00 00 00 00 00 00 00 00
0f80: 00 00 00 00 00 00 00 00 00 00 00 00 00 00 00 00
0f90: 00 00 00 00 00 00 00 00 00 00 00 00 00 00 00 00
0fa0: 00 00 00 00 00 00 00 00 00 00 00 00 00 00 00 00
0fb0: 00 00 00 00 00 00 00 00 00 00 00 00 00 00 00 00
0fc0: 00 00 00 00 00 00 00 00 00 00 00 00 00 00 00 00
0fd0: 00 00 00 00 00 00 00 00 00 00 00 00 00 00 00 00
0fe0: 00 00 00 00 00 00 00 00 00 00 00 00 00 00 00 00
0ff0: 00 00 00 00 00 00 00 00 00 00 00 00 00 00 00 00

PCIe 01:00.0 extended config space:
0000: de 10 4a 10 07 04 10 00 a1 00 00 03 10 00 80 00
0010: 00 00 00 8a 0c 00 00 80 00 00 00 00 0c 00 00 88
0020: 00 00 00 00 01 10 00 00 00 00 00 00 00 00 00 00
0030: 00 00 00 8b 60 00 00 00 00 00 00 00 ff 01 00 00
0040: 00 00 00 00 00 00 00 00 00 00 00 00 00 00 00 00
0050: 01 00 00 00 01 00 00 00 ce d6 23 00 00 00 00 00
0060: 01 68 03 00 08 00 00 00 05 78 81 00 04 10 e0 fe
0070: 00 00 00 00 25 00 00 00 10 b4 02 00 e0 8d 00 00
0080: 10 29 00 00 01 2d 05 00 43 00 01 11 00 00 00 00
0090: 00 00 00 00 00 00 00 00 00 00 00 00 10 00 00 00
00a0: 00 00 00 00 00 00 00 00 01 00 00 00 00 00 00 00
00b0: 00 00 00 00 09 00 14 01 00 00 00 00 00 00 00 00
00c0: 00 00 00 00 00 00 00 00 00 00 00 00 00 00 00 00
00d0: 00 00 00 00 00 00 00 00 00 00 00 00 00 00 00 00
00e0: 00 00 00 00 00 00 00 00 00 00 00 00 00 00 00 00
00f0: 00 00 00 00 00 00 00 00 00 00 00 00 00 00 00 00
0100: 02 00 81 12 00 00 00 00 00 00 00 00 00 00 00 00
0110: 00 00 00 00 ff 00 00 80 00 00 00 00 00 00 00 00
0120: 00 00 00 00 00 00 00 00 04 00 01 60 00 00 00 00
0130: 21 81 07 00 00 00 00 00 00 00 00 00 00 00 ff 63
0140: 10 00 01 08 10 00 00 00 ff ff ff ff 1b 00 00 0b
0150: 95 ff 00 e0 20 71 01 00 02 0b 00 00 21 81 07 00
0160: 21 81 05 00 02 80 03 00 02 80 01 00 06 80 1f 00
0170: 06 80 1d 00 00 00 00 00 00 00 00 00 00 00 00 00
0180: 00 00 00 00 00 00 00 00 02 00 00 00 01 00 00 e0
0190: 00 00 00 00 00 00 00 00 00 00 00 00 00 00 00 00
01a0: 00 00 00 00 00 00 00 00 00 00 00 00 00 00 00 00
01b0: 00 00 00 00 00 00 00 00 00 00 00 00 00 00 00 00
01c0: 00 00 00 00 00 00 00 00 00 00 00 00 00 00 00 00
01d0: 00 00 00 00 00 00 00 00 00 00 00 00 00 00 00 00
01e0: 00 00 00 00 00 00 00 00 00 00 00 00 00 00 00 00
01f0: 00 00 00 00 00 00 00 00 00 00 00 00 00 00 00 00
0200: 00 00 00 00 00 00 00 00 00 00 00 00 00 00 00 00
0210: 00 00 00 00 00 00 00 00 00 00 00 00 00 00 00 00
0220: 00 00 00 00 00 00 00 00 00 00 00 00 00 00 00 00
0230: 00 00 00 00 00 00 00 00 00 00 00 00 00 00 00 00
0240: 00 00 00 00 00 00 00 00 00 00 00 00 00 00 00 00
0250: 00 00 00 00 00 00 00 00 00 00 00 00 00 00 00 00
0260: 00 00 00 00 00 00 00 00 00 00 00 00 00 00 00 00
0270: 00 00 00 00 00 00 00 00 00 00 00 00 00 00 00 00
0280: 00 00 00 00 00 00 00 00 00 00 00 00 00 00 00 00
0290: 00 00 00 00 00 00 00 00 00 00 00 00 00 00 00 00
02a0: 00 00 00 00 00 00 00 00 00 00 00 00 00 00 00 00
02b0: 00 00 00 00 00 00 00 00 00 00 00 00 00 00 00 00
02c0: 00 00 00 00 00 00 00 00 00 00 00 00 00 00 00 00
02d0: 00 00 00 00 00 00 00 00 00 00 00 00 00 00 00 00
02e0: 00 00 00 00 00 00 00 00 00 00 00 00 00 00 00 00
02f0: 00 00 00 00 00 00 00 00 00 00 00 00 00 00 00 00
0300: 00 00 00 00 00 00 00 00 00 00 00 00 00 00 00 00
0310: 00 00 00 00 00 00 00 00 00 00 00 00 00 00 00 00
0320: 00 00 00 00 00 00 00 00 00 00 00 00 00 00 00 00
0330: 00 00 00 00 00 00 00 00 00 00 00 00 00 00 00 00
0340: 00 00 00 00 00 00 00 00 00 00 00 00 00 00 00 00
0350: 00 00 00 00 00 00 00 00 00 00 00 00 00 00 00 00
0360: 00 00 00 00 00 00 00 00 00 00 00 00 00 00 00 00
0370: 00 00 00 00 00 00 00 00 00 00 00 00 00 00 00 00
0380: 00 00 00 00 00 00 00 00 00 00 00 00 00 00 00 00
0390: 00 00 00 00 00 00 00 00 00 00 00 00 00 00 00 00
03a0: 00 00 00 00 00 00 00 00 00 00 00 00 00 00 00 00
03b0: 00 00 00 00 00 00 00 00 00 00 00 00 00 00 00 00
03c0: 00 00 00 00 00 00 00 00 00 00 00 00 00 00 00 00
03d0: 00 00 00 00 00 00 00 00 00 00 00 00 00 00 00 00
03e0: 00 00 00 00 00 00 00 00 00 00 00 00 00 00 00 00
03f0: 00 00 00 00 00 00 00 00 00 00 00 00 00 00 00 00
0400: 00 00 00 00 00 00 00 00 00 00 00 00 00 00 00 00
0410: 00 00 00 00 00 00 00 00 00 00 00 00 03 84 37 00
0420: 00 00 00 60 00 00 00 00 00 00 00 00 11 20 06 00
0430: 00 20 00 00 00 20 00 00 00 00 00 00 00 00 00 00
0440: 00 00 00 00 00 00 00 00 00 00 00 00 00 00 00 00
0450: 00 00 00 00 00 00 00 00 0f 60 28 00 00 00 00 10
0460: 20 22 6c b0 c4 09 40 06 00 00 00 00 00 00 00 00
0470: 00 00 00 00 69 05 69 05 8f 00 f2 06 15 ad 08 00
0480: 00 00 00 00 00 00 00 00 16 00 00 02 8c 00 18 01
0490: 30 00 f0 00 e5 29 af 1b 00 00 00 00 00 00 00 00
04a0: 00 00 00 00 00 00 00 00 02 00 00 00 00 00 00 00
04b0: 00 00 00 00 00 00 00 00 00 00 00 00 00 00 00 00
04c0: 03 03 18 00 00 00 00 00 00 00 00 00 37 37 f4 00
04d0: 00 00 00 00 00 00 00 00 00 00 00 00 00 00 00 00
04e0: 00 00 00 00 ff 0f 00 00 00 00 f0 00 00 00 00 00
04f0: 00 00 00 00 00 00 00 00 00 00 00 00 00 00 00 00
0500: 00 00 00 00 00 00 00 00 00 00 00 00 00 00 00 00
0510: 00 00 00 00 00 00 00 00 00 00 00 00 00 00 00 00
0520: 00 00 00 00 00 00 00 00 00 00 00 00 00 00 00 00
0530: 00 00 00 00 00 00 00 00 00 00 00 00 00 00 00 00
0540: 00 00 00 00 00 00 00 00 00 00 00 00 00 00 00 00
0550: 00 00 00 00 00 00 00 00 00 00 00 00 00 00 00 00
0560: 00 00 00 00 00 00 00 00 00 00 00 00 00 00 00 00
0570: 00 00 00 00 00 00 00 00 00 00 00 00 00 00 00 00
0580: 00 00 00 00 00 00 00 00 00 00 00 00 00 00 00 00
0590: 00 00 00 00 00 00 00 00 00 00 00 00 00 00 00 00
05a0: 00 00 00 00 00 00 00 00 00 00 00 00 00 00 00 00
05b0: 00 00 00 00 00 00 00 00 00 00 00 00 00 00 00 00
05c0: 00 00 00 00 00 00 00 00 00 00 00 00 00 00 00 00
05d0: 00 00 00 00 00 00 00 00 00 00 00 00 00 00 00 00
05e0: 00 00 00 00 00 00 00 00 00 00 00 00 00 00 00 00
05f0: 00 00 00 00 00 00 00 00 00 00 00 00 00 00 00 00
0600: 0b 00 01 00 01 00 41 02 02 00 41 01 00 08 00 00
0610: 05 00 00 00 01 00 01 00 00 00 00 00 00 00 00 00
0620: 00 00 00 00 00 00 00 00 00 00 00 00 00 00 00 00
0630: 00 00 00 00 00 00 00 00 00 00 00 00 00 00 00 00
0640: 00 00 00 00 80 00 40 00 00 10 00 64 01 64 00 00
0650: 00 40 00 00 fe 00 00 00 3e 00 00 00 00 10 00 00
0660: 00 00 00 00 00 00 00 00 00 00 00 00 00 00 00 00
0670: 00 00 00 00 00 00 00 00 00 00 00 00 00 00 00 00
0680: 00 00 00 00 00 00 00 00 00 00 00 00 00 00 00 00
0690: 00 00 00 00 00 00 00 00 00 00 00 00 00 00 00 00
06a0: 00 00 00 00 00 00 00 00 00 00 00 00 00 00 00 00
06b0: 00 00 00 00 00 00 00 00 00 00 00 00 00 00 00 00
06c0: 00 00 00 00 00 00 00 00 00 00 00 00 00 00 00 00
06d0: 00 00 00 00 00 00 00 00 00 00 00 00 00 00 00 00
06e0: 00 00 00 00 00 00 00 00 00 00 00 00 00 00 00 00
06f0: 00 00 00 00 00 00 00 00 00 00 00 00 00 00 00 00
0700: 00 00 00 00 00 00 00 00 00 00 00 00 24 00 00 00
0710: 00 00 00 00 0a 48 00 00 02 00 00 00 00 00 00 00
0720: 00 00 00 00 00 00 00 00 00 00 00 00 00 00 00 00
0730: 00 00 00 00 00 00 00 00 00 00 00 00 00 00 00 00
0740: 00 00 00 00 00 00 00 00 00 00 00 00 00 00 00 00
0750: 00 00 00 00 00 00 00 00 00 00 00 00 00 00 00 00
0760: 00 00 00 00 00 00 00 00 00 00 00 00 00 00 00 00
0770: 00 00 00 00 00 00 00 00 00 00 00 00 00 00 00 00
0780: 00 00 00 00 00 00 00 00 00 00 00 00 00 00 00 00
0790: 00 00 00 00 00 00 00 00 00 00 00 00 00 00 00 00
07a0: 00 00 00 00 00 00 00 00 00 00 00 00 00 00 00 00
07b0: 00 00 00 00 00 00 00 00 00 00 00 00 00 00 00 00
07c0: 00 00 00 00 00 00 00 00 00 00 00 00 00 00 00 00
07d0: 00 00 00 00 00 00 00 00 00 00 00 00 00 00 00 00
07e0: 00 00 00 00 00 00 00 00 00 00 00 00 00 00 00 00
07f0: 00 00 00 00 00 00 00 00 00 00 00 00 00 00 00 00
0800: 00 00 00 00 00 00 00 00 00 00 00 00 00 00 00 00
0810: 00 00 00 00 00 00 00 00 00 00 00 00 00 00 00 00
0820: 00 00 00 00 00 00 00 00 00 00 00 00 00 00 00 00
0830: 00 00 00 00 00 00 00 00 00 00 00 00 00 00 00 00
0840: 00 00 00 00 00 00 00 00 00 00 00 00 00 00 00 00
0850: 00 00 00 00 00 00 00 00 00 00 00 00 00 00 00 00
0860: 00 00 00 00 00 00 00 00 00 00 00 00 00 00 00 00
0870: 00 00 00 00 00 00 00 00 00 00 00 00 00 00 00 00
0880: 00 00 00 00 00 00 00 00 00 00 00 00 00 00 00 00
0890: 00 00 00 00 00 00 00 00 00 00 00 00 00 00 00 00
08a0: 00 00 00 00 00 00 00 00 00 00 00 00 00 00 00 00
08b0: 00 00 00 00 00 00 00 00 00 00 00 00 00 00 00 00
08c0: 00 00 00 00 00 00 00 00 00 00 00 00 00 00 00 00
08d0: 00 00 00 00 00 00 00 00 00 00 00 00 00 00 00 00
08e0: 00 00 00 00 00 00 00 00 00 00 00 00 00 00 00 00
08f0: 00 00 00 00 00 00 00 00 00 00 00 00 00 00 00 00
0900: 00 00 00 00 00 00 00 00 00 00 00 00 00 00 00 00
0910: 00 00 00 00 00 00 00 00 00 00 00 00 00 00 00 00
0920: 00 00 00 00 00 00 00 00 00 00 00 00 00 00 00 00
0930: 00 00 00 00 00 00 00 00 00 00 00 00 00 00 00 00
0940: 00 00 00 00 00 00 00 00 00 00 00 00 00 00 00 00
0950: 00 00 00 00 00 00 00 00 00 00 00 00 00 00 00 00
0960: 00 00 00 00 00 00 00 00 00 00 00 00 00 00 00 00
0970: 00 00 00 00 00 00 00 00 00 00 00 00 00 00 00 00
0980: 00 00 00 00 00 00 00 00 00 00 00 00 00 00 00 00
0990: 00 00 00 00 00 00 00 00 00 00 00 00 00 00 00 00
09a0: 00 00 00 00 00 00 00 00 00 00 00 00 00 00 00 00
09b0: 00 00 00 00 00 00 00 00 00 00 00 00 00 00 00 00
09c0: 00 00 00 00 00 00 00 00 00 00 00 00 00 00 00 00
09d0: 00 00 00 00 00 00 00 00 00 00 00 00 00 00 00 00
09e0: 00 00 00 00 00 00 00 00 00 00 00 00 00 00 00 00
09f0: 00 00 00 00 00 00 00 00 00 00 00 00 00 00 00 00
0a00: 00 00 00 00 00 00 00 00 00 00 00 00 00 00 00 00
0a10: 00 00 00 00 00 00 00 00 00 00 00 00 00 00 00 00
0a20: 00 00 00 00 00 00 00 00 00 00 00 00 00 00 00 00
0a30: 00 00 00 00 00 00 00 00 00 00 00 00 00 00 00 00
0a40: 00 00 00 00 00 00 00 00 00 00 00 00 00 00 00 00
0a50: 00 00 00 00 00 00 00 00 00 00 00 00 00 00 00 00
0a60: 00 00 00 00 00 00 00 00 00 00 00 00 00 00 00 00
0a70: 00 00 00 00 00 00 00 00 00 00 00 00 00 00 00 00
0a80: 00 00 00 00 00 00 00 00 00 00 00 00 00 00 00 00
0a90: 00 00 00 00 00 00 00 00 00 00 00 00 00 00 00 00
0aa0: 00 00 00 00 00 00 00 00 00 00 00 00 00 00 00 00
0ab0: 00 00 00 00 00 00 00 00 00 00 00 00 00 00 00 00
0ac0: 00 00 00 00 00 00 00 00 00 00 00 00 00 00 00 00
0ad0: 00 00 00 00 00 00 00 00 00 00 00 00 00 00 00 00
0ae0: 00 00 00 00 00 00 00 00 00 00 00 00 00 00 00 00
0af0: 00 00 00 00 00 00 00 00 00 00 00 00 00 00 00 00
0b00: 00 00 00 00 00 00 00 00 00 00 00 00 00 00 00 00
0b10: 00 00 00 00 00 00 00 00 00 00 00 00 00 00 00 00
0b20: 00 00 00 00 00 00 00 00 00 00 00 00 00 00 00 00
0b30: 00 00 00 00 00 00 00 00 00 00 00 00 00 00 00 00
0b40: 00 00 00 00 00 00 00 00 00 00 00 00 00 00 00 00
0b50: 00 00 00 00 00 00 00 00 00 00 00 00 00 00 00 00
0b60: 00 00 00 00 00 00 00 00 00 00 00 00 00 00 00 00
0b70: 00 00 00 00 00 00 00 00 00 00 00 00 00 00 00 00
0b80: 00 00 00 00 00 00 00 00 00 00 00 00 00 00 00 00
0b90: 00 00 00 00 00 00 00 00 00 00 00 00 00 00 00 00
0ba0: 00 00 00 00 00 00 00 00 00 00 00 00 00 00 00 00
0bb0: 00 00 00 00 00 00 00 00 00 00 00 00 00 00 00 00
0bc0: 00 00 00 00 00 00 00 00 00 00 00 00 00 00 00 00
0bd0: 00 00 00 00 00 00 00 00 00 00 00 00 00 00 00 00
0be0: 00 00 00 00 00 00 00 00 00 00 00 00 00 00 00 00
0bf0: 00 00 00 00 00 00 00 00 00 00 00 00 00 00 00 00
0c00: 00 00 00 00 00 00 00 00 00 00 00 00 00 00 00 00
0c10: 00 00 00 00 00 00 00 00 00 00 00 00 00 00 00 00
0c20: 00 00 00 00 00 00 00 00 00 00 00 00 00 00 00 00
0c30: 00 00 00 00 00 00 00 00 00 00 00 00 00 00 00 00
0c40: 00 00 00 00 00 00 00 00 00 00 00 00 00 00 00 00
0c50: 00 00 00 00 00 00 00 00 00 00 00 00 00 00 00 00
0c60: 00 00 00 00 00 00 00 00 00 00 00 00 00 00 00 00
0c70: 00 00 00 00 00 00 00 00 00 00 00 00 00 00 00 00
0c80: 00 00 00 00 00 00 00 00 00 00 00 00 00 00 00 00
0c90: 00 00 00 00 00 00 00 00 00 00 00 00 00 00 00 00
0ca0: 00 00 00 00 00 00 00 00 00 00 00 00 00 00 00 00
0cb0: 00 00 00 00 00 00 00 00 00 00 00 00 00 00 00 00
0cc0: 00 00 00 00 00 00 00 00 00 00 00 00 00 00 00 00
0cd0: 00 00 00 00 00 00 00 00 00 00 00 00 00 00 00 00
0ce0: 00 00 00 00 00 00 00 00 00 00 00 00 00 00 00 00
0cf0: 00 00 00 00 00 00 00 00 00 00 00 00 00 00 00 00
0d00: 00 00 00 00 00 00 00 00 00 00 00 00 00 00 00 00
0d10: 00 00 00 00 00 00 00 00 00 00 00 00 00 00 00 00
0d20: 00 00 00 00 00 00 00 00 00 00 00 00 00 00 00 00
0d30: 00 00 00 00 00 00 00 00 00 00 00 00 00 00 00 00
0d40: 00 00 00 00 00 00 00 00 00 00 00 00 00 00 00 00
0d50: 00 00 00 00 00 00 00 00 00 00 00 00 00 00 00 00
0d60: 00 00 00 00 00 00 00 00 00 00 00 00 00 00 00 00
0d70: 00 00 00 00 00 00 00 00 00 00 00 00 00 00 00 00
0d80: 00 00 00 00 00 00 00 00 00 00 00 00 00 00 00 00
0d90: 00 00 00 00 00 00 00 00 00 00 00 00 00 00 00 00
0da0: 00 00 00 00 00 00 00 00 00 00 00 00 00 00 00 00
0db0: 00 00 00 00 00 00 00 00 00 00 00 00 00 00 00 00
0dc0: 00 00 00 00 00 00 00 00 00 00 00 00 00 00 00 00
0dd0: 00 00 00 00 00 00 00 00 00 00 00 00 00 00 00 00
0de0: 00 00 00 00 00 00 00 00 00 00 00 00 00 00 00 00
0df0: 00 00 00 00 00 00 00 00 00 00 00 00 00 00 00 00
0e00: 00 00 00 00 00 00 00 00 00 00 00 00 00 00 00 00
0e10: 00 00 00 00 00 00 00 00 00 00 00 00 00 00 00 00
0e20: 00 00 00 00 00 00 00 00 00 00 00 00 00 00 00 00
0e30: 00 00 00 00 00 00 00 00 00 00 00 00 00 00 00 00
0e40: 00 00 00 00 00 00 00 00 00 00 00 00 00 00 00 00
0e50: 00 00 00 00 00 00 00 00 00 00 00 00 00 00 00 00
0e60: 00 00 00 00 00 00 00 00 00 00 00 00 00 00 00 00
0e70: 00 00 00 00 00 00 00 00 00 00 00 00 00 00 00 00
0e80: 00 00 00 00 00 00 00 00 00 00 00 00 00 00 00 00
0e90: 00 00 00 00 00 00 00 00 00 00 00 00 00 00 00 00
0ea0: 00 00 00 00 00 00 00 00 00 00 00 00 00 00 00 00
0eb0: 00 00 00 00 00 00 00 00 00 00 00 00 00 00 00 00
0ec0: 00 00 00 00 00 00 00 00 00 00 00 00 00 00 00 00
0ed0: 00 00 00 00 00 00 00 00 00 00 00 00 00 00 00 00
0ee0: 00 00 00 00 00 00 00 00 00 00 00 00 00 00 00 00
0ef0: 00 00 00 00 00 00 00 00 00 00 00 00 00 00 00 00
0f00: 00 00 00 00 00 00 00 00 00 00 00 00 00 00 00 00
0f10: 00 00 00 00 00 00 00 00 00 00 00 00 00 00 00 00
0f20: 00 00 00 00 00 00 00 00 00 00 00 00 00 00 00 00
0f30: 00 00 00 00 00 00 00 00 00 00 00 00 00 00 00 00
0f40: 00 00 00 00 00 00 00 00 00 00 00 00 00 00 00 00
0f50: 00 00 00 00 00 00 00 00 00 00 00 00 00 00 00 00
0f60: 00 00 00 00 00 00 00 00 00 00 00 00 00 00 00 00
0f70: 00 00 00 00 00 00 00 00 00 00 00 00 00 00 00 00
0f80: 00 00 00 00 00 00 00 00 00 00 00 00 00 00 00 00
0f90: 00 00 00 00 00 00 00 00 00 00 00 00 00 00 00 00
0fa0: 00 00 00 00 00 00 00 00 00 00 00 00 00 00 00 00
0fb0: 00 00 00 00 00 00 00 00 00 00 00 00 00 00 00 00
0fc0: 00 00 00 00 00 00 00 00 00 00 00 00 00 00 00 00
0fd0: 00 00 00 00 00 00 00 00 00 00 00 00 00 00 00 00
0fe0: 00 00 00 00 00 00 00 00 00 00 00 00 00 00 00 00
0ff0: 00 00 00 00 00 00 00 00 00 00 00 00 00 00 00 00

PCIe 01:00.1 extended config space:
0000: de 10 08 0e 06 00 10 00 a1 00 03 04 10 00 80 00
0010: 00 00 08 8b 00 00 00 00 00 00 00 00 00 00 00 00
0020: 00 00 00 00 00 00 00 00 00 00 00 00 00 00 00 00
0030: 00 00 00 00 60 00 00 00 00 00 00 00 ff 02 00 00
0040: 00 00 00 00 00 00 00 00 00 00 00 00 00 00 00 00
0050: 00 00 00 00 00 00 00 00 ce d6 23 00 00 00 00 00
0060: 01 68 03 00 08 00 00 00 05 78 80 00 00 00 00 00
0070: 00 00 00 00 00 00 00 00 10 00 02 00 a0 8d 00 00
0080: 10 29 00 00 01 2d 05 00 43 00 01 11 00 00 00 00
0090: 00 00 00 00 00 00 00 00 00 00 00 00 10 00 00 00
00a0: 00 00 00 00 00 00 00 00 00 00 00 00 00 00 00 00
00b0: 00 00 00 00 00 00 00 00 00 00 00 00 00 00 00 00
00c0: 00 00 00 00 00 00 00 00 00 00 00 00 00 00 00 00
00d0: 00 00 00 00 00 00 00 00 00 00 00 00 00 00 00 00
00e0: 00 00 00 00 00 00 00 00 00 00 00 00 00 00 00 00
00f0: 00 00 00 00 00 00 00 00 00 00 00 00 00 00 00 00
0100: 00 00 00 00 00 00 00 00 00 00 00 00 11 20 06 00
0110: 00 20 00 00 00 20 00 00 00 00 00 00 00 00 00 00
0120: 00 00 00 00 00 00 00 00 00 00 00 00 00 00 00 00
0130: 00 00 00 00 00 00 00 00 00 00 00 00 00 00 00 00
0140: 00 00 00 00 10 00 00 00 00 00 00 00 00 00 00 0b
0150: 00 00 00 e0 20 61 00 00 00 00 00 00 00 00 00 00
0160: 00 00 00 00 00 00 00 00 00 00 00 00 00 00 00 00
0170: 00 00 00 00 00 00 00 00 00 00 00 00 00 00 00 00
0180: 00 00 00 00 00 00 00 00 00 00 00 00 00 00 00 00
0190: 00 00 00 00 00 00 00 00 00 00 00 00 00 00 00 00
01a0: 00 00 00 00 00 00 00 00 00 00 00 00 00 00 00 00
01b0: 00 00 00 00 00 00 00 00 00 00 00 00 00 00 00 00
01c0: 00 00 00 00 00 00 00 00 00 00 00 00 00 00 00 00
01d0: 00 00 00 00 00 00 00 00 00 00 00 00 00 00 00 00
01e0: 00 00 00 00 00 00 00 00 00 00 00 00 00 00 00 00
01f0: 00 00 00 00 00 00 00 00 00 00 00 00 00 00 00 00
0200: 00 00 00 00 00 00 00 00 00 00 00 00 00 00 00 00
0210: 00 00 00 00 00 00 00 00 00 00 00 00 00 00 00 00
0220: 00 00 00 00 00 00 00 00 00 00 00 00 00 00 00 00
0230: 00 00 00 00 00 00 00 00 00 00 00 00 00 00 00 00
0240: 00 00 00 00 00 00 00 00 00 00 00 00 00 00 00 00
0250: 00 00 00 00 00 00 00 00 00 00 00 00 00 00 00 00
0260: 00 00 00 00 00 00 00 00 00 00 00 00 00 00 00 00
0270: 00 00 00 00 00 00 00 00 00 00 00 00 00 00 00 00
0280: 00 00 00 00 00 00 00 00 00 00 00 00 00 00 00 00
0290: 00 00 00 00 00 00 00 00 00 00 00 00 00 00 00 00
02a0: 00 00 00 00 00 00 00 00 00 00 00 00 00 00 00 00
02b0: 00 00 00 00 00 00 00 00 00 00 00 00 00 00 00 00
02c0: 00 00 00 00 00 00 00 00 00 00 00 00 00 00 00 00
02d0: 00 00 00 00 00 00 00 00 00 00 00 00 00 00 00 00
02e0: 00 00 00 00 00 00 00 00 00 00 00 00 00 00 00 00
02f0: 00 00 00 00 00 00 00 00 00 00 00 00 00 00 00 00
0300: 00 00 00 00 00 00 00 00 00 00 00 00 00 00 00 00
0310: 00 00 00 00 00 00 00 00 00 00 00 00 00 00 00 00
0320: 00 00 00 00 00 00 00 00 00 00 00 00 00 00 00 00
0330: 00 00 00 00 00 00 00 00 00 00 00 00 00 00 00 00
0340: 00 00 00 00 00 00 00 00 00 00 00 00 00 00 00 00
0350: 00 00 00 00 00 00 00 00 00 00 00 00 00 00 00 00
0360: 00 00 00 00 00 00 00 00 00 00 00 00 00 00 00 00
0370: 00 00 00 00 00 00 00 00 00 00 00 00 00 00 00 00
0380: 00 00 00 00 00 00 00 00 00 00 00 00 00 00 00 00
0390: 00 00 00 00 00 00 00 00 00 00 00 00 00 00 00 00
03a0: 00 00 00 00 00 00 00 00 00 00 00 00 00 00 00 00
03b0: 00 00 00 00 00 00 00 00 00 00 00 00 00 00 00 00
03c0: 00 00 00 00 00 00 00 00 00 00 00 00 00 00 00 00
03d0: 00 00 00 00 00 00 00 00 00 00 00 00 00 00 00 00
03e0: 00 00 00 00 00 00 00 00 00 00 00 00 00 00 00 00
03f0: 00 00 00 00 00 00 00 00 00 00 00 00 00 00 00 00
0400: 00 00 00 00 00 00 00 00 00 00 00 00 00 00 00 00
0410: 00 00 00 00 00 00 00 00 00 00 00 00 00 80 30 00
0420: 00 00 00 00 00 00 00 00 00 00 00 00 00 00 00 00
0430: 00 00 00 00 00 00 00 00 00 00 00 00 00 00 00 00
0440: 00 00 00 00 00 00 00 00 00 00 00 00 00 00 00 00
0450: 00 00 00 00 00 00 00 00 00 00 00 00 00 00 00 00
0460: 00 00 00 00 00 00 00 00 00 00 00 00 00 00 00 00
0470: 00 00 00 00 00 00 00 00 00 00 00 00 00 00 00 00
0480: 00 00 00 00 00 00 00 00 16 00 00 00 00 00 00 00
0490: 00 00 00 00 00 00 00 00 00 00 00 00 00 00 00 00
04a0: 00 00 00 00 00 00 00 00 00 00 00 00 00 00 00 00
04b0: 00 00 00 00 00 00 00 00 00 00 00 00 00 00 00 00
04c0: 00 00 00 00 00 00 00 00 00 00 00 00 00 00 00 00
04d0: 00 00 00 00 00 00 00 00 00 00 00 00 00 00 00 00
04e0: 00 00 00 00 00 00 00 00 00 00 00 00 00 00 00 00
04f0: 00 00 00 00 00 00 00 00 00 00 00 00 00 00 00 00
0500: 00 00 00 00 00 00 00 00 00 00 00 00 00 00 00 00
0510: 00 00 00 00 00 00 00 00 00 00 00 00 00 00 00 00
0520: 00 00 00 00 00 00 00 00 00 00 00 00 00 00 00 00
0530: 00 00 00 00 00 00 00 00 00 00 00 00 00 00 00 00
0540: 00 00 00 00 00 00 00 00 00 00 00 00 00 00 00 00
0550: 00 00 00 00 00 00 00 00 00 00 00 00 00 00 00 00
0560: 00 00 00 00 00 00 00 00 00 00 00 00 00 00 00 00
0570: 00 00 00 00 00 00 00 00 00 00 00 00 00 00 00 00
0580: 00 00 00 00 00 00 00 00 00 00 00 00 00 00 00 00
0590: 00 00 00 00 00 00 00 00 00 00 00 00 00 00 00 00
05a0: 00 00 00 00 00 00 00 00 00 00 00 00 00 00 00 00
05b0: 00 00 00 00 00 00 00 00 00 00 00 00 00 00 00 00
05c0: 00 00 00 00 00 00 00 00 00 00 00 00 00 00 00 00
05d0: 00 00 00 00 00 00 00 00 00 00 00 00 00 00 00 00
05e0: 00 00 00 00 00 00 00 00 00 00 00 00 00 00 00 00
05f0: 00 00 00 00 00 00 00 00 00 00 00 00 00 00 00 00
0600: 00 00 00 00 00 00 00 00 00 00 00 00 00 00 00 00
0610: 00 00 00 00 00 00 00 00 00 00 00 00 00 00 00 00
0620: 00 00 00 00 00 00 00 00 00 00 00 00 00 00 00 00
0630: 00 00 00 00 00 00 00 00 00 00 00 00 00 00 00 00
0640: 00 00 00 00 00 00 00 00 00 00 00 00 00 00 00 00
0650: 00 00 00 00 00 00 00 00 00 00 00 00 00 00 00 00
0660: 00 00 00 00 00 00 00 00 00 00 00 00 00 00 00 00
0670: 00 00 00 00 00 00 00 00 00 00 00 00 00 00 00 00
0680: 00 00 00 00 00 00 00 00 00 00 00 00 00 00 00 00
0690: 00 00 00 00 00 00 00 00 00 00 00 00 00 00 00 00
06a0: 00 00 00 00 00 00 00 00 00 00 00 00 00 00 00 00
06b0: 00 00 00 00 00 00 00 00 00 00 00 00 00 00 00 00
06c0: 00 00 00 00 00 00 00 00 00 00 00 00 00 00 00 00
06d0: 00 00 00 00 00 00 00 00 00 00 00 00 00 00 00 00
06e0: 00 00 00 00 00 00 00 00 00 00 00 00 00 00 00 00
06f0: 00 00 00 00 00 00 00 00 00 00 00 00 00 00 00 00
0700: 00 00 00 00 00 00 00 00 00 00 00 00 00 00 00 00
0710: 00 00 00 00 00 00 00 00 00 00 00 00 00 00 00 00
0720: 00 00 00 00 00 00 00 00 00 00 00 00 00 00 00 00
0730: 00 00 00 00 00 00 00 00 00 00 00 00 00 00 00 00
0740: 00 00 00 00 00 00 00 00 00 00 00 00 00 00 00 00
0750: 00 00 00 00 00 00 00 00 00 00 00 00 00 00 00 00
0760: 00 00 00 00 00 00 00 00 00 00 00 00 00 00 00 00
0770: 00 00 00 00 00 00 00 00 00 00 00 00 00 00 00 00
0780: 00 00 00 00 00 00 00 00 00 00 00 00 00 00 00 00
0790: 00 00 00 00 00 00 00 00 00 00 00 00 00 00 00 00
07a0: 00 00 00 00 00 00 00 00 00 00 00 00 00 00 00 00
07b0: 00 00 00 00 00 00 00 00 00 00 00 00 00 00 00 00
07c0: 00 00 00 00 00 00 00 00 00 00 00 00 00 00 00 00
07d0: 00 00 00 00 00 00 00 00 00 00 00 00 00 00 00 00
07e0: 00 00 00 00 00 00 00 00 00 00 00 00 00 00 00 00
07f0: 00 00 00 00 00 00 00 00 00 00 00 00 00 00 00 00
0800: 00 00 00 00 00 00 00 00 00 00 00 00 00 00 00 00
0810: 00 00 00 00 00 00 00 00 00 00 00 00 00 00 00 00
0820: 00 00 00 00 00 00 00 00 00 00 00 00 00 00 00 00
0830: 00 00 00 00 00 00 00 00 00 00 00 00 00 00 00 00
0840: 00 00 00 00 00 00 00 00 00 00 00 00 00 00 00 00
0850: 00 00 00 00 00 00 00 00 00 00 00 00 00 00 00 00
0860: 00 00 00 00 00 00 00 00 00 00 00 00 00 00 00 00
0870: 00 00 00 00 00 00 00 00 00 00 00 00 00 00 00 00
0880: 00 00 00 00 00 00 00 00 00 00 00 00 00 00 00 00
0890: 00 00 00 00 00 00 00 00 00 00 00 00 00 00 00 00
08a0: 00 00 00 00 00 00 00 00 00 00 00 00 00 00 00 00
08b0: 00 00 00 00 00 00 00 00 00 00 00 00 00 00 00 00
08c0: 00 00 00 00 00 00 00 00 00 00 00 00 00 00 00 00
08d0: 00 00 00 00 00 00 00 00 00 00 00 00 00 00 00 00
08e0: 00 00 00 00 00 00 00 00 00 00 00 00 00 00 00 00
08f0: 00 00 00 00 00 00 00 00 00 00 00 00 00 00 00 00
0900: 00 00 00 00 00 00 00 00 00 00 00 00 00 00 00 00
0910: 00 00 00 00 00 00 00 00 00 00 00 00 00 00 00 00
0920: 00 00 00 00 00 00 00 00 00 00 00 00 00 00 00 00
0930: 00 00 00 00 00 00 00 00 00 00 00 00 00 00 00 00
0940: 00 00 00 00 00 00 00 00 00 00 00 00 00 00 00 00
0950: 00 00 00 00 00 00 00 00 00 00 00 00 00 00 00 00
0960: 00 00 00 00 00 00 00 00 00 00 00 00 00 00 00 00
0970: 00 00 00 00 00 00 00 00 00 00 00 00 00 00 00 00
0980: 00 00 00 00 00 00 00 00 00 00 00 00 00 00 00 00
0990: 00 00 00 00 00 00 00 00 00 00 00 00 00 00 00 00
09a0: 00 00 00 00 00 00 00 00 00 00 00 00 00 00 00 00
09b0: 00 00 00 00 00 00 00 00 00 00 00 00 00 00 00 00
09c0: 00 00 00 00 00 00 00 00 00 00 00 00 00 00 00 00
09d0: 00 00 00 00 00 00 00 00 00 00 00 00 00 00 00 00
09e0: 00 00 00 00 00 00 00 00 00 00 00 00 00 00 00 00
09f0: 00 00 00 00 00 00 00 00 00 00 00 00 00 00 00 00
0a00: cc 34 07 00 00 00 00 00 00 00 00 00 00 00 00 00
0a10: 00 00 00 00 00 00 00 00 00 00 00 00 00 00 00 00
0a20: 00 00 00 00 00 00 00 00 00 00 00 00 00 00 00 00
0a30: 00 00 00 00 00 00 00 00 00 00 00 00 00 00 00 00
0a40: 00 00 00 00 00 00 00 00 00 00 00 00 00 00 00 00
0a50: 00 00 00 00 00 00 00 00 00 00 00 00 00 00 00 00
0a60: 00 00 00 00 00 00 00 00 00 00 00 00 00 00 00 00
0a70: 00 00 00 00 00 00 00 00 00 00 00 00 00 00 00 00
0a80: 00 00 00 00 00 00 00 00 00 00 00 00 00 00 00 00
0a90: 00 00 00 00 00 00 00 00 00 00 00 00 00 00 00 00
0aa0: 00 00 00 00 00 00 00 00 00 00 00 00 00 00 00 00
0ab0: 00 00 00 00 00 00 00 00 00 00 00 00 00 00 00 00
0ac0: 00 00 00 00 00 00 00 00 00 00 00 00 00 00 00 00
0ad0: 00 00 00 00 00 00 00 00 00 00 00 00 00 00 00 00
0ae0: 00 00 00 00 00 00 00 00 00 00 00 00 00 00 00 00
0af0: 00 00 00 00 00 00 00 00 00 00 00 00 00 00 00 00
0b00: 00 00 00 00 00 00 00 00 00 00 00 00 00 00 00 00
0b10: 00 00 00 00 00 00 00 00 00 00 00 00 00 00 00 00
0b20: 00 00 00 00 00 00 00 00 00 00 00 00 00 00 00 00
0b30: 00 00 00 00 00 00 00 00 00 00 00 00 00 00 00 00
0b40: 00 00 00 00 00 00 00 00 00 00 00 00 00 00 00 00
0b50: 00 00 00 00 00 00 00 00 00 00 00 00 00 00 00 00
0b60: 00 00 00 00 00 00 00 00 00 00 00 00 00 00 00 00
0b70: 00 00 00 00 00 00 00 00 00 00 00 00 00 00 00 00
0b80: 00 00 00 00 00 00 00 00 00 00 00 00 00 00 00 00
0b90: 00 00 00 00 00 00 00 00 00 00 00 00 00 00 00 00
0ba0: 00 00 00 00 00 00 00 00 00 00 00 00 00 00 00 00
0bb0: 00 00 00 00 00 00 00 00 00 00 00 00 00 00 00 00
0bc0: 00 00 00 00 00 00 00 00 00 00 00 00 00 00 00 00
0bd0: 00 00 00 00 00 00 00 00 00 00 00 00 00 00 00 00
0be0: 00 00 00 00 00 00 00 00 00 00 00 00 00 00 00 00
0bf0: 00 00 00 00 00 00 00 00 00 00 00 00 00 00 00 00
0c00: 00 00 00 00 00 00 00 00 00 00 00 00 00 00 00 00
0c10: 00 00 00 00 00 00 00 00 00 00 00 00 00 00 00 00
0c20: 00 00 00 00 00 00 00 00 00 00 00 00 00 00 00 00
0c30: 00 00 00 00 00 00 00 00 00 00 00 00 00 00 00 00
0c40: 00 00 00 00 00 00 00 00 00 00 00 00 00 00 00 00
0c50: 00 00 00 00 00 00 00 00 00 00 00 00 00 00 00 00
0c60: 00 00 00 00 00 00 00 00 00 00 00 00 00 00 00 00
0c70: 00 00 00 00 00 00 00 00 00 00 00 00 00 00 00 00
0c80: 00 00 00 00 00 00 00 00 00 00 00 00 00 00 00 00
0c90: 00 00 00 00 00 00 00 00 00 00 00 00 00 00 00 00
0ca0: 00 00 00 00 00 00 00 00 00 00 00 00 00 00 00 00
0cb0: 00 00 00 00 00 00 00 00 00 00 00 00 00 00 00 00
0cc0: 00 00 00 00 00 00 00 00 00 00 00 00 00 00 00 00
0cd0: 00 00 00 00 00 00 00 00 00 00 00 00 00 00 00 00
0ce0: 00 00 00 00 00 00 00 00 00 00 00 00 00 00 00 00
0cf0: 00 00 00 00 00 00 00 00 00 00 00 00 00 00 00 00
0d00: 00 00 00 00 00 00 00 00 00 00 00 00 00 00 00 00
0d10: 00 00 00 00 00 00 00 00 00 00 00 00 00 00 00 00
0d20: 00 00 00 00 00 00 00 00 00 00 00 00 00 00 00 00
0d30: 00 00 00 00 00 00 00 00 00 00 00 00 00 00 00 00
0d40: 00 00 00 00 00 00 00 00 00 00 00 00 00 00 00 00
0d50: 00 00 00 00 00 00 00 00 00 00 00 00 00 00 00 00
0d60: 00 00 00 00 00 00 00 00 00 00 00 00 00 00 00 00
0d70: 00 00 00 00 00 00 00 00 00 00 00 00 00 00 00 00
0d80: 00 00 00 00 00 00 00 00 00 00 00 00 00 00 00 00
0d90: 00 00 00 00 00 00 00 00 00 00 00 00 00 00 00 00
0da0: 00 00 00 00 00 00 00 00 00 00 00 00 00 00 00 00
0db0: 00 00 00 00 00 00 00 00 00 00 00 00 00 00 00 00
0dc0: 00 00 00 00 00 00 00 00 00 00 00 00 00 00 00 00
0dd0: 00 00 00 00 00 00 00 00 00 00 00 00 00 00 00 00
0de0: 00 00 00 00 00 00 00 00 00 00 00 00 00 00 00 00
0df0: 00 00 00 00 00 00 00 00 00 00 00 00 00 00 00 00
0e00: 00 00 00 00 00 00 00 00 00 00 00 00 00 00 00 00
0e10: 00 00 00 00 00 00 00 00 00 00 00 00 00 00 00 00
0e20: 00 00 00 00 00 00 00 00 00 00 00 00 00 00 00 00
0e30: 00 00 00 00 00 00 00 00 00 00 00 00 00 00 00 00
0e40: 00 00 00 00 00 00 00 00 00 00 00 00 00 00 00 00
0e50: 00 00 00 00 00 00 00 00 00 00 00 00 00 00 00 00
0e60: 00 00 00 00 00 00 00 00 00 00 00 00 00 00 00 00
0e70: 00 00 00 00 00 00 00 00 00 00 00 00 00 00 00 00
0e80: 00 00 00 00 00 00 00 00 00 00 00 00 00 00 00 00
0e90: 00 00 00 00 00 00 00 00 00 00 00 00 00 00 00 00
0ea0: 00 00 00 00 00 00 00 00 00 00 00 00 00 00 00 00
0eb0: 00 00 00 00 00 00 00 00 00 00 00 00 00 00 00 00
0ec0: 00 00 00 00 00 00 00 00 00 00 00 00 00 00 00 00
0ed0: 00 00 00 00 00 00 00 00 00 00 00 00 00 00 00 00
0ee0: 00 00 00 00 00 00 00 00 00 00 00 00 00 00 00 00
0ef0: 00 00 00 00 00 00 00 00 00 00 00 00 00 00 00 00
0f00: 00 00 00 00 00 00 00 00 00 00 00 00 00 00 00 00
0f10: 00 00 00 00 00 00 00 00 00 00 00 00 00 00 00 00
0f20: 00 00 00 00 00 00 00 00 00 00 00 00 00 00 00 00
0f30: 00 00 00 00 00 00 00 00 00 00 00 00 00 00 00 00
0f40: 00 00 00 00 00 00 00 00 00 00 00 00 00 00 00 00
0f50: 00 00 00 00 00 00 00 00 00 00 00 00 00 00 00 00
0f60: 00 00 00 00 00 00 00 00 00 00 00 00 00 00 00 00
0f70: 00 00 00 00 00 00 00 00 00 00 00 00 00 00 00 00
0f80: 00 00 00 00 00 00 00 00 00 00 00 00 00 00 00 00
0f90: 00 00 00 00 00 00 00 00 00 00 00 00 00 00 00 00
0fa0: 00 00 00 00 00 00 00 00 00 00 00 00 00 00 00 00
0fb0: 00 00 00 00 00 00 00 00 00 00 00 00 00 00 00 00
0fc0: 00 00 00 00 00 00 00 00 00 00 00 00 00 00 00 00
0fd0: 00 00 00 00 00 00 00 00 00 00 00 00 00 00 00 00
0fe0: 00 00 00 00 00 00 00 00 00 00 00 00 00 00 00 00
0ff0: 00 00 00 00 00 00 00 00 00 00 00 00 00 00 00 00

PCIe 02:00.0 extended config space:
0000: 06 11 03 34 07 00 10 00 01 10 00 0c 10 00 00 00
0010: 04 00 a0 7f 00 00 00 00 01 20 00 00 00 00 00 00
0020: 00 00 00 00 00 00 00 00 00 00 00 00 86 80 01 20
0030: 00 00 00 00 50 00 00 00 00 00 00 00 ff 01 00 00
0040: 00 00 00 00 00 00 00 00 00 00 00 00 00 00 00 00
0050: 01 80 03 e4 00 00 00 00 00 00 00 00 00 00 00 00
0060: 00 00 00 00 02 00 00 00 00 00 00 00 00 00 00 00
0070: 00 00 00 00 00 00 00 00 00 00 00 00 00 00 00 00
0080: 05 98 80 01 00 00 00 00 00 00 00 00 00 00 00 00
0090: 00 00 00 00 00 00 00 00 10 00 01 00 00 80 28 00
00a0: 0f 20 19 00 11 4c 07 00 00 00 11 00 00 00 00 00
00b0: 00 00 00 00 00 00 00 00 00 00 00 00 00 00 00 00
00c0: 00 00 00 00 00 00 00 00 00 00 00 00 00 00 00 00
00d0: 00 00 00 00 00 00 00 00 00 00 00 00 00 00 00 00
00e0: 00 00 00 00 00 00 00 00 00 00 00 00 00 00 00 00
00f0: 00 00 00 00 00 00 00 00 00 00 00 00 00 00 00 00
0100: 01 00 01 13 00 00 00 00 00 00 00 00 30 20 06 00
0110: 00 20 00 00 00 20 00 00 b4 00 00 00 00 00 00 00
0120: 00 00 00 00 00 00 00 00 00 00 00 00 00 00 00 00
0130: 03 00 01 00 00 00 00 ff ff 63 40 00 00 00 00 00
0140: 00 00 00 00 00 00 00 00 00 00 00 00 00 00 00 00
0150: 00 00 00 00 00 00 00 00 00 00 00 00 00 00 00 00
0160: 00 00 00 00 00 00 00 00 00 00 00 00 00 00 00 00
0170: 00 00 00 00 00 00 00 00 00 00 00 00 00 00 00 00
0180: 00 00 00 00 00 00 00 00 00 00 00 00 00 00 00 00
0190: 00 00 00 00 00 00 00 00 00 00 00 00 00 00 00 00
01a0: 00 00 00 00 00 00 00 00 00 00 00 00 00 00 00 00
01b0: 00 00 00 00 00 00 00 00 00 00 00 00 00 00 00 00
01c0: 00 00 00 00 00 00 00 00 00 00 00 00 00 00 00 00
01d0: 00 00 00 00 00 00 00 00 00 00 00 00 00 00 00 00
01e0: 00 00 00 00 00 00 00 00 00 00 00 00 00 00 00 00
01f0: 00 00 00 00 00 00 00 00 00 00 00 00 00 00 00 00
0200: 00 00 00 00 00 00 00 00 00 00 00 00 00 00 00 00
0210: 00 00 00 00 00 00 00 00 00 00 00 00 00 00 00 00
0220: 00 00 00 00 00 00 00 00 00 00 00 00 00 00 00 00
0230: 00 00 00 00 00 00 00 00 00 00 00 00 00 00 00 00
0240: 00 00 00 00 00 00 00 00 00 00 00 00 00 00 00 00
0250: 00 00 00 00 00 00 00 00 00 00 00 00 00 00 00 00
0260: 00 00 00 00 00 00 00 00 00 00 00 00 00 00 00 00
0270: 00 00 00 00 00 00 00 00 00 00 00 00 00 00 00 00
0280: 00 00 00 00 00 00 00 00 00 00 00 00 00 00 00 00
0290: 00 00 00 00 00 00 00 00 00 00 00 00 00 00 00 00
02a0: 00 00 00 00 00 00 00 00 00 00 00 00 00 00 00 00
02b0: 00 00 00 00 00 00 00 00 00 00 00 00 00 00 00 00
02c0: 00 00 00 00 00 00 00 00 00 00 00 00 00 00 00 00
02d0: 00 00 00 00 00 00 00 00 00 00 00 00 00 00 00 00
02e0: 00 00 00 00 00 00 00 00 00 00 00 00 00 00 00 00
02f0: 00 00 00 00 00 00 00 00 00 00 00 00 00 00 00 00
0300: 00 00 00 00 00 00 00 00 00 00 00 00 00 00 00 00
0310: 00 00 00 00 00 00 00 00 00 00 00 00 00 00 00 00
0320: 00 00 00 00 00 00 00 00 00 00 00 00 00 00 00 00
0330: 00 00 00 00 00 00 00 00 00 00 00 00 00 00 00 00
0340: 00 00 00 00 00 00 00 00 00 00 00 00 00 00 00 00
0350: 00 00 00 00 00 00 00 00 00 00 00 00 00 00 00 00
0360: 00 00 00 00 00 00 00 00 00 00 00 00 00 00 00 00
0370: 00 00 00 00 00 00 00 00 00 00 00 00 00 00 00 00
0380: 00 00 00 00 00 00 00 00 00 00 00 00 00 00 00 00
0390: 00 00 00 00 00 00 00 00 00 00 00 00 00 00 00 00
03a0: 00 00 00 00 00 00 00 00 00 00 00 00 00 00 00 00
03b0: 00 00 00 00 00 00 00 00 00 00 00 00 00 00 00 00
03c0: 00 00 00 00 00 00 00 00 00 00 00 00 00 00 00 00
03d0: 00 00 00 00 00 00 00 00 00 00 00 00 00 00 00 00
03e0: 00 00 00 00 00 00 00 00 00 00 00 00 00 00 00 00
03f0: 00 00 00 00 00 00 00 00 00 00 00 00 00 00 00 00
0400: 00 00 00 00 00 00 00 00 00 00 00 00 00 00 00 00
0410: 00 00 00 00 00 00 00 00 00 00 00 00 00 00 00 00
0420: 00 00 00 00 00 00 00 00 00 00 00 00 00 00 00 00
0430: 00 00 00 00 00 00 00 00 00 00 00 00 00 00 00 00
0440: 00 00 00 00 00 00 00 00 00 00 00 00 00 00 00 00
0450: 00 00 00 00 00 00 00 00 00 00 00 00 00 00 00 00
0460: 00 00 00 00 00 00 00 00 00 00 00 00 00 00 00 00
0470: 00 00 00 00 00 00 00 00 00 00 00 00 00 00 00 00
0480: 00 00 00 00 00 00 00 00 00 00 00 00 00 00 00 00
0490: 00 00 00 00 00 00 00 00 00 00 00 00 00 00 00 00
04a0: 00 00 00 00 00 00 00 00 00 00 00 00 00 00 00 00
04b0: 00 00 00 00 00 00 00 00 00 00 00 00 00 00 00 00
04c0: 00 00 00 00 00 00 00 00 00 00 00 00 00 00 00 00
04d0: 00 00 00 00 00 00 00 00 00 00 00 00 00 00 00 00
04e0: 00 00 00 00 00 00 00 00 00 00 00 00 00 00 00 00
04f0: 00 00 00 00 00 00 00 00 00 00 00 00 00 00 00 00
0500: 00 00 00 00 00 00 00 00 00 00 00 00 00 00 00 00
0510: 00 00 00 00 00 00 00 00 00 00 00 00 00 00 00 00
0520: 00 00 00 00 00 00 00 00 00 00 00 00 00 00 00 00
0530: 00 00 00 00 00 00 00 00 00 00 00 00 00 00 00 00
0540: 00 00 00 00 00 00 00 00 00 00 00 00 00 00 00 00
0550: 00 00 00 00 00 00 00 00 00 00 00 00 00 00 00 00
0560: 00 00 00 00 00 00 00 00 00 00 00 00 00 00 00 00
0570: 00 00 00 00 00 00 00 00 00 00 00 00 00 00 00 00
0580: 00 00 00 00 00 00 00 00 00 00 00 00 00 00 00 00
0590: 00 00 00 00 00 00 00 00 00 00 00 00 00 00 00 00
05a0: 00 00 00 00 00 00 00 00 00 00 00 00 00 00 00 00
05b0: 00 00 00 00 00 00 00 00 00 00 00 00 00 00 00 00
05c0: 00 00 00 00 00 00 00 00 00 00 00 00 00 00 00 00
05d0: 00 00 00 00 00 00 00 00 00 00 00 00 00 00 00 00
05e0: 00 00 00 00 00 00 00 00 00 00 00 00 00 00 00 00
05f0: 00 00 00 00 00 00 00 00 00 00 00 00 00 00 00 00
0600: 00 00 00 00 00 00 00 00 00 00 00 00 00 00 00 00
0610: 00 00 00 00 00 00 00 00 00 00 00 00 00 00 00 00
0620: 00 00 00 00 00 00 00 00 00 00 00 00 00 00 00 00
0630: 00 00 00 00 00 00 00 00 00 00 00 00 00 00 00 00
0640: 00 00 00 00 00 00 00 00 00 00 00 00 00 00 00 00
0650: 00 00 00 00 00 00 00 00 00 00 00 00 00 00 00 00
0660: 00 00 00 00 00 00 00 00 00 00 00 00 00 00 00 00
0670: 00 00 00 00 00 00 00 00 00 00 00 00 00 00 00 00
0680: 00 00 00 00 00 00 00 00 00 00 00 00 00 00 00 00
0690: 00 00 00 00 00 00 00 00 00 00 00 00 00 00 00 00
06a0: 00 00 00 00 00 00 00 00 00 00 00 00 00 00 00 00
06b0: 00 00 00 00 00 00 00 00 00 00 00 00 00 00 00 00
06c0: 00 00 00 00 00 00 00 00 00 00 00 00 00 00 00 00
06d0: 00 00 00 00 00 00 00 00 00 00 00 00 00 00 00 00
06e0: 00 00 00 00 00 00 00 00 00 00 00 00 00 00 00 00
06f0: 00 00 00 00 00 00 00 00 00 00 00 00 00 00 00 00
0700: 00 00 00 00 00 00 00 00 00 00 00 00 00 00 00 00
0710: 00 00 00 00 00 00 00 00 00 00 00 00 00 00 00 00
0720: 00 00 00 00 00 00 00 00 00 00 00 00 00 00 00 00
0730: 00 00 00 00 00 00 00 00 00 00 00 00 00 00 00 00
0740: 00 00 00 00 00 00 00 00 00 00 00 00 00 00 00 00
0750: 00 00 00 00 00 00 00 00 00 00 00 00 00 00 00 00
0760: 00 00 00 00 00 00 00 00 00 00 00 00 00 00 00 00
0770: 00 00 00 00 00 00 00 00 00 00 00 00 00 00 00 00
0780: 00 00 00 00 00 00 00 00 00 00 00 00 00 00 00 00
0790: 00 00 00 00 00 00 00 00 00 00 00 00 00 00 00 00
07a0: 00 00 00 00 00 00 00 00 00 00 00 00 00 00 00 00
07b0: 00 00 00 00 00 00 00 00 00 00 00 00 00 00 00 00
07c0: 00 00 00 00 00 00 00 00 00 00 00 00 00 00 00 00
07d0: 00 00 00 00 00 00 00 00 00 00 00 00 00 00 00 00
07e0: 00 00 00 00 00 00 00 00 00 00 00 00 00 00 00 00
07f0: 00 00 00 00 00 00 00 00 00 00 00 00 00 00 00 00
0800: 00 00 00 00 00 00 00 00 00 00 00 00 00 00 00 00
0810: 00 00 00 00 00 00 00 00 00 00 00 00 00 00 00 00
0820: 00 00 00 00 00 00 00 00 00 00 00 00 00 00 00 00
0830: 00 00 00 00 00 00 00 00 00 00 00 00 00 00 00 00
0840: 00 00 00 00 00 00 00 00 00 00 00 00 00 00 00 00
0850: 00 00 00 00 00 00 00 00 00 00 00 00 00 00 00 00
0860: 00 00 00 00 00 00 00 00 00 00 00 00 00 00 00 00
0870: 00 00 00 00 00 00 00 00 00 00 00 00 00 00 00 00
0880: 00 00 00 00 00 00 00 00 00 00 00 00 00 00 00 00
0890: 00 00 00 00 00 00 00 00 00 00 00 00 00 00 00 00
08a0: 00 00 00 00 00 00 00 00 00 00 00 00 00 00 00 00
08b0: 00 00 00 00 00 00 00 00 00 00 00 00 00 00 00 00
08c0: 00 00 00 00 00 00 00 00 00 00 00 00 00 00 00 00
08d0: 00 00 00 00 00 00 00 00 00 00 00 00 00 00 00 00
08e0: 00 00 00 00 00 00 00 00 00 00 00 00 00 00 00 00
08f0: 00 00 00 00 00 00 00 00 00 00 00 00 00 00 00 00
0900: 00 00 00 00 00 00 00 00 00 00 00 00 00 00 00 00
0910: 00 00 00 00 00 00 00 00 00 00 00 00 00 00 00 00
0920: 00 00 00 00 00 00 00 00 00 00 00 00 00 00 00 00
0930: 00 00 00 00 00 00 00 00 00 00 00 00 00 00 00 00
0940: 00 00 00 00 00 00 00 00 00 00 00 00 00 00 00 00
0950: 00 00 00 00 00 00 00 00 00 00 00 00 00 00 00 00
0960: 00 00 00 00 00 00 00 00 00 00 00 00 00 00 00 00
0970: 00 00 00 00 00 00 00 00 00 00 00 00 00 00 00 00
0980: 00 00 00 00 00 00 00 00 00 00 00 00 00 00 00 00
0990: 00 00 00 00 00 00 00 00 00 00 00 00 00 00 00 00
09a0: 00 00 00 00 00 00 00 00 00 00 00 00 00 00 00 00
09b0: 00 00 00 00 00 00 00 00 00 00 00 00 00 00 00 00
09c0: 00 00 00 00 00 00 00 00 00 00 00 00 00 00 00 00
09d0: 00 00 00 00 00 00 00 00 00 00 00 00 00 00 00 00
09e0: 00 00 00 00 00 00 00 00 00 00 00 00 00 00 00 00
09f0: 00 00 00 00 00 00 00 00 00 00 00 00 00 00 00 00
0a00: 00 00 00 00 00 00 00 00 00 00 00 00 00 00 00 00
0a10: 00 00 00 00 00 00 00 00 00 00 00 00 00 00 00 00
0a20: 00 00 00 00 00 00 00 00 00 00 00 00 00 00 00 00
0a30: 00 00 00 00 00 00 00 00 00 00 00 00 00 00 00 00
0a40: 00 00 00 00 00 00 00 00 00 00 00 00 00 00 00 00
0a50: 00 00 00 00 00 00 00 00 00 00 00 00 00 00 00 00
0a60: 00 00 00 00 00 00 00 00 00 00 00 00 00 00 00 00
0a70: 00 00 00 00 00 00 00 00 00 00 00 00 00 00 00 00
0a80: 00 00 00 00 00 00 00 00 00 00 00 00 00 00 00 00
0a90: 00 00 00 00 00 00 00 00 00 00 00 00 00 00 00 00
0aa0: 00 00 00 00 00 00 00 00 00 00 00 00 00 00 00 00
0ab0: 00 00 00 00 00 00 00 00 00 00 00 00 00 00 00 00
0ac0: 00 00 00 00 00 00 00 00 00 00 00 00 00 00 00 00
0ad0: 00 00 00 00 00 00 00 00 00 00 00 00 00 00 00 00
0ae0: 00 00 00 00 00 00 00 00 00 00 00 00 00 00 00 00
0af0: 00 00 00 00 00 00 00 00 00 00 00 00 00 00 00 00
0b00: 00 00 00 00 00 00 00 00 00 00 00 00 00 00 00 00
0b10: 00 00 00 00 00 00 00 00 00 00 00 00 00 00 00 00
0b20: 00 00 00 00 00 00 00 00 00 00 00 00 00 00 00 00
0b30: 00 00 00 00 00 00 00 00 00 00 00 00 00 00 00 00
0b40: 00 00 00 00 00 00 00 00 00 00 00 00 00 00 00 00
0b50: 00 00 00 00 00 00 00 00 00 00 00 00 00 00 00 00
0b60: 00 00 00 00 00 00 00 00 00 00 00 00 00 00 00 00
0b70: 00 00 00 00 00 00 00 00 00 00 00 00 00 00 00 00
0b80: 00 00 00 00 00 00 00 00 00 00 00 00 00 00 00 00
0b90: 00 00 00 00 00 00 00 00 00 00 00 00 00 00 00 00
0ba0: 00 00 00 00 00 00 00 00 00 00 00 00 00 00 00 00
0bb0: 00 00 00 00 00 00 00 00 00 00 00 00 00 00 00 00
0bc0: 00 00 00 00 00 00 00 00 00 00 00 00 00 00 00 00
0bd0: 00 00 00 00 00 00 00 00 00 00 00 00 00 00 00 00
0be0: 00 00 00 00 00 00 00 00 00 00 00 00 00 00 00 00
0bf0: 00 00 00 00 00 00 00 00 00 00 00 00 00 00 00 00
0c00: 00 00 00 00 00 00 00 00 00 00 00 00 00 00 00 00
0c10: 00 00 00 00 00 00 00 00 00 00 00 00 00 00 00 00
0c20: 00 00 00 00 00 00 00 00 00 00 00 00 00 00 00 00
0c30: 00 00 00 00 00 00 00 00 00 00 00 00 00 00 00 00
0c40: 00 00 00 00 00 00 00 00 00 00 00 00 00 00 00 00
0c50: 00 00 00 00 00 00 00 00 00 00 00 00 00 00 00 00
0c60: 00 00 00 00 00 00 00 00 00 00 00 00 00 00 00 00
0c70: 00 00 00 00 00 00 00 00 00 00 00 00 00 00 00 00
0c80: 00 00 00 00 00 00 00 00 00 00 00 00 00 00 00 00
0c90: 00 00 00 00 00 00 00 00 00 00 00 00 00 00 00 00
0ca0: 00 00 00 00 00 00 00 00 00 00 00 00 00 00 00 00
0cb0: 00 00 00 00 00 00 00 00 00 00 00 00 00 00 00 00
0cc0: 00 00 00 00 00 00 00 00 00 00 00 00 00 00 00 00
0cd0: 00 00 00 00 00 00 00 00 00 00 00 00 00 00 00 00
0ce0: 00 00 00 00 00 00 00 00 00 00 00 00 00 00 00 00
0cf0: 00 00 00 00 00 00 00 00 00 00 00 00 00 00 00 00
0d00: 00 00 00 00 00 00 00 00 00 00 00 00 00 00 00 00
0d10: 00 00 00 00 00 00 00 00 00 00 00 00 00 00 00 00
0d20: 00 00 00 00 00 00 00 00 00 00 00 00 00 00 00 00
0d30: 00 00 00 00 00 00 00 00 00 00 00 00 00 00 00 00
0d40: 00 00 00 00 00 00 00 00 00 00 00 00 00 00 00 00
0d50: 00 00 00 00 00 00 00 00 00 00 00 00 00 00 00 00
0d60: 00 00 00 00 00 00 00 00 00 00 00 00 00 00 00 00
0d70: 00 00 00 00 00 00 00 00 00 00 00 00 00 00 00 00
0d80: 00 00 00 00 00 00 00 00 00 00 00 00 00 00 00 00
0d90: 00 00 00 00 00 00 00 00 00 00 00 00 00 00 00 00
0da0: 00 00 00 00 00 00 00 00 00 00 00 00 00 00 00 00
0db0: 00 00 00 00 00 00 00 00 00 00 00 00 00 00 00 00
0dc0: 00 00 00 00 00 00 00 00 00 00 00 00 00 00 00 00
0dd0: 00 00 00 00 00 00 00 00 00 00 00 00 00 00 00 00
0de0: 00 00 00 00 00 00 00 00 00 00 00 00 00 00 00 00
0df0: 00 00 00 00 00 00 00 00 00 00 00 00 00 00 00 00
0e00: 00 00 00 00 00 00 00 00 00 00 00 00 00 00 00 00
0e10: 00 00 00 00 00 00 00 00 00 00 00 00 00 00 00 00
0e20: 00 00 00 00 00 00 00 00 00 00 00 00 00 00 00 00
0e30: 00 00 00 00 00 00 00 00 00 00 00 00 00 00 00 00
0e40: 00 00 00 00 00 00 00 00 00 00 00 00 00 00 00 00
0e50: 00 00 00 00 00 00 00 00 00 00 00 00 00 00 00 00
0e60: 00 00 00 00 00 00 00 00 00 00 00 00 00 00 00 00
0e70: 00 00 00 00 00 00 00 00 00 00 00 00 00 00 00 00
0e80: 00 00 00 00 00 00 00 00 00 00 00 00 00 00 00 00
0e90: 00 00 00 00 00 00 00 00 00 00 00 00 00 00 00 00
0ea0: 00 00 00 00 00 00 00 00 00 00 00 00 00 00 00 00
0eb0: 00 00 00 00 00 00 00 00 00 00 00 00 00 00 00 00
0ec0: 00 00 00 00 00 00 00 00 00 00 00 00 00 00 00 00
0ed0: 00 00 00 00 00 00 00 00 00 00 00 00 00 00 00 00
0ee0: 00 00 00 00 00 00 00 00 00 00 00 00 00 00 00 00
0ef0: 00 00 00 00 00 00 00 00 00 00 00 00 00 00 00 00
0f00: 00 00 00 00 00 00 00 00 00 00 00 00 00 00 00 00
0f10: 00 00 00 00 00 00 00 00 00 00 00 00 00 00 00 00
0f20: 00 00 00 00 00 00 00 00 00 00 00 00 00 00 00 00
0f30: 00 00 00 00 00 00 00 00 00 00 00 00 00 00 00 00
0f40: 00 00 00 00 00 00 00 00 00 00 00 00 00 00 00 00
0f50: 00 00 00 00 00 00 00 00 00 00 00 00 00 00 00 00
0f60: 00 00 00 00 00 00 00 00 00 00 00 00 00 00 00 00
0f70: 00 00 00 00 00 00 00 00 00 00 00 00 00 00 00 00
0f80: 00 00 00 00 00 00 00 00 00 00 00 00 00 00 00 00
0f90: 00 00 00 00 00 00 00 00 00 00 00 00 00 00 00 00
0fa0: 00 00 00 00 00 00 00 00 00 00 00 00 00 00 00 00
0fb0: 00 00 00 00 00 00 00 00 00 00 00 00 00 00 00 00
0fc0: 00 00 00 00 00 00 00 00 00 00 00 00 00 00 00 00
0fd0: 00 00 00 00 00 00 00 00 00 00 00 00 00 00 00 00
0fe0: 00 00 00 00 00 00 00 00 00 00 00 00 00 00 00 00
0ff0: 00 00 00 00 00 00 00 00 00 00 00 00 00 00 00 00


Error: Dumping MSRs on this CPU (0x0306a0) is not (yet) supported.



============= AMBs ============


============= SPI / BIOS CNTL =============

BIOS_CNTL = 0x0009 (IO)

0x0001 = BIOSWE - write enable
0x0000 = BLE - lock enable
0x0002 = SPI Read configuration
0x0000 = TopSwapStatus
0x0000 = SMM BIOS Write Protect Disable
0x0000 = reserved

============= SPI Bar ==============

0x03ff0017 = BFPR - BIOS Flash primary region
0x0000e008 = HSFSTS - Hardware Sequencing Flash Status
0x00000000 = HSFCTL - Hardware Sequencing Flash Control
0x00000000 = FADDR - Flash Address
0x00000000 = Reserved
0x006f0002 = FDATA0
0x0000ffff = FRACC - Flash Region Access Permissions
0x00000000 = Flash Region 0
0x03ff0017 = Flash Region 1
0x00160003 = Flash Region 2
0x00020001 = Flash Region 3
0x00000fff = Flash Region 4
0x00000000 = FPR0 Flash Protected Range 0
0x00000000 = FPR0 Flash Protected Range 1
0x00000000 = FPR0 Flash Protected Range 2
0x00000000 = FPR0 Flash Protected Range 3
0x00000000 = FPR0 Flash Protected Range 4
0x00000080 = SSFSTS - Software Sequencing Flash Status
0x00005006 = PREOP - Prefix opcode Configuration
0x0000b32d = OPTYPE - Opcode Type Configuration
0x0bd89f2005030201 = OPMENU - Opcode Menu Configuration
0x00000000 = BBAR - BIOS Base Address Configuration
0x00001000 = FDOC - Flash Descriptor Observability Control
0x00000000 = Reserved
0x00000007 = AFC - Additional Flash Control
0x00802005 = LVSCC - Host Lower Vendor Specific Component Capabilities
0x00002005 = UVSCC - Host Upper Vendor Specific Component Capabilities
0x00000000 = FPB - Flash Partition Boundary

============= AHCI Registers ==============


============= AHCI Configuration Registers ==============


============= SATA Initialization Registers ==============


============= ABAR ==============

ABAR = 0x7fb25000 (MEM)

Generic Host Control Registers:
0x000: 0xff30ff05 (CAP)
0x004: 0x80000002 (GHC)
0x008: 0x00000000 (IS)
0x00c: 0x0000003f (PI)
0x010: 0x00010300 (VS)
0x014: 0x00000000 (CCC_CTL)
0x018: 0x00000000 (CCC_PORTS)
0x01c: 0x00000000 (EM_LOC)
0x020: 0x00000000 (EM_CTL)
0x024: 0x00000004 (CAP2)
0x028: 0x00000000 (BOHC)
0x0a0: 0x00000048 (Reserved)
0x0c0: 0x00311c02 (Reserved)
0x0c8: 0x0000003f (Reserved)

Port 0 Control Registers:
0x100: 0x322c0000 (PxCLB)
0x104: 0x00000000 (PxCLBU)
0x108: 0x322c0400 (PxFB)
0x10c: 0x00000000 (PxFBU)
0x110: 0x00000000 (PxIS)
0x114: 0x7840007f (PxIE)
0x118: 0x0000ee17 (PxCMD)
0x11c: 0x00000000 (Reserved)
0x120: 0x00000040 (PxTFD)
0x124: 0x00000101 (PxSIG)
0x128: 0x00000133 (PxSSTS)
0x12c: 0x00000300 (PxSCTL)
0x130: 0x00000000 (PxSERR)
0x134: 0x00000000 (PxSACT)
0x138: 0x00000000 (PxCI)
0x13c: 0x00000000 (PxSNTF)
0x140: 0x00000000 (PxFBS)
0x144: 0x00000000 (PxDEVSLP)
0x148: 0x00000000 (Reserved)

Port 1 Control Registers:
0x180: 0x322e0000 (PxCLB)
0x184: 0x00000000 (PxCLBU)
0x188: 0x322e0400 (PxFB)
0x18c: 0x00000000 (PxFBU)
0x190: 0x00000000 (PxIS)
0x194: 0x7840007f (PxIE)
0x198: 0x00006016 (PxCMD)
0x19c: 0x00000000 (Reserved)
0x1a0: 0x0000007f (PxTFD)
0x1a4: 0xffffffff (PxSIG)
0x1a8: 0x00000000 (PxSSTS)
0x1ac: 0x00000300 (PxSCTL)
0x1b0: 0x00000000 (PxSERR)
0x1b4: 0x00000000 (PxSACT)
0x1b8: 0x00000000 (PxCI)
0x1bc: 0x00000000 (PxSNTF)
0x1c0: 0x00000000 (PxFBS)
0x1c4: 0x00000000 (PxDEVSLP)
0x1c8: 0x00000000 (Reserved)

Port 2 Control Registers:
0x200: 0x32300000 (PxCLB)
0x204: 0x00000000 (PxCLBU)
0x208: 0x32300400 (PxFB)
0x20c: 0x00000000 (PxFBU)
0x210: 0x00000000 (PxIS)
0x214: 0x7840007f (PxIE)
0x218: 0x00006016 (PxCMD)
0x21c: 0x00000000 (Reserved)
0x220: 0x0000007f (PxTFD)
0x224: 0xffffffff (PxSIG)
0x228: 0x00000000 (PxSSTS)
0x22c: 0x00000300 (PxSCTL)
0x230: 0x00000000 (PxSERR)
0x234: 0x00000000 (PxSACT)
0x238: 0x00000000 (PxCI)
0x23c: 0x00000000 (PxSNTF)
0x240: 0x00000000 (PxFBS)
0x244: 0x00000000 (PxDEVSLP)
0x248: 0x00000000 (Reserved)

Port 3 Control Registers:
0x280: 0x32320000 (PxCLB)
0x284: 0x00000000 (PxCLBU)
0x288: 0x32320400 (PxFB)
0x28c: 0x00000000 (PxFBU)
0x290: 0x00000000 (PxIS)
0x294: 0x7840007f (PxIE)
0x298: 0x00006016 (PxCMD)
0x29c: 0x00000000 (Reserved)
0x2a0: 0x0000007f (PxTFD)
0x2a4: 0xffffffff (PxSIG)
0x2a8: 0x00000000 (PxSSTS)
0x2ac: 0x00000300 (PxSCTL)
0x2b0: 0x00000000 (PxSERR)
0x2b4: 0x00000000 (PxSACT)
0x2b8: 0x00000000 (PxCI)
0x2bc: 0x00000000 (PxSNTF)
0x2c0: 0x00000000 (PxFBS)
0x2c4: 0x00000000 (PxDEVSLP)
0x2c8: 0x00000000 (Reserved)

Port 4 Control Registers:
0x300: 0x32340000 (PxCLB)
0x304: 0x00000000 (PxCLBU)
0x308: 0x32340400 (PxFB)
0x30c: 0x00000000 (PxFBU)
0x310: 0x00000000 (PxIS)
0x314: 0x7840007f (PxIE)
0x318: 0x00006016 (PxCMD)
0x31c: 0x00000000 (Reserved)
0x320: 0x0000007f (PxTFD)
0x324: 0xffffffff (PxSIG)
0x328: 0x00000000 (PxSSTS)
0x32c: 0x00000300 (PxSCTL)
0x330: 0x00000000 (PxSERR)
0x334: 0x00000000 (PxSACT)
0x338: 0x00000000 (PxCI)
0x33c: 0x00000000 (PxSNTF)
0x340: 0x00005000 (PxFBS)
0x344: 0x00000000 (PxDEVSLP)
0x348: 0x00000000 (Reserved)

Port 5 Control Registers:
0x380: 0x32360000 (PxCLB)
0x384: 0x00000000 (PxCLBU)
0x388: 0x32360400 (PxFB)
0x38c: 0x00000000 (PxFBU)
0x390: 0x00000000 (PxIS)
0x394: 0x7840007f (PxIE)
0x398: 0x00006016 (PxCMD)
0x39c: 0x00000000 (Reserved)
0x3a0: 0x0000007f (PxTFD)
0x3a4: 0xffffffff (PxSIG)
0x3a8: 0x00000000 (PxSSTS)
0x3ac: 0x00000300 (PxSCTL)
0x3b0: 0x00000000 (PxSERR)
0x3b4: 0x00000000 (PxSACT)
0x3b8: 0x00000000 (PxCI)
0x3bc: 0x00000000 (PxSNTF)
0x3c0: 0x00005000 (PxFBS)
0x3c4: 0x00000000 (PxDEVSLP)
0x3c8: 0x00000000 (Reserved)

Other registers:

============= Dumping INTEL SGX status =============
Number of CPUs = 2
------------- CPU 0 ----------------
SGX supported             : NO
SGX enabled               : NO
Feature Control locked    : YES
------------- CPU 1 ----------------
SGX supported             : NO
SGX enabled               : NO
Feature Control locked    : YES
====================================================

============= Dumping INTEL TME status =============
TME supported : NO
====================================================

============= Dumping INTEL Key Locker status =============
Key Locker supported : NO
===========================================================
