superiotool r24.02-410-g86b145ad3e
Probing for ALi Super I/O at 0x3f0...
  Failed. Returned data: id=0xffff, rev=0xff
Probing for ALi Super I/O at 0x370...
  Failed. Returned data: id=0xffff, rev=0xff
Probing for Aspeed Super I/O at 0x2e...
  Failed. Returned data: scratch registers all read as 0xff
Probing for Aspeed Super I/O at 0x4e...
  Failed. Returned data: scratch registers all read as 0xff
Probing for Exar Super I/O at 0x2e...
  Failed. Returned data: vid=0xffff, id=0xffff
Probing for Exar Super I/O at 0x4e...
  Failed. Returned data: vid=0xffff, id=0xffff
Probing for Fintek Super I/O at 0x2e...
  Failed. Returned data: vid=0x4078, id=0x73b4
Probing for Fintek Super I/O at 0x4e...
  Failed. Returned data: vid=0xffff, id=0xffff
Probing for Fintek Super I/O at 0x2e...
  Failed. Returned data: vid=0xffff, id=0xffff
Probing for Fintek Super I/O at 0x4e...
  Failed. Returned data: vid=0xffff, id=0xffff
Probing for ITE Super I/O (init=standard) at 0x20e...
  Failed. Returned data: id=0xffff, rev=0xf
Probing for ITE Super I/O (init=it8502e) at 0x20e...
  Failed. Returned data: id=0xffff, rev=0xf
Probing for ITE Super I/O (init=it8761e) at 0x20e...
  Failed. Returned data: id=0xffff, rev=0xf
Probing for ITE Super I/O (init=it8228e) at 0x20e...
  Failed. Returned data: id=0xffff, rev=0xf
Probing for ITE Super I/O (init=it8987e) at 0x20e...
  Failed. Returned data: id=0xffff, rev=0xf
Probing for ITE Super I/O (init=0x87,0x87) at 0x20e...
  Failed. Returned data: id=0xffff, rev=0xf
Probing for ITE Super I/O (init=standard) at 0x25e...
  Failed. Returned data: id=0xffff, rev=0xf
Probing for ITE Super I/O (init=it8502e) at 0x25e...
  Failed. Returned data: id=0xffff, rev=0xf
Probing for ITE Super I/O (init=it8761e) at 0x25e...
  Failed. Returned data: id=0xffff, rev=0xf
Probing for ITE Super I/O (init=it8228e) at 0x25e...
  Failed. Returned data: id=0xffff, rev=0xf
Probing for ITE Super I/O (init=it8987e) at 0x25e...
  Failed. Returned data: id=0xffff, rev=0xf
Probing for ITE Super I/O (init=0x87,0x87) at 0x25e...
  Failed. Returned data: id=0xffff, rev=0xf
Probing for ITE Super I/O (init=standard) at 0x2e...
  Failed. Returned data: id=0xffff, rev=0xf
Probing for ITE Super I/O (init=it8502e) at 0x2e...
  Failed. Returned data: id=0xffff, rev=0xf
Probing for ITE Super I/O (init=it8761e) at 0x2e...
  Failed. Returned data: id=0xffff, rev=0xf
Probing for ITE Super I/O (init=it8228e) at 0x2e...
  Failed. Returned data: id=0xffff, rev=0xf
Probing for ITE Super I/O (init=it8987e) at 0x2e...
  Failed. Returned data: id=0xffff, rev=0xf
Probing for ITE Super I/O (init=0x87,0x87) at 0x2e...
  Failed. Returned data: id=0xb473, rev=0xf
Probing for ITE Super I/O (init=standard) at 0x4e...
  Failed. Returned data: id=0xffff, rev=0xf
Probing for ITE Super I/O (init=it8502e) at 0x4e...
  Failed. Returned data: id=0xffff, rev=0xf
Probing for ITE Super I/O (init=it8761e) at 0x4e...
  Failed. Returned data: id=0xffff, rev=0xf
Probing for ITE Super I/O (init=it8228e) at 0x4e...
  Failed. Returned data: id=0xffff, rev=0xf
Probing for ITE Super I/O (init=it8987e) at 0x4e...
  Failed. Returned data: id=0xffff, rev=0xf
Probing for ITE Super I/O (init=0x87,0x87) at 0x4e...
  Failed. Returned data: id=0xffff, rev=0xf
Probing for ITE Super I/O (init=legacy/it8661f) at 0x370...
  Failed. Returned data: id=0xffff, rev=0xf
Probing for ITE Super I/O (init=legacy/it8671f) at 0x370...
  Failed. Returned data: id=0xffff, rev=0xf
Probing for ITE Super I/O (init=standard) at 0x6e...
  Failed. Returned data: id=0xffff, rev=0xf
Probing for ITE Super I/O (init=it8502e) at 0x6e...
  Failed. Returned data: id=0xffff, rev=0xf
Probing for ITE Super I/O (init=it8761e) at 0x6e...
  Failed. Returned data: id=0xffff, rev=0xf
Probing for ITE Super I/O (init=it8228e) at 0x6e...
  Failed. Returned data: id=0xffff, rev=0xf
Probing for ITE Super I/O (init=it8987e) at 0x6e...
  Failed. Returned data: id=0xffff, rev=0xf
Probing for ITE Super I/O (init=0x87,0x87) at 0x6e...
  Failed. Returned data: id=0xffff, rev=0xf
Probing for NSC Super I/O at 0x2e...
  Failed. Returned data: port=0xff, port+1=0xff
Probing for NSC Super I/O at 0x4e...
  Failed. Returned data: port=0xff, port+1=0xff
Probing for NSC Super I/O at 0x15c...
  Failed. Returned data: port=0xff, port+1=0xff
Probing for NSC Super I/O at 0x164e...
  Failed. Returned data: port=0xff, port+1=0xff
Probing for Nuvoton Super I/O at 0x164e...
  Failed. Returned data: chip_id=0xffff
Probing for Nuvoton Super I/O (sid=0xfc) at 0x164e...
  Failed. Returned data: sid=0xff, id=0xffff, rev=0x00
Probing for Nuvoton Super I/O at 0x2e...
Found Nuvoton NCT6775F (B) / NCT5572D (B) (not all LDNs supported) (id=0xb473) at 0x2e
Register dump:
idx 20 21 22 23 24 25 26 27  28 29 2a 2b 2c 2d 2e 2f
val b4 73 ff 78 40 00 00 7d  00 00 58 77 fc 04 00 0d
def b4 73 ff 78 40 00 00 7d  00 00 58 77 fc 04 00 MM
LDN 0x00 (FDC)
idx 30 60 61 70 74 f0 f1 f2  f4 f5
val 02 03 f0 06 02 8e 00 ff  00 00
def 03 03 f0 06 02 8e 00 ff  00 00
LDN 0x01 (Parallel Port)
idx 30 60 61 70 74 f0
val 00 03 78 07 04 3f
def 01 03 78 07 04 3f
LDN 0x02 (UART A)
idx 30 60 61 70 f0
val 00 03 f8 04 00
def 01 03 f8 04 00
LDN 0x03 (UART B, IR)
idx 30 60 61 70 f0 f1
val 00 02 f8 03 00 00
def 01 02 f8 03 00 00
LDN 0x05 (Keyboard Controller)
idx 30 60 61 62 63 70 72 f0
val 00 00 00 00 00 00 00 83
def 00 00 00 00 00 00 00 83
LDN 0x06 (CIR)
idx 30 60 61 70
val 00 00 00 00
def 00 00 00 00
LDN 0x07 (GPIO6, GPIO7, GPIO8, GPIO9)
idx 30 e0 e1 e2 e3 e4 e5 e6  e7 e8 e9 ea eb ec ed ee  f4 f5 f6 f7 f8
val 00 ff ff ff ff ff ff ff  ff ff ff ff ff ff ff ff  ff ff ff ff ff
def 18 ff 00 00 00 ef 00 00  00 ff 00 00 00 00 00 00  ff 00 00 00 00
LDN 0x08 (WDT1, GPIO0, GPIO1)
idx 30 e0 e1 e2 e3 e4 f0 f1  f2 f3 f4 f5 f6 f7
val 00 ff ff ff ff ff ff ff  ff ff ff ff 00 ff
def 00 ff 00 00 00 00 ff 00  00 00 00 00 00 00
LDN 0x09 (GPIO2, GPIO3, GPIO4, GPIO5)
idx 30 e0 e1 e2 e3 e4 e5 e6  e7 e8 e9 ea eb ee f0 f1  f2 f4 f5 f6 f7 fe
val 00 ff ff ff ff ff ff ff  ff ff ff ff ff ff ff ff  ff ff ff ff ff ff
def 05 ff 00 00 00 ff 00 00  00 00 00 00 00 00 ff 00  00 ff 00 00 00 00
LDN 0x0a (ACPI)
idx 30 e0 e1 e2 e3 e4 e5 e6  e7 e8 e9 ea eb ed f2 f3  f4 f6 f7 fe
val 01 01 00 17 04 00 02 5c  00 01 00 00 9b 20 7c 00  00 00 20 00
def 00 01 00 00 00 00 02 1c  00 00 00 00 00 00 7c 00  00 00 20 00
LDN 0x0b (Hardware Monitor, Front Panel LED)
idx 30 60 61 62 63 70 f0 f1  f2 f3 f4 f5 f6 f7 f8 f9  fa fb fc fd fe
val 01 02 90 00 00 00 c1 00  00 00 04 10 00 87 47 00  00 00 00 00 00
def 00 00 00 00 00 00 c1 00  00 00 00 10 00 87 47 00  00 00 00 00 00
LDN 0x0c (PECI, SST)
idx e0 e1 e2 e3 e4 e5 e6 e7  e9 ee ef f1 f2 f3 fa
val 00 00 00 00 00 60 00 01  0f 47 5b 40 50 10 00
def 00 00 00 00 00 00 00 01  0f 47 5b 40 50 10 00
LDN 0x0d (VID, VIDDAC, BUSSEL)
idx e0 e1 e2 e3 e4 e5 e6 e7  eb ec ed ee ef f3 f4 f5  f6 f7 f8 f9
val 00 00 00 00 07 00 00 00  14 00 00 88 00 00 00 00  07 00 00 bf
def 00 00 00 00 07 00 00 00  14 01 00 88 00 00 00 00  07 00 00 00
LDN 0x0e (CIR WAKE-UP)
idx 30 60 61 70
val 00 00 00 00
def 00 00 00 00
LDN 0x0f (GPIO Push-Pull or Open-drain)
idx e0 e1 e2 e3 e4 e5 e6 e7  e8 e9 f0 f2 f3 f4 f8 fe
val ff ff f7 ff fb cb ff ff  ff ff 00 00 00 00 70 ff
def ff ff f7 ff fb cb ff ff  ff ff 00 00 00 00 70 ff
Bank 0:
    00 01 02 03 04 05 06 07 08 09 0a 0b 0c 0d 0e 0f 
00: 04 04 04 04 04 04 04 04 ff ff ff ff ff ff ff ff 
01: 04 ff 00 ff ff ff ff ff ff 17 00 00 1c ff 03 e7 
02: e7 e7 d1 d1 81 81 86 59 ff ff ff da 00 00 00 00 
03: 00 00 00 00 00 00 00 00 00 00 00 00 00 00 00 00 
04: 00 00 00 00 ff 00 3f 05 2d ff ff 00 18 95 00 a3 
05: a3 ff 00 ff ff ff 00 80 c1 c1 c1 ff 01 04 04 05 
06: 05 05 05 05 05 05 00 ff ff ff ff ff 00 f8 80 ff 
07: 00 00 00 00 00 1c 00 16 80 ff 00 1f ff 01 59 00 
08: 00 00 00 00 00 00 ff ff ff ff ff ff ff ff ff ff 
09: ff ff ff ff ff ff ff ff ff ff ff ff ff ff ff ff 
0a: ff ff ff ff ff ff ff ff ff ff ff ff ff ff ff ff 
0b: ff ff ff ff ff ff ff ff ff ff ff ff ff ff ff ff 
0c: ff ff ff ff ff ff ff ff ff ff ff ff ff ff ff ff 
0d: ff ff ff ff ff ff ff ff ff ff ff ff ff ff ff ff 
0e: ff ff ff ff ff ff ff ff ff ff ff ff ff ff ff ff 
0f: ff ff ff ff ff ff ff ff ff ff ff ff ff ff ff ff 
Bank 1:
    00 01 02 03 04 05 06 07 08 09 0a 0b 0c 0d 0e 0f 
00: 01 00 00 00 00 00 00 3c 00 ff ff ff ff ff ff ff 
01: ff ff ff ff ff ff ff ff ff ff ff ff ff ff ff ff 
02: 02 00 00 00 00 00 00 00 00 00 00 00 00 ff ff ff 
03: ff ff ff ff 00 64 00 00 00 41 41 41 00 00 ff ff 
04: ff ff ff ff 59 00 00 00 00 00 ff ff ff ff 01 01 
05: 1c 00 00 00 00 50 05 fe ff ff ff ff ff ff ff ff 
06: ff ff ff ff ff ff ff ff ff ff ff ff ff ff ff ff 
07: ff ff ff ff ff ff ff ff ff ff ff ff ff ff ff ff 
08: ff ff ff ff ff ff ff ff ff ff ff ff ff ff ff ff 
09: ff ff ff ff ff ff ff ff ff ff ff ff ff ff ff ff 
0a: ff ff ff ff ff ff ff ff ff ff ff ff ff ff ff ff 
0b: ff ff ff ff ff ff ff ff ff ff ff ff ff ff ff ff 
0c: ff ff ff ff ff ff ff ff ff ff ff ff ff ff ff ff 
0d: ff ff ff ff ff ff ff ff ff ff ff ff ff ff ff ff 
0e: ff ff ff ff ff ff ff ff ff ff ff ff ff ff ff ff 
0f: ff ff ff ff ff ff ff ff ff ff ff ff ff ff ff ff 
Bank 2:
    00 01 02 03 04 05 06 07 08 09 0a 0b 0c 0d 0e 0f 
00: 82 32 12 0a 0a 0a 0a 0a 0a 0a ff 01 ff ff ff ff 
01: ff ff ff ff ff ff ff ff ff ff ff ff ff ff ff ff 
02: ff ff ff ff 00 00 00 00 00 00 00 00 00 ff ff ff 
03: ff 00 ff ff 00 64 00 ff 00 41 41 00 00 00 ff ff 
04: 7f 7f 7f 00 1e 00 00 00 00 00 00 00 00 00 00 ff 
05: ff 80 00 4b 4b 4b 18 00 00 ff ff ff ff ff ff ff 
06: ff ff ff ff ff ff ff ff ff ff ff ff ff ff ff ff 
07: ff ff ff ff ff ff ff ff ff ff ff ff ff ff ff ff 
08: ff ff ff ff ff ff ff ff ff ff ff ff ff ff ff ff 
09: ff ff ff ff ff ff ff ff ff ff ff ff ff ff ff ff 
0a: ff ff ff ff ff ff ff ff ff ff ff ff ff ff ff ff 
0b: ff ff ff ff ff ff ff ff ff ff ff ff ff ff ff ff 
0c: ff ff ff ff ff ff ff ff ff ff ff ff ff ff ff ff 
0d: ff ff ff ff ff ff ff ff ff ff ff ff ff ff ff ff 
0e: ff ff ff ff ff ff ff ff ff ff ff ff ff ff ff ff 
0f: ff ff ff ff ff ff ff ff ff ff ff ff ff ff ff ff 
Bank 3:
    00 01 02 03 04 05 06 07 08 09 0a 0b 0c 0d 0e 0f 
00: 03 03 03 0a 0a 01 01 3c 02 ff ff 01 ff ff ff ff 
01: ff ff ff ff ff ff ff ff ff ff ff ff ff ff ff ff 
02: 02 00 00 00 00 00 00 00 00 00 00 00 00 ff ff ff 
03: ff 00 ff ff 00 64 00 ff 00 00 00 00 00 00 00 00 
04: ff ff ff 00 16 00 00 00 01 ff ff ff ff ff ff ff 
05: 02 06 02 02 00 04 00 02 02 02 00 e0 24 08 00 00 
06: 00 ff ff ff ff ff ff ff ff ff ff ff ff ff ff ff 
07: ff ff ff ff ff ff ff ff ff ff ff ff ff ff ff ff 
08: ff ff ff ff ff ff ff ff ff ff ff ff ff ff ff ff 
09: ff ff ff ff ff ff ff ff ff ff ff ff ff ff ff ff 
0a: ff ff ff ff ff ff ff ff ff ff ff ff ff ff ff ff 
0b: ff ff ff ff ff ff ff ff ff ff ff ff ff ff ff ff 
0c: ff ff ff ff ff ff ff ff ff ff ff ff ff ff ff ff 
0d: ff ff ff ff ff ff ff ff ff ff ff ff ff ff ff ff 
0e: ff ff ff ff ff ff ff ff ff ff ff ff ff ff ff ff 
0f: ff ff ff ff ff ff ff ff ff ff ff ff ff ff ff ff 
Bank 4:
    00 01 02 03 04 05 06 07 08 09 0a 0b 0c 0d 0e 0f 
00: 03 00 00 00 00 00 00 00 00 00 00 01 ff ff ff ff 
01: ff ff ff ff ff ff ff ff ff ff ff ff ff ff ff ff 
02: 02 00 00 00 00 00 00 00 00 00 00 00 00 00 00 00 
03: ff 00 ff ff 00 64 00 ff 00 41 00 00 00 00 00 00 
04: ff ff ff 00 16 00 00 00 00 00 00 00 00 00 00 ff 
05: 02 06 02 02 00 04 00 02 06 01 00 e0 24 08 00 00 
06: 00 00 00 00 00 00 00 ff ff ff ff ff ff ff ff ff 
07: ff ff ff ff ff ff ff ff ff ff ff ff ff ff ff ff 
08: ff ff ff ff ff ff ff ff ff ff ff ff ff ff ff ff 
09: ff ff ff ff ff ff ff ff ff ff ff ff ff ff ff ff 
0a: ff ff ff ff ff ff ff ff ff ff ff ff ff ff ff ff 
0b: ff ff ff ff ff ff ff ff ff ff ff ff ff ff ff ff 
0c: ff ff ff ff ff ff ff ff ff ff ff ff ff ff ff ff 
0d: ff ff ff ff ff ff ff ff ff ff ff ff ff ff ff ff 
0e: ff ff ff ff ff ff ff ff ff ff ff ff ff ff ff ff 
0f: ff ff ff ff ff ff ff ff ff ff ff ff ff ff ff ff 
Bank 5:
    00 01 02 03 04 05 06 07 08 09 0a 0b 0c 0d 0e 0f 
00: 00 00 00 00 00 00 00 00 00 00 00 00 00 00 00 00 
01: 00 00 00 00 00 00 ff ff ff ff ff ff ff ff ff ff 
02: ff ff ff ff ff ff ff ff ff ff ff ff ff ff ff ff 
03: ff ff ff ff ff ff ff ff ff ff ff ff ff ff ff ff 
04: ff ff ff ff ff ff ff ff ff ff ff ff ff ff ff ff 
05: d4 d0 00 ff ff 00 00 00 00 00 00 00 00 00 00 00 
06: ff ff ff ff ff ff ff ff ff ff ff ff ff ff ff ff 
07: ff ff ff ff ff ff ff ff ff ff ff ff ff ff ff ff 
08: ff ff ff ff ff ff ff ff ff ff ff ff ff ff ff ff 
09: ff ff ff ff ff ff ff ff ff ff ff ff ff ff ff ff 
0a: ff ff ff ff ff ff ff ff ff ff ff ff ff ff ff ff 
0b: ff ff ff ff ff ff ff ff ff ff ff ff ff ff ff ff 
0c: ff ff ff ff ff ff ff ff ff ff ff ff ff ff ff ff 
0d: ff ff ff ff ff ff ff ff ff ff ff ff ff ff ff ff 
0e: ff ff ff ff ff ff ff ff ff ff ff ff ff ff ff ff 
0f: ff ff ff ff ff ff ff ff ff ff ff ff ff ff ff ff 
Bank 6:
    00 01 02 03 04 05 06 07 08 09 0a 0b 0c 0d 0e 0f 
00: 00 00 00 00 00 00 00 00 00 00 00 00 00 00 00 ff 
01: ff 00 00 00 00 00 ff ff ff ff ff ff ff ff ff ff 
02: ff ff ff ff ff ff ff ff ff ff ff ff ff ff ff ff 
03: ff ff ff ff ff ff ff ff ff ff ff ff ff ff ff ff 
04: ff ff ff ff ff ff ff ff ff ff ff ff ff ff 05 ff 
05: d4 d0 00 ff 00 00 00 00 00 00 00 00 00 00 00 00 
06: ff ff ff ff ff ff ff ff ff ff ff ff ff ff ff ff 
07: ff ff ff ff ff ff ff ff ff ff ff ff ff ff ff ff 
08: ff ff ff ff ff ff ff ff ff ff ff ff ff ff ff ff 
09: ff ff ff ff ff ff ff ff ff ff ff ff ff ff ff ff 
0a: ff ff ff ff ff ff ff ff ff ff ff ff ff ff ff ff 
0b: ff ff ff ff ff ff ff ff ff ff ff ff ff ff ff ff 
0c: ff ff ff ff ff ff ff ff ff ff ff ff ff ff ff ff 
0d: ff ff ff ff ff ff ff ff ff ff ff ff ff ff ff ff 
0e: ff ff ff ff ff ff ff ff ff ff ff ff ff ff ff ff 
0f: ff ff ff ff ff ff ff ff ff ff ff ff ff ff ff ff 
Bank 10:
    00 01 02 03 04 05 06 07 08 09 0a 0b 0c 0d 0e 0f 
00: 48 48 48 48 48 48 48 48 00 00 00 00 00 01 01 00 
01: 00 00 00 00 00 00 00 00 00 00 00 00 00 00 00 00 
02: 00 f8 80 80 80 f8 80 80 80 80 80 f8 80 f8 80 80 
03: 80 f8 80 80 80 80 80 f8 80 f8 80 80 80 80 80 f8 
04: ff ff ff ff ff ff ff ff ff ff ff ff ff ff 0a ff 
05: 00 00 00 00 00 00 00 00 00 00 00 00 00 00 00 00 
06: 00 00 00 00 00 00 00 00 00 00 00 00 00 00 00 00 
07: 00 00 00 00 00 00 00 00 00 00 00 00 00 00 00 00 
08: ff ff ff ff ff ff ff ff ff ff ff ff ff ff ff ff 
09: ff ff ff ff ff ff ff ff ff ff ff ff ff ff ff ff 
0a: ff ff ff ff ff ff ff ff ff ff ff ff ff ff ff ff 
0b: ff ff ff ff ff ff ff ff ff ff ff ff ff ff ff ff 
0c: ff ff ff ff ff ff ff ff ff ff ff ff ff ff ff ff 
0d: ff ff ff ff ff ff ff ff ff ff ff ff ff ff ff ff 
0e: ff ff ff ff ff ff ff ff ff ff ff ff ff ff ff ff 
0f: ff ff ff ff ff ff ff ff ff ff ff ff ff ff ff ff 
Bank 12:
    00 01 02 03 04 05 06 07 08 09 0a 0b 0c 0d 0e 0f 
00: 00 00 00 00 00 00 00 00 00 00 00 00 00 00 00 00 
01: 00 00 00 00 00 00 00 00 00 00 00 00 00 00 00 00 
02: 00 00 00 00 00 00 00 00 00 00 00 00 00 00 00 00 
03: 00 00 00 00 00 00 00 00 00 00 00 00 00 00 00 00 
04: ff ff ff ff ff ff ff ff ff ff ff ff ff ff 0c ff 
05: 00 00 00 00 00 00 00 00 00 00 00 00 00 00 00 00 
06: 00 00 00 00 00 00 00 00 00 00 00 00 00 00 00 00 
07: 00 00 00 00 00 00 00 00 00 00 00 00 00 00 00 00 
08: ff ff ff ff ff ff ff ff ff ff ff ff ff ff ff ff 
09: ff ff ff ff ff ff ff ff ff ff ff ff ff ff ff ff 
0a: ff ff ff ff ff ff ff ff ff ff ff ff ff ff ff ff 
0b: ff ff ff ff ff ff ff ff ff ff ff ff ff ff ff ff 
0c: ff ff ff ff ff ff ff ff ff ff ff ff ff ff ff ff 
0d: ff ff ff ff ff ff ff ff ff ff ff ff ff ff ff ff 
0e: ff ff ff ff ff ff ff ff ff ff ff ff ff ff ff ff 
0f: ff ff ff ff ff ff ff ff ff ff ff ff ff ff ff ff 
Bank 13:
    00 01 02 03 04 05 06 07 08 09 0a 0b 0c 0d 0e 0f 
00: 00 00 00 00 00 00 00 00 00 00 00 00 00 00 00 00 
01: 00 00 00 00 00 00 00 00 00 00 00 00 00 00 00 00 
02: 00 00 00 00 00 00 00 00 00 00 00 00 00 00 00 00 
03: 00 00 00 00 00 00 00 00 00 00 00 00 00 00 00 00 
04: 00 ff ff ff ff ff ff ff ff ff ff ff ff ff 0c ff 
05: 00 00 00 00 00 00 00 00 00 00 00 00 00 00 00 00 
06: 00 00 00 00 00 00 00 00 00 00 00 00 00 00 00 00 
07: 00 00 00 00 00 00 00 00 00 00 00 00 00 00 00 00 
08: ff ff ff ff ff ff ff ff ff ff ff ff ff ff ff ff 
09: ff ff ff ff ff ff ff ff ff ff ff ff ff ff ff ff 
0a: ff ff ff ff ff ff ff ff ff ff ff ff ff ff ff ff 
0b: ff ff ff ff ff ff ff ff ff ff ff ff ff ff ff ff 
0c: ff ff ff ff ff ff ff ff ff ff ff ff ff ff ff ff 
0d: ff ff ff ff ff ff ff ff ff ff ff ff ff ff ff ff 
0e: ff ff ff ff ff ff ff ff ff ff ff ff ff ff ff ff 
0f: ff ff ff ff ff ff ff ff ff ff ff ff ff ff ff ff 
Probing for Nuvoton Super I/O at 0x4e...
  Failed. Returned data: chip_id=0xffff
Probing for Nuvoton Super I/O (sid=0xfc) at 0x4e...
  Failed. Returned data: sid=0xff, id=0xffff, rev=0x00
Probing for SMSC Super I/O (idregs=0x20/0x21) at 0x2e...
  Failed. Returned data: id=0xff, rev=0xff
Probing for SMSC Super I/O (idregs=0x0d/0x0e) at 0x2e...
  Failed. Returned data: id=0xff, rev=0xff
Probing for SMSC Super I/O (idregs=0x20/0x21) at 0x4e...
  Failed. Returned data: id=0xff, rev=0xff
Probing for SMSC Super I/O (idregs=0x0d/0x0e) at 0x4e...
  Failed. Returned data: id=0xff, rev=0xff
Probing for SMSC Super I/O (idregs=0x20/0x21) at 0x162e...
  Failed. Returned data: id=0xff, rev=0xff
Probing for SMSC Super I/O (idregs=0x0d/0x0e) at 0x162e...
  Failed. Returned data: id=0xff, rev=0xff
Probing for SMSC Super I/O (idregs=0x20/0x21) at 0x164e...
  Failed. Returned data: id=0xff, rev=0xff
Probing for SMSC Super I/O (idregs=0x0d/0x0e) at 0x164e...
  Failed. Returned data: id=0xff, rev=0xff
Probing for SMSC Super I/O (idregs=0x20/0x21) at 0x3f0...
  Failed. Returned data: id=0xff, rev=0xff
Probing for SMSC Super I/O (idregs=0x0d/0x0e) at 0x3f0...
  Failed. Returned data: id=0xff, rev=0xff
Probing for SMSC Super I/O (idregs=0x20/0x21) at 0x370...
  Failed. Returned data: id=0xff, rev=0xff
Probing for SMSC Super I/O (idregs=0x0d/0x0e) at 0x370...
  Failed. Returned data: id=0xff, rev=0xff
Probing for Winbond Super I/O (init=0x88) at 0x2e...
  Failed. Returned data: id/oldid=0xff/0x0f, rev=0xff
Probing for Winbond Super I/O (init=0x89) at 0x2e...
  Failed. Returned data: id/oldid=0xff/0x0f, rev=0xff
Probing for Winbond Super I/O (init=0x86,0x86) at 0x2e...
  Failed. Returned data: id/oldid=0xff/0x0f, rev=0xff
Probing for Winbond Super I/O (init=0x87,0x87) at 0x2e...
  Failed. Returned data: id/oldid=0xb4/0x0f, rev=0x73
Probing for Winbond Super I/O (init=0x88) at 0x4e...
  Failed. Returned data: id/oldid=0xff/0x0f, rev=0xff
Probing for Winbond Super I/O (init=0x89) at 0x4e...
  Failed. Returned data: id/oldid=0xff/0x0f, rev=0xff
Probing for Winbond Super I/O (init=0x86,0x86) at 0x4e...
  Failed. Returned data: id/oldid=0xff/0x0f, rev=0xff
Probing for Winbond Super I/O (init=0x87,0x87) at 0x4e...
  Failed. Returned data: id/oldid=0xff/0x0f, rev=0xff
Probing for Winbond Super I/O (init=0x88) at 0x3f0...
  Failed. Returned data: id/oldid=0xff/0x0f, rev=0xff
Probing for Winbond Super I/O (init=0x89) at 0x3f0...
  Failed. Returned data: id/oldid=0xff/0x0f, rev=0xff
Probing for Winbond Super I/O (init=0x86,0x86) at 0x3f0...
  Failed. Returned data: id/oldid=0xff/0x0f, rev=0xff
Probing for Winbond Super I/O (init=0x87,0x87) at 0x3f0...
  Failed. Returned data: id/oldid=0xff/0x0f, rev=0xff
Probing for Winbond Super I/O (init=0x88) at 0x370...
  Failed. Returned data: id/oldid=0xff/0x0f, rev=0xff
Probing for Winbond Super I/O (init=0x89) at 0x370...
  Failed. Returned data: id/oldid=0xff/0x0f, rev=0xff
Probing for Winbond Super I/O (init=0x86,0x86) at 0x370...
  Failed. Returned data: id/oldid=0xff/0x0f, rev=0xff
Probing for Winbond Super I/O (init=0x87,0x87) at 0x370...
  Failed. Returned data: id/oldid=0xff/0x0f, rev=0xff
Probing for Winbond Super I/O (init=0x88) at 0x250...
  Failed. Returned data: id/oldid=0xff/0x0f, rev=0xff
Probing for Winbond Super I/O (init=0x89) at 0x250...
  Failed. Returned data: id/oldid=0xff/0x0f, rev=0xff
Probing for Winbond Super I/O (init=0x86,0x86) at 0x250...
  Failed. Returned data: id/oldid=0xff/0x0f, rev=0xff
Probing for Winbond Super I/O (init=0x87,0x87) at 0x250...
  Failed. Returned data: id/oldid=0xff/0x0f, rev=0xff
Probing for VIA Super I/O (init=0x87,0x87) at 0x2e...
  Failed. Returned data: id=0xb4, rev=0x73
Probing for VIA Super I/O (init=0x87,0x87) at 0x4e...
  Failed. Returned data: id=0xff, rev=0xff
Probing for VIA Super I/O (init=vt82c686) at 0x3f0...
  PCI device 1106:0686 not found.
Probing for AMD EC Super I/O at 0xaa...
Probing for Server Engines Super I/O at 0x2e...
  Failed. Returned data: id=0xffff, rev=0xff
Probing for Infineon Super I/O at 0x2e...
  Failed. Returned data: id=0xff, rev=0xff
Probing for Infineon Super I/O at 0x4e...
  Failed. Returned data: id=0xff, rev=0xff
